URL,Title,Abstract,Introduction
https://arxiv.org/html/2411.09159v1,PIMCOMP: An End-to-End DNN Compiler for Processing-In-Memory Accelerators,"In the past decade, various processing-in-memory (PIM) accelerators based on various devices, micro-architectures, and interfaces have been proposed to accelerate deep neural networks (DNNs). How to deploy DNNs onto PIM-based accelerators is the key to explore PIM’s high performance and energy efficiency. The scale of DNN models, the diversity of PIM accelerators, and the complexity of deployment are far beyond the human deployment capability. Hence, an automatic deployment methodology is indispensable. In this work, we propose PIMCOMP, an end-to-end DNN compiler tailored for PIM accelerators, achieving efficient deployment of DNN models on PIM hardware. PIMCOMP can adapt to various PIM architectures by using an abstract configurable PIM accelerator template with a set of pseudo-instructions, which is a high-level abstraction of the hardware’s fundamental functionalities. Through a generic multi-level optimization framework, PIMCOMP realizes an end-to-end conversion from a high-level DNN description to pseudo-instructions, which can be further converted to specific hardware intrinsics/primitives. The compilation addresses two critical issues in PIM-accelerated inference from a system perspective: resource utilization and dataflow scheduling. PIMCOMP adopts a flexible unfolding format to reshape and partition convolutional layers, adopts a weight-layout guided computation-storage-mapping approach to enhance resource utilization, and balances the system’s computation, memory access, and communication characteristics. For dataflow scheduling, we design two scheduling algorithms with different inter-layer pipeline granularities to support varying application scenarios while ensuring high computational parallelism. Experiments demonstrate that PIMCOMP improves throughput, latency, and energy efficiency across various architectures. PIMCOMP is open-sourced at https://github.com/sunxt99/PIMCOMP-NN.","DEEP neural networks (DNNs), with their powerful feature extraction and classification abilities, can excellently perform various intelligent tasks. According to neural scaling laws, the size and data of neural network models are continuously increasing to achieve better performance. Researchers have proposed a series of special-purpose accelerators (e.g., [1, 2]) to accommodate the models and speed up the inference process to cope with the ever-expanding neural networks. However, these accelerators are facing the memory wall challenge [3] as they suffer from high-cost data movement between memory and processing elements and encounter obstacles in enhancing energy efficiency. Processing-in-memory (PIM) is expected to overcome the memory wall challenge as it binds data and computation, thereby circumventing the need for data movement. Among various PIM implementations, the resistive random-access memory (RRAM) has high density, low latency, and is easy to integrate with the CMOS technology [4], offering a broad application prospect. RRAM cells are usually integrated into a crossbar array, which can perform a matrix-vector multiplication (MVM) in O(1) time. The weights are programmed to be the conductances of the cells. The input activations are converted to voltages by digital-to-analog converters (DACs). According to the Kirchhoff’s law, the output currents reflect the product of the weights (a matrix) and the inputs (a vector). Since the crossbar array operates in the analog domain, peripheral circuits such as DACs and analog-to-digital converters (ADCs) are needed to convert the signals. Due to the high memory density, parallel in-situ computing properties, elimination of weight movement, and the crossbar array formed by PIM devices can potentially meet the storage and computation requirements of DNNs. Crossbar arrays can also be constructed with other devices, such as ferroelectric field-effect transistors, magnetic random-access memories, phase-change memories, and even volatile static random-access memories. Based on this principle, previous works (e.g., [5, 6, 7, 8, 9, 10]) have designed a series of crossbar array-based DNN accelerators. These accelerators contain thousands of or more crossbar arrays, which challenge the deployment of DNN models due to the vast hardware scale. In addition, DNN models with different sizes and topologies demand meticulous attention for resource utilization, data scheduling, and memory optimization during deployment. Due to the different micro-architectures of various accelerators, it is uneconomical and unrealistic to manually design the deployment schemes for each DNN model on each accelerator as in previous works [5, 6, 7, 8, 9, 10]. Therefore, a compiler that can adapt to various PIM architectures and automatically complete DNN model deployment is indispensable to improve the usability of PIM accelerators, which also helps build a PIM ecosystem [11]. To bridge DNN models and PIM accelerators, the compiler needs to be designed by considering the following aspects to make it universal, flexible, and efficient. • For hardware: various PIM-based DNN accelerators have emerged, and it is cumbersome to design a specific compiler for each accelerator. Therefore, the compiler needs to be built on a high-level hardware abstraction, which can be lowered to specific PIM architectures. In addition, the compiler needs to be flexible and configurable to facilitate users quickly deploying DNNs on PIM accelerators with different scales of hardware resources. • For software: the compiler should support a variety of DNN workloads. Besides, it should apply to different application scenarios, such as meeting low-latency or high-throughput requirements. Above all, the compiler should automatically complete the deployment, that is, transparently perform model reading, weight mapping, and output collecting without user intervention. • System-level optimization: the compiler needs to handle resource allocation and dataflow scheduling effectively to unleash the hardware potential. For resource allocation, the compiler should make full use of the PIM resources to boost performance while balancing computing, memory access, and communication. For dataflow scheduling, the compiler should rapidly generate instruction streams for different scenarios and optimize the system performance bottlenecks. In addition, the compiler ought to have a profiler that provides an effective evaluation to steer the iterative performance optimization. To address the challenges faced by PIM accelerators during DNN deployment, this paper proposes PIMCOMP, an end-to-end DNN compiler for PIM accelerators. A previous version of this work was published in [12], which provides an optimization scheme for resource allocation, task mapping, and pipeline dataflow through four stages: layer partitioning, weight replication, core mapping, and dataflow scheduling. The previous work offers a methodology that focuses on some deployment-specific issues, but falls short of meeting the compiler requirements stated above, as it lacks support for end-to-end compilation, integration of different compilation stages, and system-level optimizations. Nevertheless, the previous work lays out a design blueprint and algorithmic guidance for this work. In this paper, we first review and contrast the existing PIM compilers. Then, we present the overall architecture and implementation details of PIMCOMP. PIMCOMP is a practical compiler that builds on Ref. [12] and enhances hardware compatibility, software support, and holistic performance. The new contributions of this paper are summarized as follows. 1. We propose an end-to-end DNN compiler tailored for PIM accelerators, encompassing the frontend, optimizer, and backend, capable of inferring an entire DNN model. We design two pipelines to accommodate diverse application scenarios. We build a profiler to accomplish a comprehensive performance assessment for iterative compilation space optimizations. 2. We present a PIM accelerator abstraction adaptable to various academic accelerator designs. The accelerator abstraction comprises a hardware template with rich configurability, a set of pseudo-instructions fully abstracting the hardware’s fundamental functionalities, and user-specified hardware execution patterns. 3. We introduce three-stage optimizations to complete the deployment of DNNs on PIM accelerators. In the layer partitioning stage, we propose array groups as the basic programming unit and utilize a flexible unfolding format to meet various resource demands. In the layout-computation mapping stage, we propose a weight-layout guided computation-storage-mapping method, utilizing genetic algorithms to optimize weight replication and layout and adaptively allocating computational tasks. In the dataflow scheduling stage, we propose scheduling algorithms maintaining high parallelism tailored to two pipelines. 4. We evaluate PIMCOMP’s end-to-end deployment capability on three different architectures. The experimental results show that PIMCOMP achieves promising improvements in throughput, latency, and energy consumption compared with previous works."
https://arxiv.org/html/2411.08674v2,Reducing ADC Front-end Costs During Training of On-sensor Printed Multilayer Perceptrons,"Printed electronics technology offers a cost-effective and fully-customizable solution to computational needs beyond the capabilities of traditional silicon technologies, offering advantages such as on-demand manufacturing and conformal, low-cost hardware. However, the low-resolution fabrication of printed electronics, which results in large feature sizes, poses a challenge for integrating complex designs like those of machine learning (ML) classification systems. Current literature optimizes only the Multilayer Perceptron (MLP) circuit within the classification system, while the cost of analog-to-digital converters (ADCs) is overlooked. Printed applications frequently require on-sensor processing, yet while the digital classifier has been extensively optimized, the analog-to-digital interfacing, specifically the ADCs, dominates the total area and energy consumption. In this work, we target digital printed MLP classifiers and we propose the design of customized ADCs per MLP’s input which involves minimizing the distinct represented numbers for each input, simplifying thus the ADC’s circuitry. Incorporating this ADC optimization in the MLP training, enables eliminating ADC levels and the respective comparators, while still maintaining high classification accuracy. Our approach achieves 11.2x lower ADC area for less than 5% accuracy drop across varying MLPs.","Recently, there has been a growing trend fueled by the fourth industrial revolution and the Internet of Things to integrate intelligence into everyday items. Applications like wearables, fast-moving consumer goods, basic healthcare devices, and disposable sensors for pharmaceuticals have not yet, fully incorporate computing capabilities [1]. These products need computing technology that is ultra-low cost, thin, and conformal. Traditional lithography-based CMOS technologies can’t meet these requirements, limiting computing’s reach [2]. Printed electronics (PE) offer a promising solution with on-demand, ultra-low cost fabrication, ideal for short-lifetime, disposable products. PE uses various printing methods like jet, screen, or gravure printing [2]. These techniques are mask-less, portable, and additive, reducing manufacturing costs and production times [2]. The simplicity of additive manufacturing allow ultra low-cost, at sub-cent levels, electronic circuits. However, this low precision fabrication, results in higher device latency and lower integration density compared to silicon VLSI systems [2], making the design of more complex circuits a challenge in PE. Nevertheless, the target applications are viable in printed electronics due to their relaxed frequency and precision requirements [2]. We focus on Electrolyte-Gated FET (EGFET) technology, which has low supply voltage (\leq 1$\mathrm{V}$), making it suitable for battery-powered applications [1]. Figure 1: Area and Power Evaluation of the printed classification system in [3]. PE’s target applications require smart sensor processing, which starts with analog frontend to digitize analog sensor data using ADCs, followed by machine learning classifiers, such as Multilayer Perceptrons (MLPs) [2]. However the complexity of these classification system oppose a challenge to their realization in PE due to their large gate count. To mitigate this limitation, exploiting the high customization capabilities of the PE technology by bespoke implementations in which the hardware is tailored to a specific dataset and model were proposed [4]. In [3, 5, 6, 7], the authors combined the bespoke architecture alongside the well established Approximation Computing paradigm where a small, accuracy loss resulted in significant area and power gains of the MLP classifier. Nevertheless, all the previous works focused only on the reduction of the MLP classifier inside the overall classification system, neglecting the area and power consumption of the Analog-to-Digital Converts (ADCs). In Figure 1, an area and power analysis within the classification system is presented, by using the MLP in [3]. As shown in Figure1, since the MLP classifier is optimized using approximate bespoke mapping, the ADC ratio in the classification system consuming on average 58% area and 74% power of the entire classification system, making the ADCs the dominant source of area and power overhead in the classification system. Inspired by the fact that different sensor data have different distributions in a given range (e.g., 4bits), not all the representations are required and thus high accuracy can be achieved albeit discard them. Leveraging the above, in this work, we propose the design of bespoke pruned ADCs for each input with the minimum possible representations required saving thus hardware by removing the circuitry of the unused input representation. In more details, we use a Genetic Algorithm (GA) to explore which representations of the ADC can be pruned alongside a quantization-aware training (QAT) of the MLP. Further, our ADC-optimization is orthogonal to any other training approach. In the literature some ADC optimization have been proposed in other technologies rather than in printed electronics. In [8], a spike-based scheme avoids ADCs by a comparator-register architecture but both of these components are hardware expensive in printed electronics[4]. In [9], prune crossbars to eliminate ADCs in ReRAM architectures, which in our architectures is equivalent to feature reduction. Our approach goes further by optimizing the remaining ADCs. To the best of our knowledge, this is the first time that such a framework111https://github.com/floAfentaki/Approximation-Techniques-Targeting-Printed-MLPs is proposed for ADC-efficient printed MLP-based classification systems. Our experiments across various datasets showcase that our framework reduces both area and power of the required ADCs on average 11.2\times and 13.2\times respectively."
https://arxiv.org/html/2411.08353v1,Everything You Wanted to Know About Consumer Light Management in Smart Energy,"Consumer lighting plays a significant role in the development of smart cities and smart villages. With the advancement of (IoT) technology, smart lighting solutions have become more prevalent in residential areas as well. These solutions provide consumers with increased energy efficiency, added convenience, and improved security. On the other hand, the growing number of IoT devices has become a global concern due to the carbon footprint and carbon emissions associated with these devices. The overuse of batteries increases maintenance and cost to IoT devices and simultaneously possesses adverse environmental effects, ultimately exacerbating the pace of climate change. Therefore, in tandom with the principles of Industry 4.0, it has become crucial for manufacturing and research industries to prioritize sustainable measures adhering to smart energy as a prevention to the negative impacts. Consequently, it has undoubtedly garnered global interest from scientists, researchers, and industrialists to integrate state-of-the-art technologies in order to solve the current issues in consumer light management systems making it a complete sustainable, and smart solution for consumer lighting application. This manuscript provides a thorough investigation of various methods as well as techniques to design a state-of-the-art IoT-enabled consumer light management system. It critically reviews the existing works done in consumer light management systems, emphasizing the significant limitations and the need for sustainability. The top-down approach of developing sustainable computing frameworks for IoT-enabled consumer light management has been reviewed based on the multidisciplinary technologies involved and state-of-the-art works in the respective domains. Lastly, this article concludes by highlighting possible avenues for future research.","Smart city and Smart energy are interrelated concepts designed to enhance the efficiency and sustainability of urban areas. The idea of smart city represents the extensive integration of \acICT in the daily lives of human beings in urban areas [1]. Implementing these technologies aims to elevate the living standards of residents by optimizing the effectiveness of services and infrastructure associated with cities. Smart city also refers to a city that integrates the physical infrastructure, information technology infrastructure, social infrastructure, and business infrastructure through \acIoT to harness the collective intelligence of its community [2]. On the other hand, smart energy encompasses a much broader scope than conventional energy. It can be perceived as a model akin to the “Internet of Energy” that deals with smart power generation, smart energy management, smart energy storage, and smart energy consumption. Energy refers to the characteristics of an object or system that determine its capacity to perform work. It exists in multiple forms, including potential energy, kinetic energy, chemical energy, and thermal energy. It is worth highlighting that the wide range of energy sources includes solar, fossil fuels, electricity, vibration, biomass etc. The significance of smart energy in smart cities is fundamentally rooted in the rapid growth of smart cities and the subsequent exponential increase in energy supply demand. Smart cities are reported to improve energy efficiency, minimize electronic waste, and decrease carbon emissions through the use of smart energy. Moreover, all forms of traditional energy, clean energy, green energy, sustainable energy, and renewable energy, integrated with \acICT technology, constitute smart energy. Consequently, the integration of smart energy concept in various physical processess forms \acE-CPS in smart cities. \acE-CPS employs advanced sensors, communication networks, and control systems to enhance energy efficiency and minimize environmental effects. These systems can adeptly manage energy resources, forecast demand trends, and modify energy output appropriately by integrating real-time data and \acAI algorithms. Consumer lighting constitutes a crucial application in smart city and smart home frameworks. On the other hand, it is considered as one of the most energy-consuming applications, which accounts for 30% to 40% of the total energy demand of smart cities [1]. The global smart consumer lighting market is valued at roughly 16.25 billion USD, and it is anticipated to expand at a \acCAGR of 20%, potentially reaching over USD 83.81 billion by 2032 [3]. Undoubtedly, this rapid expansion is primarily driven by the rising need for energy efficient lighting solutions and the escalating trend towards smart homes and smart cities. Smart consumer light management systems serve an instrumental role in converting traditional consumer lighting systems to smart lighting systems. The integration of \acIoT, smart sensors, and robust control strategies for energy saving makes it a widely adopted solution. The number of features in smart consumer lighting continues to grow with the advancement in \acICT technology. Subsequently, energy consumption also increases with the number of features, leading to most state-of-the-art smart consumer light management systems being energy hungry, demanding average power in terms of hundreds of milli-watts [4]. Conversely, sustainability is an essential aspect that must be integrated on a larger scale to comply with Industry 5.0 [5]. Thus, it demands a focus on optimizing power consumption in order to feature smart consumer light management systems with energy autonomy using harvesters with small form factor. Consumer light management system helps in reducing energy consumption and increases total lighting efficiency via smart sensors and advanced data analytics techniques. It can automatically adjust lighting configurations according to various factors such as occupancy, ambient light, and weather conditions, aiding cities in minimizing their carbon emission and reducing energy expenses. It augments the safety and security of residents by ensuring adequately illuminated streets, public areas, and indoor environments. Moreover, the application has extensively improved both energy efficiency and quality of life in smart cities. The evolution of consumer lighting application over the past decades has been presented in Fig. 1. Figure 1: Evolution of Consumer Lighting Technology The remainder of this survey is structured into nine sections. Section 2 discusses the related prior work and contributions made in this manuscript. Section 3 elucidates smart consumer light management, its significance, and its attributes. Section 4 presents the need for sustainability and various elements of smart consumer light. Section 5 illustrates power management strategies in consumer lighting management systems. Section 6 delineates energy harvesting, power conditioning, and storage techniques. Section 7 presents the sustainable computing architectures for smart consumer light management systems. Task scheduling and energy optimization techniques of these systems have been detailed in Section 8. The open research directions have been highlighted in Section 9. The manuscript has been concluded in Section 10. An appendix containing a list of acronyms used is provided at the conclusion of the manuscript."
