URL,Title,Abstract,Introduction
https://arxiv.org/html/2411.10285v1,"Systolic Arrays and Structured Pruning Co-design 
for Efficient Transformers in Edge Systems","Efficient deployment of resource-intensive transformers on edge devices necessitates cross-stack optimization. We thus study the interrelation between structured pruning and systolic acceleration, matching the size of pruned blocks with the systolic array dimensions. In this setting, computations of pruned weight blocks can be skipped, reducing run-time and energy consumption, but potentially impacting quality of service (QoS). To evaluate the trade-offs between systolic array size and sparsity opportunities, we present a novel co-design framework that integrates algorithmic optimization, system simulation, and hardware design. Targeting speech recognition using transformers as case study, we analyze how configuration choices across the stack affect performance metrics. Results demonstrate that structured pruning on systems featuring systolic array acceleration can effectively increase performance, while maintaining high QoS levels. Up to 26% system-wide speedups due to structured pruning were measured, with only 1.4% word error rate degradation on the standard Librispeech dataset.","Transformers have fostered a revolution in machine learning, with applications ranging from classification [1] to generative models for text and images [2], to speech recognition [3]. However, their complex structure based on multiple attention and feed-forward layers [4] results in unprecedented computational requirements, posing significant challenges for their deployment. These are particularly acute in edge scenarios, where systems have to operate within constrained energy and performance envelopes. In this context, a plethora of optimization strategies have been proposed. On the software side [5], commonly used approaches involve reducing the precision of data representations (quantization) and removing parts that contribute the least to inference outcomes (pruning). As for hardware, efforts have mainly focused on the acceleration of the main computational kernel in transformers, i.e. General Matrix Multiplications (GEMMs). Although diverse solutions ranging from analog crossbars [6][7] to near-DRAM computing [8][9] work toward this goal, a particularly promising alternative is represented by systolic arrays [10]. These two-dimensional meshes of processing elements can indeed parallelize the computation of a GEMM (or, more precisely, the computation of a GEMM tile), while presenting a high parallelism degree, low resource requirements and only mandating a simple, low-overhead control logic. Recent works [11, 12, 13, 14, 15] have attempted to co-optimize software algorithms and hardware accelerators dedicated to transformer inference [16]. Such a stance is particularly appealing at the crossroads of model pruning and systolic array acceleration. On the software side, pruning can be performed by eliding weights in regular block patterns (in a “structured” way) rather than as individual elements [17]. While this approach introduces a constraint to pruning, and can hence result in lower overall sparsity rates, it substantially amplifies hardware-side optimization opportunities when matching the sizes of the pruned tile and the accelerator mesh. The exploration of this strategy, which we term Systolic Array Structured Pruning (SASP), is the focus of this work. SASP opens a complex multidimensional design space which requires careful consideration of metrics spanning from hardware to algorithms. Indeed, while a larger accelerator can expose a higher degree of parallelism, it also requires more resources (area / energy). Moreover, SASP settings with larger tiles may overly penalize the achievable sparsity for a desired Quality of Service (QoS) or, alternatively, result in high QoS degradation for a fixed pruning rate. To explore these interrelations, we employ a holistic approach integrating methods for a) the structured pruning of transformer algorithms, b) the system-level level modeling of accelerated systems executing them, and c) the hardware synthesis of accelerators. Our environment for SASP exploration builds on frameworks for the training of transformers (ESPnet [3]) and for system simulation (gem5 [18]). By employing a novel systolic array architectural template, it supports both floating point and weight-quantized data representations, as supported by ESPnet. As a test case, we employ our exploration approach to analyze a speech recognition application, based on an 24-block, 75M-parameter transformer processing the LibriSpeech dataset [19]. We observed that SASP can achieve, for a systolic array size of 32\times 32, up to 44% speedup and 42% energy savings over a non-pruned, non-quantized system when employing a 20% pruning rate, resulting in a marginal Word Error Rate (WER) degradation of 1.4%. The contributions of this paper are summarized as follows: • We introduce a methodology for the systematic exploration of Systolic Array Structured Pruning (SASP), a co-design strategy that combines systolic array acceleration and structured pruning with matching accelerator and tile size. • We show how the insights collected from our framework enable the evaluation of figures of merit at different abstraction levels, including the assessment of QoS, performance, resource usage, and energy, as well as their trade-offs. We discuss how these can be effectively leveraged from the joint perspective of algorithmic optimization, system integration, and systolic array design. • Using a speech recognition case study, we show that SASP-based co-optimization of transformers and systolic arrays can lead to efficiency and speedup gains of up to 26% with minimal QoS impact."
https://arxiv.org/html/2411.09760v1,SpecPCM: A Low-power PCM-based In-Memory Computing Accelerator for Full-stack Mass Spectrometry Analysis,"Mass spectrometry (MS) is essential for proteomics and metabolomics but faces impending challenges in efficiently processing the vast volumes of data. This paper introduces SpecPCM, an in-memory computing (IMC) accelerator designed to achieve substantial improvements in energy and delay efficiency for both MS spectral clustering and database (DB) search. SpecPCM employs analog processing with low-voltage swing and utilizes recently introduced phase change memory (PCM) devices based on superlattice materials, optimized for low-voltage and low-power programming. Our approach integrates contributions across multiple levels: application, algorithm, circuit, device, and instruction sets. We leverage a robust hyperdimensional computing (HD) algorithm with a novel dimension-packing method and develop specialized hardware for the end-to-end MS pipeline to overcome the non-ideal behavior of PCM devices. We further optimize multi-level PCM devices for different tasks by using different materials. We also perform a comprehensive design exploration to improve energy and delay efficiency while maintaining accuracy, exploring various combinations of hardware and software parameters controlled by the instruction set architecture (ISA). SpecPCM, with up to three bits per cell, achieves speedups of up to 82× and 143× for MS clustering and DB search tasks, respectively, along with a four-orders-of-magnitude improvement in energy efficiency compared with state-of-the-art CPU/GPU tools.","\IEEEPARstart Mass spectrometry (MS) is a key analytical tool used by proteomics and metabolomics, aiding in drug discovery and chemical analysis by identifying and quantifying molecules based on their mass-to-charge ratios[1]. Its high sensitivity and precision have made it one of the most widely used techniques for detecting even the smallest molecular variations. However, one of the key challenges in MS processing is handling the vast and continually growing data volumes. For example, the MassIVE database, a publicly accessible repository for proteomics MS data [2], now exceeds 600 TB (as of September 2024) and continues to grow at an accelerating pace, with hundreds of terabytes of new spectral data added annually. The MS analysis process involves comparing spectra generated from MS experiments against an extensive reference library to identify proteins, a procedure known as database (DB) search [3]. To accelerate the search process, spectral clustering is done by grouping similar reference spectra together. During search, the query is first compared to the cluster centroids, quickly focusing the search on an appropriate cluster and thereby speeding up the overall process [4]. Ideally, such a database should be clustered on a daily basis as new samples are continually added, but this is currently done only once per year due to the excessive time required, resulting in lower accuracy. Traditional systems with separate memory and processor units are hindered by limited data movement bandwidth and computing efficiency in processing such a sheer amount of data. Modern MS analysis tools [5, 6, 7], whether based on conventional CPU or GPU architectures, often spend more than 60% of their time on large matrix operations with significant memory footprint. These tools struggle to manage large datasets efficiently, mainly due to the high energy consumption and latency involved in data transfer. To overcome these challenges, in-memory computing (IMC) has emerged as an alternative paradigm that processes data directly within the memory where it is stored, substantially reducing the latency and energy overhead caused by data movement. To capitalize on this opportunity, various memory topologies have been explored, including DRAM, SRAM, RRAM, PCM, NAND Flash, and other emerging memory technologies [8]. While RRAM has been widely adopted [9, 10, 11] for its well-recognized high-density and efficient read operations, particularly due to its support for multi-level cells (MLC), it faces limitations, such as high energy consumption and high voltage requirements during write operations. This drawback will significantly degrade the energy efficiency of the clustering process, where frequent data updates are required to adapt to the newly collected MS data. While NAND flash memories provide superior memory density and fabrication maturity, they suffer from relatively high latency, e.g., several \mu s[12], due to the high resistance in the read-path, which is caused by the nature of reading data from serially connected cells. This work adopts a recently developed multi-level phase change memory (PCM) [13] based on superlattice materials, which features lower error rates, reduced voltage requirements, faster and more energy-efficient programming. In particular, we aim to explore the analog IMC, which offers dramatic efficiency improvements, achieving more than two orders of magnitude benefit [8] compared to conventional digital counterparts by utilizing low-voltage swing analog operations. Additionally, the analog IMC performs both reading and computation across the entire bitcell array simultaneously, enabling high parallelism and significant compute density improvement. Consequently, the analog IMC on PCM facilitates efficient processing for classification while also enabling the effective updating of stored weights to adapt to newly collected MS data. From an algorithmic perspective, we employ hyperdimensional computing (HD), a brain-inspired computing paradigm that leverages lightweight and highly parallel operations by encoding input features into high-dimensional (long) binary vectors. HD replaces costly and complex floating-point arithmetic with simpler binary or integer operations, which can be executed in parallel, leading to dramatic throughput improvements as demonstrated in [14, 15, 16]. Furthermore, HD’s data representation in hyperspace offers significant error resilience, with data points being well separated by large geometric distances. This property has been demonstrated in previous work [10], where HD tolerated up to a 10% bit error rate for MS DB search tasks. This resilience creates a strong synergy with analog IMC on emerging devices, helping to overcome their computing and storage non-idealities while achieving greater storage density and computing efficiency. The use of MLC PCM involves complex trade-offs between efficiency and accuracy, which require careful optimization across both hardware and algorithms. These interrelated challenges cannot be addressed at a single abstraction level. Therefore, we introduce SpecPCM, an IMC accelerator designed for the efficient processing of MS workloads. This framework integrates design efforts across the entire vertical stack, spanning application, algorithm, circuit, device, and instruction set levels, to enhance performance throughout the end-to-end MS pipeline. The detailed contributions of this work are summarized as follows: 1. We propose an analog IMC system with architecture and circuits specifically tailored for MS algorithms. While prior works have applied IMC to MS database (DB) search tasks in the HD domain, our work is the first to apply IMC for both clustering and DB search. 2. At the algorithm level, we introduce a new HD encoding method, called dimension packing, to maximize storage density by leveraging multi-level PCM devices while maintaining the simplicity of the binary representation of HD vectors. 3. At the device level, we propose customized PCM devices to meet the distinct requirements of clustering and MS DB search by optimizing the materials differently for each task, based on measured characterization results from the fabricated devices. 4. We conduct hardware-software co-design through a comprehensive analysis to balance trade-offs between latency, energy efficiency, and accuracy, taking into account various parameters such as bits per cell, write-verify cycles, analog-to-digital converter (ADC) precision, and HD dimensions, all controlled by the instruction set. The results indicate that the proposed SpecPCM demonstrates speedup of up to 82\times for clustering and 143\times for database search over state-of-the-art (SoA) solutions, with a four-orders-of-magnitude in energy efficiency improvement, while maintaining on-par accuracy across datasets of different scales."
https://arxiv.org/html/2411.10005v1,Analyzing Performance Characteristics of PostgreSQL and MariaDB on NVMeVirt,"The NVMeVirt paper analyzes the implication of storage performance on database engine performance to promote the tunable performance of NVMeVirt. They perform analysis on two very popular database engines, MariaDB and PostgreSQL. The result shows that MariaDB is more efficient when the storage is slow, but PostgreSQL outperforms MariaDB as I/O bandwidth increases. Although this verifies that NVMeVirt can support advanced storage bandwidth configurations, the paper does not provide a clear explanation of why two database engines react very differently to the storage performance.To understand why the above two database engines have different performance characteristics, we conduct a study of the database engine’s internals. We focus on three major differences in Multi-version concurrency control (MVCC) implementations: version storage, garbage collection, and index management. We also evaluated each scheme’s I/O overhead using OLTP workload. Our analysis identifies the reason why MariaDB outperforms PostgreSQL when the bandwidth is low.","The NVMeVirt is a versatile software-defined virtual NVMe device. Because the NVMeVirt supports advanced storage configurations, it can be used for database engine analysis and allows us to estimate the performance of database engines on future storage devices. In NVMeVirt paper (Kim et al., 2023), the authors conducted an evaluation on PostgreSQL (Group, 2023b) and MariaDB (Foundation, 2023) with OLTP workload using sysbench (Kopytov, 2023). They measured various performance metrics while running the benchmark. The result indicates that MariaDB and PostgreSQL react differently to the storage performance. MariaDB fully utilizes the I/O bandwidth up to 500 MiB/s. However, I/O bandwidth utilization remains around 600 MiB/s even when the storage device provides higher bandwidth. On the other hand, PostgreSQL fully utilizes the I/O bandwidth up to 1,000 MiB/s, and the performance is saturated at approximately 1,800 MiB/s. The I/O bandwidth affects both database engines’ performance, but PostgreSQL is much more sensitive than MariaDB. From the evaluation, the authors conclude that PostgreSQL is more promising on modern storage devices, whereas MariaDB is more efficient when the storage is low. The result verifies the tunable performance of NVMeVirt, but the problem is that the paper does not provide a clear explanation of what features of database engine internals make such differences. In this paper, we analyze the implication of storage performance on database engine performance focusing on database engine internals. We aim to provide a clear explanation of why PostgreSQL is more sensitive to I/O bandwidth than MariaDB. The contributions of this work are as follows: • We perform experiments for both OLTP and OLAP workloads and analyze the different performance characteristics (Section 2). • We analyze what differences in database engine internals make PostgreSQL more sensitive to I/O bandwidth compared to MariaDB (Section 3). • We evaluated different MVCC schemes using OLTP workloads (Section 4)."
https://arxiv.org/html/2411.09546v1,Architectural Exploration of Application-Specific Resonant SRAM Compute-in-Memory (rCiM),"While general-purpose computing follows Von Neumann’s architecture, the data movement between memory and processor elements dictates the processor’s performance. The evolving compute-in-memory (CiM) paradigm tackles this issue by facilitating simultaneous processing and storage within static random-access memory (SRAM) elements. Numerous design decisions taken at different levels of hierarchy affect the figure of merits (FoMs) of SRAM, such as power, performance, area, and yield. The absence of a rapid assessment mechanism for the impact of changes at different hierarchy levels on global FoMs poses a challenge to accurately evaluating innovative SRAM designs. This paper presents an automation tool designed to optimize the energy and latency of SRAM designs incorporating diverse implementation strategies for executing logic operations within the SRAM. The tool structure allows easy comparison across different array topologies and various design strategies to result in energy-efficient implementations. Our study involves a comprehensive comparison of over 6900+ distinct design implementation strategies for EPFL combinational benchmark circuits on the energy-recycling resonant compute-in-memory (rCiM) architecture designed using TSMC 28 nm technology. When provided with a combinational circuit, the tool aims to generate an energy-efficient implementation strategy tailored to the specified input memory and latency constraints. The tool reduces 80.9% of energy consumption on average across all benchmarks while using the six-topology implementation compared to baseline implementation of single-macro topology by considering the parallel processing capability of rCiM cache size ranging from 4KB to 192KB.","Cache memory remains one of the critical components in our computing system, enhancing overall performance by bridging the speed gap between the main memory (RAM) and the central processing unit (CPU). Besides, in recent years, static random access memory (SRAM)-based in-memory computing paved a promising direction to enable energy-efficient computation. However, the lack of design and automation tools to map computation on optimal SRAM architecture increases design time-to-market, resulting in higher engineering costs. This research resolves this issue by proposing an architectural exploration tool that efficiently maps logic computations to optimal cache architecture. Figure 1: (a) Conventional Von Neumann architecture, where an operation f is performed on data D within the CPU, incurs high data movement overhead, which can be reduced using (b) a CiM architecture, where f is computed directly within the memory, with the CPU primarily functioning as a control unit. Computing-in-memory (CiM) architectures have emerged as highly promising solutions for data-intensive applications. They minimize data movement, enhance computational capabilities, and improve the system’s overall energy efficiency by processing and storing data within cache memory. As shown in Figure 1 (a), the traditional Von Neumann architecture relies on data communication between the arithmetic logic unit (ALU) and cache memory through address and data buses. However, as the CPU performance is significantly higher than the memory performance, the Von Neumann architectures often create memory bottlenecks. CiM architectures, as shown in Figure 1 (b), mitigate the impact of large memory access latencies by performing the computations within the memory. By reducing data movement and exploiting parallelism within the memory, CiM architectures significantly enhance computational efficiency and performance. SRAM-based CiM architectures have been heavily investigated for performing various operations, such as matrix-vector multiplication (MVM) [1, 2], multiply-and-accumulate (MAC) operations [3, 4, 5, 6, 7, 8, 9, 10, 11, 12, 13, 14, 15, 16], boolean logic operations [17, 18, 19, 20, 21, 22, 23, 24, 25, 26, 27, 28, 29, 30], and content-addressable memory (CAM) [31, 32, 33, 34, 35, 36] operations for fast searching operations. However, none presents a generic energy-saving architecture that spans across various applications. This work utilizes a novel series-resonance-based resonant CiM (rCiM) architecture that reduces dynamic power consumption by recycling the wasted energy during writing operations. This work proposes an agile architectural exploration tool to map various logical operations to an optimal SRAM macro cache size. The primary objective of the tool is to facilitate the development of novel energy-efficient SRAM-based energy-recycling rCiM implementations individually designed for specific boolean logical applications. In particular, the main contributions of the paper are as follows: • A novel resonant Compute-in-Memory (rCiM) structure that incorporates a series inductor to recycle energy dissipated during write operations. • An architectural exploration toolflow that integrates open-source synthesis tools (Berkeley-ABC [37] & YOSYS [38]) to identify the optimal SRAM configuration within a specified range of SRAM cache memory and map efficient logical operations tailored to an optimal rCiM macro size. • Comprehensive analysis of 6900+ distinct logical design implementations for EPFL combinational benchmark circuits [39] using 12 different SRAM topologies."
