URL,Title,Abstract,Introduction
https://arxiv.org/html/2411.07091v1,"Impact of LLM-based Review Comment Generation in Practice:
A Mixed Open-/Closed-source User Study","Code review is a standard practice in modern software development, aiming to improve code quality and facilitate knowledge exchange among developers. As providing constructive reviews on a submitted patch is a challenging and error-prone task, the advances of Large Language Models (LLMs) in performing natural language processing (NLP) tasks in a human-like fashion have prompted researchers to evaluate the LLMs’ ability to automate the code review process. However, outside lab settings, it is still unclear how receptive reviewers are to accept comments generated by LLMs in a real development workflow. To fill this gap, we conduct a large-scale empirical user study in a live setup to evaluate the acceptance of LLM-generated comments and their impact on the review process. This user study was performed in two organizations, Mozilla (which has its codebase available as open-source) and Ubisoft (fully closed-source). Inside their usual review environment, participants were given access to RevMate, an LLM-based assistive tool suggesting generated review comments using an off-the-shelf LLM with Retrieval-Augmented Generation to provide extra code and review context, combined with LLM-as-a-Judge, to auto-evaluate the generated comments and discard irrelevant cases. Based on more than 587 patch reviews provided by RevMate, we observed that 8.1% and 7.2%, respectively, of LLM-generated comments were accepted by reviewers in each organization, while 14.6% and 20.5% other comments were still marked as valuable as review or development tips. Refactoring-related comments are more likely to be accepted than Functional comments (18.2% and 18.6% compared to 4.8% and 5.2%). The extra time spent by reviewers to inspect generated comments or edit accepted ones (36/119), yielding an overall median of 43s per patch, is reasonable. The accepted generated comments are as likely to yield future revisions of the revised patch as human-written comments (74% vs 73% at chunk-level).","Software code review is a core practice for modern software quality assurance [1, 2], widely adopted in industrial and open-source projects [3, 4]. While, initially, code review mostly was a synonym for code inspections on a submitted patch (structured as a set of chunks, i.e., successive lines of modified code) [5, 6], the field gradually adopted a more dynamic approach to performing reviews commonly known as modern code reviews [7], embracing social dimensions, like facilitating knowledge transfer between developers and strengthening synergy within teams [8]. Despite such benefits, code reviews can also bring additional costs, due to the delay between a patch submission and its final approval for integration by the reviewers caused by back-and-forth between its author and reviewers [9]. Additionally, providing valid and effective reviews requires non-trivial efforts from reviewers in terms of technical, social, and personal aspects [10]. Reviewers need to understand and rationalize the overall impact of the changes under analysis while using effective communication [11, 12, 13]. Reviewers, even when qualified and focused on a patch, might miss issues due to fatigue [14], distraction, or pressure from other deadlines [15]. To overcome these limitations, the research community has explored different approaches to generate review comments with LLM-based approaches such as T5, CodeT5 and ChatGPT[16, 17, 18]. However, thus far these have only been evaluated using textual metrics such as BLEU score and Exact Match, which are imperfect as they do not capture the actual impact and synergy the approach can have on reviewers [16]. Furthermore, it is unclear how reviewers receive LLM-generated comments in the long-term, i.e., apart from their relevance, to what extent do generated comments solicit follow-up comments by the patch author or lead to follow-up patch revisions? To fill in this gap, we conducted the first large-scale user study in a live setup involving two organizations, Mozilla and Ubisoft. Our choice for both an open-source (Mozilla) and closed-source (Ubisoft) organization is deliberate, since open-source codebases risk being part of the pretraining data of LLMs like GPT4o, yielding an unfair advantage in empirical studies. Hence, this study also aims at investigating whether open-source organizations actually benefit from this potential advantage compared to closed-source organizations. Spanning over 6 weeks, our user study involved 59 reviewers, covered 587 patch reviews, and led to the evaluation of 1.6k generated comments. During this study, we monitored the reviewers’ interactions with the generated comments, assessed the impact of these comments on the review flow, and finally conducted a survey of the participating reviewers to gain insight into their perspectives, filled by 37/59 participants. For this evaluation, we built RevMate, an LLM-based review assistant that generates review comments and that is easy to integrate into modern review environments. RevMate builds on GPT4o and uses both (i) Retrieval Augmented Generation (RAG) [19] to enclose relevant information and ground the model on the project under analysis, and (ii) LLM-as-a-Judge [20] to leverage LLMs’ capacity to evaluate generated content and discard irrelevant review comments. In particular, we exploit two different approaches for RevMate: RevMate with extra code context (Code): inspired by Zhou et al.’s approach for code generation [21], the model can request a code retrieval tool to provide function definitions and additional code lines from the codebase under analysis. RevMate with related comment examples (Example): like Parvez et al.’s approach for code summarization [22], for each patch, the model dynamically selects few-shot examples of review comments similar to its chunks, then provides them to the LLM. This paper addresses the following research questions: RQ1: How frequently do reviewers accept comments generated by an LLM-based approach? Based on the participants’ feedback in both organizations, we found that 8.1% and 7.2% of comments are accepted by Mozilla and Ubisoft reviewers, respectively, with 23% and 28.3% other comments still appreciated as being helpful. Despite the organizations differences in data availability, both the acceptance and appreciation ratios were consistent among them, indicating that the results may generalize across closed- and open-source development processes. Across both organizations, 23/37 participants reported they would continue using RevMate at least sometimes outside of the study context. RQ2: How does the comment category correlate with acceptance ratios? We found that, for Mozilla and Ubisoft respectively, 79.2% and 84.9% of generated comments are classified as functional issues, and 15.8% and 14.5% as refactoring-related comments. Furthermore, we found that refactoring-related comments have higher acceptance ratios than functional comments (18.2% and 18.6% compared to 4.8% and 5.2%). RQ3: How does the adoption of LLM-generated comments impact the code review workflow? We find that, although reviews take longer due to the extra time needed to evaluate the generated comments, the time spent per generated comment is reasonable (43s as a median per patch). This time is mostly spent on investigating the validity of the comment and on editing the comment when applicable, as 37/119 accepted comments were edited, with 25/37 cases being shortening the comment. RQ4: How does the adoption of LLM-generated comments impact the patch’s review process? This RQ assesses the extent to which accepted generated comments lead to changes in the codebase. We found that accepted review comments lead to as many patch revisions (i.e., changes in a future version of the patch) as human comments (74% vs 73% at chunk level) in Ubisoft, indicating that the generated comments have the same impact as human comments. Also, generated comments lead to fewer follow-up comments among developers (23% compared to 34%). The main contributions of this study are: • A large-scale mixed closed-/open-source user study, with 57 expert reviewers, assessing the usefulness of LLM-generated review comments and their impact on the review flow and outcome; • A diverse set of 3.4k generated code review comments by GPT4o for the Mozilla organization, among which 426 were evaluated by reviewers [23]; • An open source project implementing the comment review generation approach [24]."
https://arxiv.org/html/2411.07012v1,What Do Developers Discuss in Their Workplace? An Analysis of Workplace StackExchange Discussions,"Software workplaces are increasingly recognized as key spaces for professional development, where developers encounter various challenges in their roles, which they often discuss in online forums. This paper analyzes 47,368 posts on the Workplace StackExchange site, aggregating developer insights and applying topic modeling techniques. Through manual analysis, we identified 46 distinct topics grouped into seven categories: Employee Wellness, Communication, Career Movement & Hiring, Conflicts & Mistakes, Corporate Policies, Management/Supervisor Responsibilities, and Learning & Technical Skills. Our findings show that approximately 30% of discussions involve workplace conflicts, marking this as the most prominent topic. Additionally, we found that workplace culture, harassment, and other corporate policy-related issues represent significant areas of difficulty commonly discussed among developers.","The software industry has experienced unprecedented growth over the past few decades, driven by rapid technological advancements and an increasing reliance on digital solutions across all sectors. This expansion has resulted not only in a rise in the number of software companies but also in a transformation of software workplaces, compelling organizations to adapt to new workforce dynamics and operational models [1]. As software becomes central to nearly every industry, companies must support a workforce capable of keeping up with technological advancements. This has heightened challenges around skill development, employee well-being, and retention [2]. Additionally, as software companies grow and globalize, creating inclusive and culturally adaptable workplaces has become a priority. Companies increasingly recognize that diversity drives innovation and enhances problem-solving, leading to initiatives such as mentorship programs for women, flexible work policies, and equal opportunity efforts [3, 4]. Online software workplace discussions have become integral to how professionals in the software industry collaborate and share knowledge. As the software landscape evolves rapidly, these discussions facilitate continuous learning, problem-solving, and networking among developers, engineers, and other stakeholders. Moreover, online discussions play a crucial role in addressing workplace-related topics, such as team dynamics, conflict resolution, and career advancement strategies. Engaging in these discussions allows software professionals to better navigate workplace complexities and improve job satisfaction [5]. As organizations increasingly adopt remote work and flexible arrangements, online forums play a crucial role in maintaining collaboration and cohesion across distributed teams. Motivated by this, we conducted a large-scale analysis of developer online discussions on workplace-related issues. Specifically, we analyzed 47,368 posts on the Workplace StackExchange site, a question-and-answer platform dedicated to workplace and career topics. Workplace is a large online community where thousands of developers ask and answer questions on various issues, including job hunting, interviewing, salary negotiation, and professionalism in the workplace [6]. We aggregated developer discussions and applied topic modeling techniques. Workplace is part of the Stack Exchange network, a broad online community where millions of developers engage in Q&A discussions. In this study, we address the following four research questions: RQ1 What workplace topics are discussed on the Workplace Stack Exchange? We find that developers discuss a wide range of workplace-related topics. Their discussions on Stack Exchange’s Workplace encompass 46 different topics, including employment contracts, technical skills, team organization, work conflicts, workplace satisfaction, communication tips, and company policies. Our analysis reveals that work conflicts account for the highest number of posts, followed by resignation and job change. These topics belong to seven categories, Employee Wellness, Communication, Career Movement & Hiring, Conflicts & Mistakes, Corporate Policies, Management/Supervisor Responsibilities, and Learning & Technical Skills. RQ2 How do the topics evolve over time? We find that topics related to conflicts and mistakes, as well as career movement and hiring, have the highest number of posts and consistently maintain the highest levels of activity over the years compared to other categories. RQ3 How do the topics vary in terms popularity and difficulty? We observe that topics vary significantly in popularity. Work Conflicts is the most popular topic, with the highest number of views, while the technical topic Data Science is the least popular and also the most difficult, as its questions take the longest to receive an accepted answer. Work Culture and Harassment are also among the most difficult topics, whereas New Graduate Jobs and Languages are the least difficult. RQ4 How does user activity and gender distribution vary across The Workplace discussion community? Since Workplace is a community of users interested in discussing workplace-related issues, we aim to understand user characteristics. We found that the top 20% of users contribute to 17.2% of the total posts in the dataset. Additionally, we found that men significantly outnumber women, with about 14% of identified users being women and 86% being men. The remainder of this paper is organized as follows. The next section discusses related work. Section 3 covers the methodology and data collection. Section 4 presents the results related to the research questions. Section 5 discusses threats to validity. Section 6 concludes the paper."
https://arxiv.org/html/2411.06796v1,Automatically Write Code Checker: An LLM-based Approach with Logic-guided API Retrieval and Case by Case Iteration,"With the rising demand for code quality assurance, developers are not only utilizing existing static code checkers but also seeking custom checkers to satisfy their specific needs. Nowadays, various code-checking frameworks provide extensive checker customization interfaces to meet this need. However, both the abstract checking logic as well as the complex API usage of large-scale frameworks make this task challenging. To this end, automated code checker generation is anticipated to ease the burden of checker development. In this paper, we explore the feasibility of automated checker generation and propose AutoChecker, an innovative LLM-powered approach that can write code checkers automatically based on only a rule description and a test suite. Instead of generating the checker at once, AutoChecker incrementally updates the checker with the rule and one single test case each time, i.e., it iteratively generates the checker case by case. During each iteration, AutoChecker first decomposes the whole logic into a series of sub-operations and then uses the logic-guided API-context retrieval strategy to search related API-contexts from all the framework APIs. To evaluate the effectiveness of AutoChecker, we apply AutoChecker and two LLM-based baseline approaches to automatically generate checkers for 20 built-in PMD rules, including easy rules and hard rules. Experimental results demonstrate that AutoChecker significantly outperforms baseline approaches across all effectiveness metrics, where its average test pass rate improved over 4.2 times. Moreover, the checkers generated by AutoChecker are successfully applied to real-world projects, matching the performance of official checkers.","Static code-checking tools play a crucial role in ensuring code quality by automatically generating security reports based on a set of predefined rules. Ideally, users should be able to utilize any tool to meet their specific checking requirements (Distefano et al., 2019). To achieve this, many code-checking tools strive to develop extensible frameworks that allow users to scan code with their custom checkers. For example, PMD (PMD, 2024a) and SonarQube (Son, 2024) are well-designed to support secondary development, on which users can write custom checkers in Java code based on their checking rules; CodeQL (cod, 2024a) and other DSL-based tools (Xie et al., 2024) also encourage users’ customization, which ask users to “write queries to find vulnerabilities based on a powerful query language and share queries to help others do the same (cod, 2024b)”. However, due to the high complexity of existing checking frameworks (Brown et al., 2016) (e.g., the PMD’s framework excluding its pre-designed checkers exceeds 30 KLOC), the massive framework-specific API knowledge and incomplete API documents, as well as the non-trivial checking logic to be implemented, checker customization is still a time-consuming and challenging task. It bothers the users who are not familiar with specific code-checking frameworks but have urgent customization demands. Nowadays, the booming of Large language Models (LLMs) has stimulated the development of automatic code generation. Inspired by this, we aim to explore the auto-generation of checker code powered by LLMs to help users analyze software code more easily and flexibly. According to our investigation, existing code generation tasks can be categorized into the following two types. • Non-project-specific code generation, e.g., common code completion (Lu et al., 2022; Guo et al., 2023), common patch generation (Xia et al., 2023; Lin et al., 2024), common code generation for algorithmic questions (Zheng et al., 2023; Fan et al., 2023), etc. • Project-specific code generation, e.g., project-specific code completion (Zhang et al., 2023a; Agrawal et al., 2023; Cheng et al., 2024; Wu et al., 2024), code repair during project evolution (Liu et al., 2024; Prenner and Robbes, 2024), etc. Compared to non-project-specific one, project-specific code generation is an upgraded task, where the target code can access specific classes and methods defined in the project. Therefore, it requires project-specific knowledge (classes and methods defined in the projects) for correct generation. Otherwise, there may be unexpected hallucinations during code generation. Generally speaking, checker generation belongs to project-specific code generation. Each checker is defined and executed on the code checking framework, which is the project. However, it is much harder than previous studied tasks. Fig. 1 gives the overall pipeline of the manual checker development process. When the project manager has checker customization demands, they must provide a rule description to the developers, which is often unclear and not formalized. To clarify the rule, they should also provide a test suite to cover all possible scenarios (including corner cases). Based on this information, the developers will summarize the correct and comprehensive checking logic derived from the rule description and the test suite. Then, they will implement the logic to write the checker using framework APIs based on their knowledge of the framework. Unlike previous code generation tasks with clear guidance, the non-trivial checking logic and massive available framework APIs make it harder to correctly generate an expected checker. Figure 1. Pipeline of the Manual Checker Development According to the pipeline of manual checker development, we have to first cope with the following two main challenges that a developer may also encounter while writing new checkers. C1: Complex checking logic. Summarizing the comprehensive checking logic is crucial for checker generation. Both the rule description (for the rough goal) and the test suite (covering all scenarios) should be considered as input. However, complex checking logic may lead to excessive input information, including numerous test cases. On the one hand, it will overwhelm the LLM’s ability to generate the thorough logic considering all the scenarios. On the other hand, it may reach the LLM’s token limit. Therefore, complex checking logic is challenging to be summarized in one time. C2: Unclear framework API knowledge. When customizing code checkers, developers should have a strong understanding of the APIs available in their chosen checking framework. As one code-checking framework may contain thousands of APIs but only a few are required for one checker, automatic checker generation may lack the knowledge of which APIs can be invoked and how these APIs should be used, which will lead to hallucinations during generation. To address the above challenges, we propose a novel approach to automatically write static checkers based on iterative test-driven checker generation with logic-guided API-context retrieval and implement it as AutoChecker. First, to obtain the comprehensive checking logic covering complex scenarios, we iteratively generate and refine the checker, with each iteration guided by the given rule and a single selected test case (the initial and failed test case) from the test suite (C1). This approach is inspired by the manual checker development process shown in Fig. 1, where developers will validate the checker on the test suite and update it referring to the failed test cases iteratively until passing all the tests. During the evolving process, AutoChecker is able to cover the full test suite case by case and generates the comprehensive checking logic. Second, during each iteration for checker generation, AutoChecker adopts logic-guided API-context retrieval to extract task-oriented framework knowledge (definitions and usages of framework APIs) as references (C2). Specifically, AutoChecker decomposes the checking logic into discrete sub-operations and subsequently retrieves the corresponding API contexts for each individual sub-operation, which is performed on our constructed API-context Database, Meta-Op DB (semi-automatically) and Custom-API DB (automatically). With this logic-guided retrieval, AutoChecker is able to extract precise API-contexts for the checker generation. To evaluate the effectiveness of AutoChecker, we select 20 PMD rules, with an equal distribution of 10 easy and 10 hard rules. Experimental results show that AutoChecker outperforms baseline methods both on compilation and test pass rates. Specifically, the checkers generated by AutoChecker for all the rules can be successfully compiled and achieve average test pass rate at 82.28% (84.70% in easy rules and 79.86% in hard ones), which is 4.3 times higher than NoCaseLLM and 4.2 times higher than AllCasesLLM. Furthermore, we conducted a practicality evaluation by selecting AutoChecker-generated checkers that passed all tests and applying them to five large-scale real-world Java projects. The results indicate that AutoChecker can generate checkers that perform equivalently to the ground truth when sufficient test cases are provided. We make the following contributions in this paper: • We propose an automatic test-driven checker-generation approach, which uses an iterative generation pipeline to cope with the complex checking logic case by case. • We develop a logic-guided API-context retrieval strategy, and design a general Meta-Op set for better API retrieval, which contains 354 atomic checking operations. • We implement our approach into AutoChecker, which can automatically write custom code checkers based on the given rule and test suite. The experimental results show that the checkers generated by AutoChecker greatly outperform baseline approaches across all effectiveness metrics. Comparable to the official checkers, they also achieve expected results on large-scale real-world projects. Both the code and the dataset of AutoChecker are available at https://anonymous.4open.science/r/AutoChecker-EF16/."
