URL,Title,Abstract,Introduction
https://arxiv.org/html/2411.07480v2,Discovery of Timeline and Crowd Reaction of Software Vulnerability Disclosures,"Reusing third-party libraries increases productivity and saves time and costs for developers. However, the downside is the presence of vulnerabilities in those libraries, which can lead to catastrophic outcomes. For instance, Apache Log4J was found to be vulnerable to remote code execution attacks. A total of more than 35,000 packages were forced to update their Log4J libraries with the latest version. Although several studies have been conducted to predict software vulnerabilities, the prediction does not cover the vulnerabilities found in third-party libraries. Even if the developers are aware of the forthcoming issue, replicating a function similar to the libraries would be time-consuming and labour-intensive. Nevertheless, it is practically reasonable for software developers to update their third-party libraries (and dependencies) whenever the software vendors have released a vulnerable-free version. In this work, our manual study focuses on the real-world practices (crowd reaction) adopted by software vendors and developer communities when a vulnerability is disclosed. We manually investigated 312 CVEs and identified that the primary trend of vulnerability handling is to provide a fix before publishing an announcement. Otherwise, developers wait an average of 10 days for a fix if it is unavailable upon the announcement. Additionally, the crowd reaction is oblivious to the vulnerability severity. In particular, we identified Oracle as the most vibrant community diligent in releasing fixes. Their software developers also actively participate in the associated vulnerability announcements.","Modern software development often reuses third-party libraries to save time and costs incurred while developing from scratch. However, the presence of vulnerabilities (i.e., security flaws) could be catastrophic when the artifacts pose threats to their consumers. One way to assure software reliability is to refrain from vulnerabilities by keeping software library dependencies updated. However, a study showed that developers ceased to support and maintain dependency when a software development lifecycle ended [1], citing a lack of awareness of the new release. Another study [2] found that developers struggle with determining the most appropriate version when upgrading their dependencies. The number of vulnerabilities has been steadily increasing since 2017 [3]. This trend is particularly concerning because vulnerabilities in widely used software libraries can create ripple effects of security risks across numerous dependent applications. In November 2021, Apache Log4J was found to be vulnerable to remote code execution attacks, and more than 18,450 packages using the vulnerable version were affected [4]. Nevertheless, the first release of Apache’s fix did not fully address the vulnerability. As a result, 18,560 packages needed to be updated twice to finally use a fixed version of the dependency [5]. A total of more than 35,000 impacted packages are roughly equivalent to 8% of the total packages in the Maven ecosystem. Therefore, the magnitude of this impact is considered large as the average ecosystem impact of advisories affecting Maven Central is 2%, with a median of less than 0.1% [6]. Existing literature has contributed to predicting software vulnerabilities using text analysis [7, 8], trend analysis with topic models [9], and machine learning [10]. However, vulnerability databases often lack sufficient data to create robust prediction models [11, 12] that accurately reflect how vulnerabilities evolve throughout their real-world lifecycle. Li et al. [13] compiled a list of popular vulnerability databases that release official security policies and standards. However, these databases do not fully capture the real-world dynamics of vulnerabilities. Thus, we aim to address this gap by empirically investigating real-world vulnerability data to better understand the dynamics of how vulnerabilities evolve over time and how they are managed in practice. This study aims to uncover the lifecycle of vulnerability management. We manually examine the timeline and responses from software vendors and the developer community following the disclosure of software vulnerabilities, particularly in third-party libraries commonly used in software development. Vulnerabilities in these libraries can lead to security risks across dependent applications, making it essential to understand how these issues are identified, fixed, and disclosed. More specifically, our analysis focused on real-world responses to disclosed vulnerabilities and the time taken by software vendors to release fixes. We built a dataset containing 735 Java-related CVEs reported after 2017, and conducted a detailed study on a random sample of 312 CVEs. Data collection involved manual examination of CVE records, GitHub repositories, and reference links to construct a timeline of key events in each vulnerability’s lifecycle. Our study found that most vendors release fixes before publicly announcing vulnerabilities. We also observed that software vendors often upload their fixes across multiple platforms (but with time gaps), with different organizations adopting varying approaches to providing updates. For example, Oracle demonstrated consistent response times when releasing updates, while other vendors showed more variability. Additionally, the analysis revealed that community involvement was largely limited to identifying and reporting vulnerabilities, rather than offering solutions. However, this involvement can help speed up the CVE update process, as user-reported vulnerabilities tend to be resolved more quickly than those discovered solely by vendors. Vendors provided most fixes, and the time taken to resolve issues varied significantly. We compiled a set of actionable insights to enhance the role of the community and improve monitoring practices for vulnerability management. First, we find that vendors should encourage community involvement beyond just issue reporting. This can improve response times, as community members might contribute patches or mitigations that complement vendor fixes. Second, software developers can adopt a multi-source monitoring approach by regularly checking platforms like GitHub, mailing lists, and public advisories for updates. Given that some fixes are released on one platform ahead of others, this approach can help developers respond quickly to vulnerabilities, reducing potential risks in dependent applications. We highlight our contributions in this paper as follows: • We compile a comprehensive dataset that tracks software vulnerability response time, providing valuable insights for real-world practices. While previous datasets primarily analyze CVEs based on severity scores and other attributes, our dataset offers a comprehensive view of the entire vulnerability lifecycle, with a particular focus on Java vulnerabilities. This contribution enables further research in vulnerability management. • We conduct an exploratory manual examination of CVE records and reference links, the study reveals key trends, such as vendors predominantly releasing fixes before announcing vulnerabilities and the community’s role being largely limited to vulnerability identification rather than providing direct fixes. • We examine the relationship among various factors related to vulnerability and response handling, and we assist the developers in identifying the software library resident in the most responsive community. • We offer practical recommendations, including encouraging greater community involvement in vulnerability remediation and promoting multi-source monitoring practices, which can help developers and organizations respond more quickly to vulnerabilities and reduce security risks associated with third-party libraries. Paper organization. Section II introduces the background of the vulnerability lifecycle and the motivation of our study. Section III describes the manual study setup. Section IV presents the results. Sections VI and VII discuss threats to validity and related work. Section VIII concludes the paper."
https://arxiv.org/html/2411.07272v1,ASTD Patterns for Integrated Continuous Anomaly Detection In Data Logs,"This paper investigates the use of the ASTD language for ensemble anomaly detection in data logs. It uses a sliding window technique for continuous learning in data streams, coupled with updating learning models upon the completion of each window to maintain accurate detection and align with current data trends. It proposes ASTD patterns for combining learning models, especially in the context of unsupervised learning, which is commonly used for data streams. To facilitate this, a new ASTD operator is proposed, the Quantified Flow, which enables the seamless combination of learning models while ensuring that the specification remains concise. Our contribution is a specification pattern, highlighting the capacity of ASTDs to abstract and modularize anomaly detection systems. The ASTD language provides a unique approach to develop data flow anomaly detection systems, grounded in the combination of processes through the graphical representation of the language operators. This simplifies the design task for developers, who can focus primarily on defining the functional operations that constitute the system.","In today’s digital age, protecting IT infrastructure from cyberattacks and security breaches is critical for organizations to ensure daily operations, store sensitive data and manage customer information. Anomaly detection techniques can help organizations identify unusual patterns and behaviors in their systems so they can respond quickly and prevent potential security incidents. Anomaly detection techniques are instrumental in diverse areas, including fraud detection, network security, and intrusion detection within business applications [1]. Recognizing the pivotal role of anomaly detection systems in ensuring the security and reliability of various applications, from cybersecurity to industrial monitoring, it is crucial to acknowledge the challenges associated with their development [2]. Effectively addressing these challenges becomes imperative for successfully deploying robust and adaptive detection systems. In the realm of anomaly detection systems, a formidable challenge arises from the dynamic nature of data patterns. To maintain the system’s accuracy over time, periodic model re-training becomes imperative. Nils Baumann et al. [3] underscore the critical importance of automating the re-training process to adapt to evolving data patterns seamlessly. This challenge necessitates implementing robust mechanisms that detect anomalies and autonomously refine their understanding of normal and abnormal behaviors in the ever-changing data landscape. The intricacy of learning systems poses yet another significant challenge, encompassing multifaceted phases such as data pre-processing and model training. Benjamin Benni et al. [4] delve into a comprehensive analysis of this complexity, shedding light on the intricate processes that form the backbone of effective anomaly detection. Addressing this challenge requires the development of streamlined strategies to simplify the various phases, ensuring that the learning system can efficiently navigate the intricacies of data preprocessing and model training. Overcoming this hurdle is crucial for enhancing anomaly detection systems’ overall effectiveness and efficiency. As detection systems scale up to handle vast amounts of data, a distinct challenge emerges in maintaining modularity to ensure scalability and ease of maintenance. The development of large-scale detection systems demands a careful balance to prevent unwieldy complexity. Baldwin and Clark [5] stress the significance of modularity in such systems, emphasizing its pivotal role in facilitating scalability and simplifying maintenance efforts. Successfully addressing this challenge involves designing detection systems with modular architectures that can seamlessly adapt to the increasing demands of data volume and computational resources, ensuring both scalability and ease of long-term maintenance. This article introduces a method for developing anomaly detection systems using a specification language called Algebraic State Transition Diagram (ASTD) [6]. It investigates the extent to which this language reduces the complexity of the detection system by adding an abstraction layer. Additionally, it examines how the graphical representation of the language’s operators contributes to easing development efforts by managing the scheduling of various processes within the detection system. ASTD is a graphical and executable notation for composing state machines, offering modularity and flexibility in system development [7]. The paper’s contributions include (1) The extension of the ASTD language by the Quantified Flow operator to allow the combination of an arbitrary number of models while keeping the specification compact, and (2) The definition of an ASTD specification that represents a pattern on which to base the development of more complex systems; this specification has the following features: - Automated re-training of learning models, - Composition of a set of learning models to detect anomalies in data logs, - Combination of the decisions of each model for each event. The intent is to provide an illustrative example of specifications of anomaly detection systems that can be easily adapted for other contexts or learning methods. The paper is divided into six sections. In Section 2, we emphasize the importance of automating the renewal of the learning model in the context of dynamic data, the role of abstraction in reducing system complexity, and modularity, which facilitates maintenance and extension without introducing errors. Section 3 introduces the Quantified Flow operator as an extension of the ASTD language to easily combine an arbitrary number of learning models. In Section 4, we present a case study on the detection of unexpected events, implementing the following essential features for unsupervised anomaly detection: - Automation of retraining of learning models using the Sliding Window technique. - Model composition using the Quantified Flow operator. - Decision combination of models through Majority Voting. In section 5, we assess the performance of the specification in detecting unexpected events during a day of activity, while highlighting the effect of training data renewal and the combination of unsupervised models. Finally, in Sections 6 and 7, we summarize our findings and conclude."
https://arxiv.org/html/2411.07479v1,Developers Are Victims Too : A Comprehensive Analysis of The VS Code Extension Ecosystem,"With the wave of high-profile supply chain attacks targeting development and client organizations, supply chain security has recently become a focal point. As a result, there is an elevated discussion on securing the development environment and increasing the transparency of the third-party code that runs in software products to minimize any negative impact from third-party code in a software product. However, the literature on secure software development lacks insight into how the third-party development tools used by every developer affect the security posture of the developer, the development organization, and, eventually, the end product. To that end, we have analyzed 52,880 third-party VS Code extensions to understand their threat to the developer, the code, and the development organizations. We found that 5.6% of the analyzed extensions have suspicious behavior, jeopardizing the integrity of the development environment and potentially leaking sensitive information on the developer’s product. We also found that the VS Code hosting the third-party extensions lacks practical security controls and lets untrusted third-party code run unchecked and with questionable capabilities. We offer recommendations on possible avenues for fixing some of the issues uncovered during the analysis.","Accepting the Turing Award in 1984, Thompson projected that reliance on third-party software components involves a significant amount of trust [1]. Despite this warning and subsequent research and incidents stemming from supply chain issues [2, 3, 4, 5, 6, 7], developers’ and organizations’ reliance on third-party components continues to increase. At the same time, these components create security risks through undocumented functionality and settings, bugs, or malicious code. Supply chain attacks have emerged as a pervasive and ubiquitous threat vector in recent years [8, 9, 10]. The main reason why these types of attacks can be catastrophic is due to the nature of their coverage: numerous systems and software products may be vulnerable, often without users’, administrators’, or organizations’ knowledge, as most software products do not enumerate their constituent third-party components. Mounting an attack on several hundred organizations would otherwise be daunting; however, if the attacker can compromise one of the tools or systems used by all those organizations, then the economics suddenly shift heavily to the attacker. This has become quite apparent in the wake of several high-profile attacks [2, 6, 11]. The sheer scale of these attacks is unprecedented. However, the security community has been aware of these risks for almost 40 years. Standards, like the Software Bill of Materials (SBoM), increase transparency and awareness of the third-party code that may be executed in an organizational environment. A few of the current literature on supply chain security includes securing CI/CD [12, 13] or securing update channels [14] focusing on securing the product even before it ships out of the development organization. Security literature has looked into how developers write secure code [15] or how they look for security advice [16], which is essential in securing the whole ecosystem. However, the recent high-profile attacks on a development organization emphasize the importance of securing the roots of the supply chain: the developer [17]. While SBoM helps to articulate the composition of the software code consisting of third-party software libraries, there has been an oversight on one aspect of the development activity that involves third-party code: developer tools. Developers use tools for a wide range of activities that have a direct impact on the final software code. There is already documented evidence [18, 19] of malicious developer tools that could jeopardize the integrity of the development environment, which will lead to catastrophic events such as recent attacks [17]. However, security and privacy literature lacks systematic knowledge of how third-party developer tools behave in the wild and their impact on the security posture of the developer, the organization, and the end product. To that end, we analyzed 52,880 third-party VS Code extensions using static and dynamic analysis methods. We used static analysis to examine the code and narrow the extension list with suspicious code segments. We then executed those selected extensions using an instrumented VS Code environment, logging all their execution aspects. We also used VirusTotal [20], Retire.js [21] to scan for malicious content and known vulnerabilities. With this holistic analysis approach, we found that 5.6% 111https://github.com/vulnerability-reporter/DAV2-ACAnTVSCEE of our collected extension set has suspicious behavior that could jeopardize the integrity of the development environment and/or leak sensitive information such as code and personally identifiable information. We contribute the following: • Systematically show that the third-party developer tools pose a serious security threat to the developer, the host computer, and the organization. • VS Code, one of the most popular developer tools, has a lax security architecture that lets third-party extensions run unchecked, resulting in serious security lapses. • To the best of our knowledge, the paper presents the first holistic (52, 880) analysis of developer tools and their security and privacy implications."
