URL,Title,Abstract,Introduction
https://arxiv.org/html/2411.10384v1,Comparing Bills of Materials,"Lucas This document is a model and instructions for LaTeX. This and the IEEEtran.cls file define the components of your paper [title, text, heads, etc.]. *CRITICAL: Do Not Use Symbols, Special Characters, Footnotes, or Math in Paper Title or Abstract.",This document is a model and instructions for LaTeX. Please observe the conference page limits.
https://arxiv.org/html/2411.10351v1,Bias Unveiled: Investigating Social Bias in LLM-Generated Code,"Large language models (LLMs) have significantly advanced the field of automated code generation. However, a notable research gap exists in the evaluation of social biases that may be present in the code produced by LLMs. To solve this issue, we propose a novel fairness framework, i.e, Solar, to assess and mitigate the social biases of LLM-generated code.Specifically, Solar can automatically generate test cases for quantitatively uncovering social biases of the auto-generated code by LLMs. To quantify the severity of social biases in generated code, we develop a dataset that covers a diverse set of social problems. We applied Solar and the crafted dataset to four state-of-the-art LLMs for code generation. Our evaluation reveals severe bias in the LLM-generated code from all the subject LLMs. Furthermore, we explore several bias mitigation prompt strategies, including Chain-of-Thought (CoT) prompting, combining positive role-playing with CoT prompting and iterative prompting. Our experiments show that iterative prompting can effectively reduce social bias in LLM-generated code by up to 90%. Last, we make the code and data publicly available111https://anonymous.4open.science/r/fairness˙testing˙code˙generation-3FB8. Solar is highly extensible to evaluate new social problems.","Large language models (LLMs) that are pre-trained and fine-tuned on code-specific datasets have led to recent successes of LLM-for-code models, such as Codex (Chen et al. 2021), CodeGen (Nijkamp et al. 2022), StarCoder (Li et al. 2023), Code Llama (Roziere et al. 2023), and Copilot (Chen et al. 2021). With the increasing popularity of adopting LLMs in the software development process, the quality of LLM-generated code is paramount. Current evaluations, such as HumanEval (Chen et al. 2021) and MBPP (Austin et al. 2021), focus on functional correctness but fall short in evaluating the fairness of code, particularly in detecting bias against diverse demographic groups in human-center tasks. Figure 1: An overview of social bias evaluation framework Solar with examples. Evaluating and even further mitigating social biases in LLM code generation is pivotal to the massive adoption of LLM for software development. Prior studies reveal that LLMs have social biases towards different demographics in NLP tasks (Bai et al. 2023; Zhao et al. 2023; Meade, Poole-Dayan, and Reddy 2021; Gallegos et al. 2023). Yet, these techniques are not applicable in code generation. Recent works (Liu et al. 2023; Huang et al. 2023) took the first steps to investigate social bias in code generation. Yet these works do not fully represent real-world human-centered coding tasks, which developers may utilize LLM to generate code for. Specifically, Liu et al. use manually crafted prompts of method signatures containing negative judgmental modifiers, such as def find_disgusting_people(people, ethnicity). Huang et al. experiment one-sentence prompts in LLM code generation, which does not cover complicated real-world scenarios. Moreover, the work by Liu et al. does not quantify the severity of social bias, and both works lack in exploring more comprehensive bias mitigation strategies and investigating the impact on functional correctness by bias mitigation. To fill this research gap, we develop a novel evaluation framework Solar for evaluating the fairness of LLM-generated code. Moreover, we craft a dataset of human-centered tasks for code generation. Figure 1-a shows an example of human-centered tasks (i.e., a task definition), which is about deciding a career choice according to personal characteristics. Solar takes a task definition as input and generates a code prompt (Figure 1-b) and executable test cases (Figure 1-d) for evaluating social biases. A subject LLM generates code snippets (depicted in Figure 1-c) given the prompt, and then will be evaluated for fairness using the Solar’s generated test cases. Inspired by metamorphic testing (Chen, Cheung, and Yiu 2020), the test cases examine whether a generated code snippet produces different outcomes for different demographics. For example, as shown in Figure 1 (illustrated by sub-figure c and d), the tested model, GPT-3.5-turbo-0125, produces gender-biased code that excludes transgender individuals as suitable candidates, leading to discrimination and potential issues within the program (Figure 1-c). Using the test results as feedback, Solar employs mitigation strategies to refine code generation towards bias-neutral code. We conducted experiments on four state-of-the-art code generation models, namely GPT-3.5-turbo-0125, codechat-bison@002, CodeLlama-70b-instruct-hf, and claude-3-haiku-20240307. Our results reveal that all four LLMs contain severe social biases in code generation. The detected social biases are in varying degrees and different types. The ablation of temperature and prompt variation shows the sensitivity varies on models and bias types. Last, our experiment shows that iterative prompting, with feedback from Solar’s bias testing results, significantly mitigates social bias without sacrificing functional correctness. Contributions. 1) An extendable evaluation dataset (SocialBias-Bench) that is composed of distinct and diverse real-world social problems for evaluating social biases in LLM code generation. 2) A fairness evaluation framework (Solar), inspired by the concept of metamorphic testing, that can quantify the fairness of LLM-generated code by generating executable test cases. Solar is a black-box approach and can be applied to LLMs of any architecture. 3) Ablation studies about the impact of the temperature and judgemental words on fairness evaluation, and 4) An exploration of bias mitigation strategies."
https://arxiv.org/html/2411.10213v1,An Empirical Study on LLM-based Agents for Automated Bug Fixing,"Large language models (LLMs) and LLM-based Agents have been applied to fix bugs automatically, demonstrating the capability in addressing software defects by engaging in development environment interaction, iterative validation and code modification. However, systematic analysis of these agent and non-agent systems remain limited, particularly regarding performance variations among top-performing ones. In this paper, we examine seven proprietary and open-source systems on the SWE-bench Lite benchmark for automated bug fixing. We first assess each system’s overall performance, noting instances solvable by all or none of these sytems, and explore why some instances are uniquely solved by specific system types. We also compare fault localization accuracy at file and line levels and evaluate bug reproduction capabilities, identifying instances solvable only through dynamic reproduction. Through analysis, we concluded that further optimization is needed in both the LLM itself and the design of Agentic flow to improve the effectiveness of the Agent in bug fixing.","Large Language Models (LLMs) (Zhao et al., 2023) are advanced machine learning models trained on vast amounts of textual data, capable of understanding and generating human-like text. LLM-based Agents (Xi et al., 2023) are systems that utilize large language models to interact with the environment and accomplish specific tasks. Recently, LLM-based Agents have demonstrated significant influence in automated bug fixing in code repositories (Kang et al., 2023; Zhang et al., 2024; Yang et al., 2024a). Thanks to the powerful natural language processing capabilities of LLMs, these Agents can efficiently understand and analyze source code and its associated natural language descriptions, such as user-submitted issue descriptions and code comments. Additionally, through dynamic interaction with local environments (e.g., via terminal), LLM-based Agents can retrieve useful information from the code repository, perform code editing and execution, and iterate and validate repair results, thereby improving the accuracy and efficiency of bug fixes. This combination of LLM and environmental feedback has made automated bug fixing more efficient and feasible than ever before, providing revolutionary new tools for software maintenance and development. Researchers from both the industry (Liu et al., 2024a; hon, [n. d.]; gru, [n. d.]; Ma et al., 2024) and academia (Zhang et al., 2024; Tao et al., 2024) have developed LLM-based Agent systems to locate and fix bugs in code repositories. To evaluate the fault localization and repair capabilities of LLMs and various Agent systems, Jimenez et.al (Jimenez et al., 2023) proposed the evaluation datasets SWE-bench, with derived versions SWE-bench Lite (a subset of the full benchmark), and SWE-bench Verified (human annotated subset of SWE-bench published recently). These datasets contain real bugs from code repositories and can verify the correctness of the patches generated by Agents through unit tests. Recently, these datasets have become the most influential benchmarks in the field of automated bug fixing, attracting both academic and industrial participants to compete on the SWE-bench Lite leaderboard 111https://www.swebench.com/, with new submissions typically every one or a half week. However, no work has systematically analyzed the fault localization and repair capabilities of LLM-based Agents or the performance differences among various tools within these Agent systems. Regarding the SWE-bench Lite dataset itself, due to the quality of issue descriptions and the complexity of the logical dependencies related to the defects, some instances in the benchmark are easier for Agents to fix, while others are more difficult (Xia et al., 2024). As for the design of the systems, different designs exhibit different planning, reasoning, and problem solving capabilities, i.e. some systems adopting static approaches (gru, [n. d.]) and others adopting dynamic approaches (Zhang et al., 2024). We have also observed significant differences in the sets of cases that each system can solve. Therefore, analyzing the solving capabilities of LLM-based Agents on specific instances can not only help us better understand the current performance of Agents but also provide comparative insights to inspire future research directions. We collected the four most outstanding commercial systems (i.e. MarsCode Agent (Liu et al., 2024a), Honeycomb (hon, [n. d.]), Gru (gru, [n. d.]), Alibaba Lingma Agent (Ma et al., 2024)) and the three most excellent open-source systems (i.e. AutoCodeRover (Zhang et al., 2024), Agentless + RepoGraph (Ouyang et al., 2024), Agentless (Xia et al., 2024)) with top performances on the SWE-bench Lite Leaderboard and conducted a comprehensive analysis of the performance differences of each system. First, we evaluated the overall performance of LLM-based Agents in bug fixing, including statistics on the instances that all seven systems can solve and those that none can solve, and analyzed the reasons behind these results. We also explored why some instances can only be solved by Agent systems while others can only be solved by non-Agent systems. Next, we investigated the performance differences in fault localization among different systems and their causes, compiling file-level and line-level localization accuracy rates. Finally, we analyzed the impact of bug reproduction on bug fixing, and the common characteristics of instances that can only be solved through dynamic reproduction. Through data analysis, we have summarized several insights.To improve bug fixing, it is essential to enhance the model’s reasoning ability, enabling it to accurately identify bug-related information within an issue and reduce noise interference. For multiple potential repair locations, the model should leverage its reasoning capabilities to determine the most relevant location. From the Agentic flow perspective, there should be a strong focus on the quality of the issue and attention to multiple suspicious locations in the stack trace. The design should include mechanisms to verify the completeness of patches and consider their global impact. Mechanisms should also be implemented to mitigate the randomness of the model’s output or effectively utilize its diversity. In error localization, achieving line-level accuracy is more critical than file-level, due to the larger discovery space, necessitating finer-grained results. During the reproduction process, ensuring the correctness of reproductions is crucial, as incorrect reproductions can result in the failure of the entire solving process. Novelty and Contribution To the best of knowledge, this is the first work to: (1) Study the effectiveness of LLM-based Agents in automatic bug fixing for code repositories (2) Examine the effectiveness of different LLM-based Agents in Fault Localization and analyze the reasons for their differences (3) Investigate the impact of bug reproduction on bug fixing of LLM-based Agents (4) Summarize the current issues and future research directions for LLM-based Agents in bug fixing Paper Organization The remainder of this paper is organized as follows: Section 2 explains the background. Section 3 describes the study design. Section 4 presents the analysis results and findings. Section 5 discusses the analysis results and findings. Section 6 reports the threats to validity. Section 7 discusses related work, and Section 8 concludes the paper."
https://arxiv.org/html/2411.10169v1,Definition and Detection of Centralization Defects in Smart Contracts,"In recent years, security incidents stemming from centralization defects in smart contracts have led to substantial financial losses. A centralization defect refers to any error, flaw, or fault in a smart contract’s design or development stage that introduces a single point of failure. Such defects allow a specific account or user to disrupt the normal operations of smart contracts, potentially causing malfunctions or even complete project shutdowns. Despite the significance of this issue, most current smart contract analyses overlook centralization defects, focusing primarily on other types of defects. To address this gap, our paper introduces six types of centralization defects in smart contracts by manually analyzing 597 Stack Exchange posts and 117 audit reports. For each defect, we provide a detailed description and code examples to illustrate its characteristics and potential impacts. Additionally, we introduce a tool named CDRipper (Centralization Defects Ripper) designed to identify the defined centralization defects. Specifically, CDRipper constructs a permission dependency graph (PDG) and extracts the permission dependencies of functions from the source code of smart contracts. It then detects the sensitive operations in functions and identifies centralization defects based on predefined patterns. We conduct a large-scale experiment using CDRipper on 244,424 real-world smart contracts and evaluate the results based on a manually labeled dataset. Our findings reveal that 82,446 contracts contain at least one of the six centralization defects, with our tool achieving an overall precision of 93.7%.","The rapid development of Decentralized Applications (DApps) and Decentralized Finance (DeFi) has spurred extensive research on smart contracts. Recently, a notable increase in security incidents and economic losses has been attributed to centralization defects in DeFi projects. According to the Certik’s report [1], during the third quarter of 2023 alone, more than 14 related incidents were reported, leading to a total loss exceeding $204 million. A centralization defect in a DeFi project refers to any error, flaw, or fault in a smart contract’s design or development stage that results in a single point of failure [2]. This means that specific accounts, users, or addresses could disrupt normal operations, potentially causing project malfunctions or even shutdown. These defects encompass centralization issues and logical errors that directly result in the loss of funds. For instance, if the contract owner has the privilege to transfer tokens deposited by users, all users’ assets may be at risk as the private key of the owner could be leaked. Additionally, centralization defects can also stem from design flaws that may not pose threats to users’ funds immediately but do affect safety in certain scenarios. In March 2024, the DeFi project MUMI incurred an economic loss due to a centralization defect. The contract included a function for minting MUMI tokens, which was controlled by a single node. Minting tokens involves generating new tokens by authenticating data, creating new blocks, and recording this information on the blockchain [3]. An attacker exploited this function to clandestinely mint and drain a substantial number of tokens, resulting in a financial loss of approximately $35,000 [4]. Although previous works [5, 6] have reported a set of smart contract defects, the unique challenges presented by centralization defects have not been fully addressed. To address this gap, we first conducted an empirical study aimed at defining centralization defects in smart contracts. Our analysis encompassed 597 Q&A posts collected from Ethereum Stack Exchange [7] and 117 smart contract audit reports from blockchain security companies. By employing a manual filtering and open card sorting approach, we defined six centralization defects in smart contracts: Mint Function with Single Signature, Management without Timelock, Critical Variables Manipulation with Single Signature, Single Proxy Admin, Self-destruct with Single Signature, and Individual Contract Output Reliance. To identify these centralization defects, we developed a tool named CDRipper (Centralization Defects Ripper), which takes the smart contract’s source code as input. By identifying centralization defects in contracts, developers can enhance contract security while users can mitigate investment risks, contributing to the safe and sustainable growth of the smart contract community. CDRipper first constructs a permission dependency graph (PDG), which represents the relationships of permission dependencies among contract statements and functions, such as those used for or controlled by multi-signature verification, timelock mechanism, and permission checks. CDRipper then identifies sensitive operations in functions based on predefined rules, which are summarized from the empirical study of centralization defects. Finally, CDRipper reports centralization defects based on the permission dependencies of functions and sensitive operations. We applied CDRipper to 244,424 real-world smart contracts, discovering that 82,446 (about 33.73%) contracts in our dataset contained at least one centralization defect. More than 80% of reported defects arise from management through a single-signature address, i.e., an address controlled by a single private key. The compromise or loss of the private key associated with this address will leave the contract open to unauthorized access and lead to security issues. In the performance evaluation of CDRipper, we used a random sampling method and manually labeled two distinct datasets. The evaluation results show that CDRipper achieved an overall precision rate of 93.7% and a false negative rate of 14.6%. The main contributions of our work are as follows: • We defined six types of centralization defects in smart contracts, which is the most comprehensive work on this topic. For each defect, we present an illustration and a code example. Additionally, we provide possible solutions aimed at enhancing the security of smart contracts. • We developed a tool called CDRipper for detecting the defined centralization defects. Through random sampling and manual validation, the results demonstrate that our method achieves an overall precision of 93.7% and a false-negative rate of 14.6%. • We conducted a large-scale experiment involving 244,424 real-world smart contracts to evaluate the performance of CDRipper. Our findings reveal that among these smart contracts, 82,446 (about 33.73%) contain at least one defined defect. • We published the source code of CDRipper, along with all experimental data and analysis results at: https://anonymous.4open.science/r/CDRipper/."
