URL,Title,Abstract,Introduction
https://arxiv.org/html/2411.06847v1,Human game experiment to verify the equilibrium selection controlled by design,"We conducted a laboratory experiment involving human subjects to test the theoretical hypothesis that equilibrium selection can be impacted by manipulating the games dynamics process, by using modern control theory. Our findings indicate that human behavior consists with the predictions derived from evolutionary game theory paradigm. The consistency is supported by three key observations: (1) the long-term distribution of strategies in the strategy space, (2) the cyclic patterns observed within this space, and (3) the speed of convergence to the selected equilibrium. These findings suggest that the design of controllers aimed at equilibrium selection can indeed achieve their theoretical intended purpose. The location of this study in the knowledge tree of evolutionary game science is presented.","The primary objective of this experiment study is to validate the consistency between theoretical predictions and experimental results. In our prior theoretical research [22], we demonstrated how to manipulate game equilibrium selection using the pole assignment method, which is a sophisticated full-state feedback technique rooted in modern control theory [14, 7, 4]. While previous experimental work has shown how to implement the pole assignment approach for controlling dynamic structures in laboratory experiment involving human subjects [21, 1], there has been no exploration of its application to equilibrium selection in such contexts. Figure 1 shows the location of this study (in red text), equilibrium selection by controller, in the knowledge tree of evolutionary game theory and experiment. The tree represents the fundamental concepts of dynamics system theory in mathematics. Differential Equations \dot{x}=f(x)Equilibrium x^{*}Jacobian J\big{|}_{x^{*}}Velocity \dot{x}\big{|}_{x}[10, 17, 16]Eigenvalue \lambdaReImReImEigenvector \etaStability \tau[2, 11, 3]Angular velocity \omega[15]Eigencycle \sigma[19, 23]Coherence \kappaMulti modes [13]Distribution [8, 18, 6, 23, 3]Collapse [20]ControllerEquilibrium selection[22] and This studyMode control [21] Figure 1: The location of this study, equilibrium selection (in red text) by controller, in the knowledge tree of evolutionary game theory and experiment, or called as evolutionary game science. This knowledge tree is presented in the linearization paradigm of dynamics system theory in mathematics. The controller is using pole assignment approach in modern control theory in engineering. The references for related concepts are the existed experimental literatures with associated theory. This experimental study is based on the previous theoretical work [22], where a five-strategy game was employed to demonstrate the pool assignment method to control the equilibrium selection. In this experimental study, we will utilize the same five-strategy game to realize the control and to verify the consistency. 1.1 Theoretical background Table 1: The game matrix x1 x2 x3 x4 x5 x1 0 0 2 0 -2 x2 2 0 0 -2 0 x3 0 2 0 2 -1 x4 -2 0 1 0 1 x5 0 -2 -2 1 0 The theoretical study [22] used a symmetric 5-strategy one population game, whose payoff matrix is shown in Table 1. The game has and only has two equilibrium (Nash_1 and Nash_2) as shown in Fig. 2. The locations of the two Nash equilibrium of the game are \displaystyle{\text{Nash\_1}}=\!\frac{1}{3}(1,1,1,0,0) (1) \displaystyle{\text{Nash\_2}}=\!\frac{1}{2}(0,0,0,1,1) (2) In replicator dynamics [9] as the estimator, the eigenvalues at the Nash_1 denoted as \lambda^{o}_{\text{Nash\_1}} are \lambda^{o}_{\text{Nash\_1}}=\left[\begin{array}[]{rrrrr}-\frac{1-\sqrt{3}i}{3% }&-\frac{1+\sqrt{3}i}{3}&-\frac{2}{3}&-1&-2\\ \end{array}\right]. (3) The associated eigenvector, v_{\text{Nash\_1}}, which presents the dynamics structure, is as follow. v_{\text{Nash\_1}}=\left[\begin{array}[]{rrrrr}(-.289&(-.289&.577&.151&-.161\\ -.5i)&+.5i)&&&\\ (-.289&(-.289&.577&-.030&-.462\\ +.5i)&-.5i)&&&\\ .577&.577&.577&-.757&-.221\\ 0&0&0&.636&0\\ 0&0&0&0&.844\\ \end{array}\right] (4) Notice that, the imaginary part of the first two eigenvalues are not zero, then the performance of the two associated eigenvectors (1st and 2nd columns) could be a rock-paper-scissors cycle, which is known recently [23, 19] Utilizing the pole assignment approach, we can manipulate the eigenvalues at the Nash equilibrium point, Nash_1. In simpler terms, we employ pole assignment to regulate the eigenvalues, which determine the stability of the game evolution, of Nash_1 by introducing various constant values b for different experimental treatment. This can be mathematically expressed as follows: \displaystyle\lambda^{c}_{\text{Nash\_1}} \displaystyle= \displaystyle\lambda^{o}_{\text{Nash\_1}}+b~{}\Big{[}~{}1~{}~{}1~{}~{}0~{}~{}0% ~{}~{}0~{}\Big{]} (5) \displaystyle= \displaystyle\left[\begin{array}[]{rrrrr}\big{(}b-\frac{1-\sqrt{3}i}{3}\big{)}% &\big{(}b-\frac{1+\sqrt{3}i}{3}\big{)}&-\frac{2}{3}&-1&-2\\ \end{array}\right]. (7) It is clear that, the original system (b=0 condition) is stable at Nash_1. At the same time, b=1/3 is the marginal value for control to switch the stability form stable (when b<1/3) to unstable (when b>1/3). Referring to the control parameter b, the performance of the game system should be difference, which can be derive in dynamics theory and provides a series of theoretical predictions [22]. Figure 2: Conceptual figure: In a five strategy game, the two equilibrium (Nash_1 and Nash_2) locate in the two sub space S_{1}(x_{1},x_{2},x_{3}) and S_{2}(x_{4},x_{5}), respectively. The pole assignment can be designed to make the Nash_1 being unstable. As consequence, the long run trajectory will converge to Nash_2, which means that the equilibrium Nash_2 is selected. Alternatively, the pole assignment can be designed to make the Nash_1 being more stable, then Nash_1 will be long rum distribution center. This figure comes from [22]. 1.2 Theoretical predictions In theory, we have completed the controller design, utilizing the workflow outlined in [22]. Furthermore, the theoretical predictions of the controller have been validated through numerical agent-based simulations, demonstrating good consistency. In human game experiments, the theoretical predictions remain valid and will be verified. 1. When b<1/3, Nash_1 will be selected equilibrium; when b>1/3, Nash_2 will be selected equilibrium. 2. The convergence speed will be faster, when \Big{|}b-1/3\Big{|} being larger. 3. When When b<1/3, cycles exist constantly; when b>1/3, cycles do not exist."
https://arxiv.org/html/2411.06472v1,"Generalized Eigenspaces and Pseudospectra 
of Nonnormal and Defective
Matrix-Valued Dynamical Systems","We consider nonnormal matrix-valued dynamical systems with discrete time. For an eigenvalue of matrix, the number of times it appears as a root of the characteristic polynomial is called the algebraic multiplicity. On the other hand, the geometric multiplicity is the dimension of the linear space of eigenvectors associated with that eigenvalue. If the former exceeds the latter, then the eigenvalue is said to be defective and the matrix becomes nondiagonalizable by any similarity transformation. The discrete-time of our dynamics is identified with the geometric multiplicity of the zero eigenvalue \lambda_{0}=0. Its algebraic multiplicity takes about half of the matrix size at t=1 and increases stepwise in time, which keeps excess to the geometric multiplicity until their coincidence at the final time. Our model exhibits relaxation processes from far-from-normal to near-normal matrices, in which the defectivity of \lambda_{0} is recovering in time. We show that such processes are realized as size reductions of pseudospectrum including \lambda_{0}. Here the pseudospectra are the domains on the complex plane which are not necessarily exact spectra but in which the resolvent of matrix takes extremely large values. The defective eigenvalue \lambda_{0} is sensitive to perturbation and the eigenvalues of the perturbed systems are distributed densely in the pseudospectrum including \lambda_{0}. By constructing generalized eigenspace for \lambda_{0}, we give the Jordan block decomposition for the resolvent of matrix and characterize the pseudospectrum dynamics. Numerical study of the systems perturbed by Gaussian random matrices supports the validity of the present analysis.Keywords: Nonnormal matrices, Defective eigenvalue, Pseudospectrum dynamics, Generalized eigenspaces, Jordan decompositions of resolvents, Symbol curves2020 Mathematics Subject Classification: 15A18; 15A20; 15B05; 47A10; 60B20","Consider a matrix M\in\mathbb{C}^{n\times n}. We write its Hermitian conjugate as M^{\dagger} defined by the complex conjugate of the transpose; M^{\dagger}:=\overline{M^{\mathsf{T}}}. If it satisfies the equality M^{\dagger}M=MM^{\dagger}, then it is said to be normal and can be diagonalized by a unitary transformation. Hermitian matrices satisfying M^{\dagger}=M fall in this class. We introduce two notions of degeneracy of eigenvalues. The algebraic multiplicity is the number of times the eigenvalue appears as a root of the characteristic polynomial of M, while the geometric multiplicity is the dimension of the linear space of the eigenvectors associated to the eigenvalue. When the geometric multiplicity is equal to the algebraic multiplicity for all eigenvalues, the matrix M has a complete set of eigenvectors. In this case, even if M is nonnormal, it can be reduced to a diagonal matrix \Lambda by a similarity transformation as \Lambda=V^{-1}MV. Here the j-th column of V is given by the j-th linearly independent eigenvector, j=1,2,\dots,n, and V^{-1} is well defined. But if the algebraic multiplicity of an eigenvalue exceeds the geometric multiplicity, then that eigenvalue is said to be defective and the matrix becomes nondiagoralizable. Consider the shift matrix with size n\geq 2, S=S_{n}:=\Big{(}\delta_{j\,k-1}\Big{)}_{1\leq j,k\leq n}=\left(\begin{array}[]% {cccccc}0&1&&&\smash{\lower 7.3194pt\hbox{\bg 0}}&\\ &0&1&&&\\ &\ldots&\ldots&&&\\ &&\ldots&\ldots&&\\ &&&0&1&\\ &&&&0&1\\ &\smash{\hbox{\bg 0}}&&&&0\end{array}\right), (1.1) where \delta_{jk} denotes the Kronecker delta. It is obvious that S^{k}=0 for k\geq n. Let b_{j}\in\mathbb{C}, j=1,2,\dots, and consider nilpotent Toeplitz matrices, S(m):=S^{m}+b_{1}S^{m+1}+\cdots+b_{n-m-1}S^{n-1}, (1.2) for m=1,2,\dots,n-1. Notice that S(m), m=1,2,\dots,n-1 are non-Hermitian and nonnormal. Since all the elements of the diagonal and lower triangular part of S(m) are zero, \lambda_{0}:=0 is the only eigenvalue. Hence, the algebraic multiplicity of \lambda_{0}, which is denoted by a_{0}(m), is n for any m=1,2,\dots,n-1. For each m=1,2,\dots,n-1, any vector \bm{v}_{0}(m) in the form \bm{v}_{0}(m)=(v_{01}(m),v_{02}(m),\cdots,v_{0m}(m),0,\cdots,0)^{\mathsf{T}} can be an eigenvector for \lambda_{0}. The dimension of the complex space spanned by these eigenvectors is m. Hence the geometric multiplicity g_{0}(m) of \lambda_{0} is m. We notice that g_{0}(1)=a_{0}(1)=1, but g_{0}(m)<a_{0}(m),\quad m=2,3,\dots,n-1. That is, the eigenvectors fail to span \mathbb{C}^{n}. In this case, the eigenvalue \lambda_{0} is defective and there is no similarity transformation which reduces S(m) to any diagonal form. Although S(m) is nondiagonalizable, a similarity transformation can reduce the matrix to the Jordan canonical form, \mathbb{J}(m)=V(m)^{-1}S(m)V(m). The diagonal elements of \mathbb{J}(m) are still all zero, but some of the upper 2nd-diagonal elements can be 1. More precisely, \mathbb{J}(m) is decomposed into g_{0}(m)-ple Jordan blocks which are given by shift matrices (1.1), \mathbb{J}(m)=\bigoplus_{\ell=1}^{g_{0}(m)}S_{d_{0}^{(\ell)}(m)}, (1.3) where the sizes of them are denoted by d_{0}^{(\ell)}(m), \ell=1,2,\dots,g_{0}(m). By convention, we assume the non-increasing order, d_{0}^{(1)}(m)\geq d_{0}^{(2)}(m)\geq\cdots\geq d_{0}^{(g_{0}(m))}(m). Each d_{0}^{(\ell)}(m) gives the dimension of the generalized sub-eigenspace which includes the \ell-th eigenvector \bm{v}_{0}^{(\ell)}(m) associated with the zero-eigenvalue \lambda_{0}, \ell=1,2,\dots,g_{0}(m). They satisfy the sum rule \sum_{\ell=1}^{g_{0}(m)}d_{0}^{(\ell)}(m)=a_{0}(m). By definition, if d_{0}^{(\ell)}\equiv 1, \ell=1,2,\dots,g_{0}, then g_{0}=a_{0} and the matrix is normal. Therefore, k_{0}(m):=\max\{d_{0}^{(\ell)}(m):\ell=1,2,\dots,g_{0}(m)\}=d_{0}^{(1)}(m) (1.4) will indicate the degree of defectivity of the zero-eigenvalue \lambda_{0} measuring how far from being normal. It is called the index of \lambda_{0}. Eigenvalue analysis is one of the most successful method of applied mathematics. Roughly speaking, eigenvalues give us the abstraction of a matrix by plotting the set of them (spectra) on a complex plane \mathbb{C}. For defective matrices, however, eigenvalue analysis fails. In the above case with S(m), the unique eigenvalue at zero with full algebraic multiplicity a_{0}(m)\equiv n misleads us to identify S(m) with the null (all-zero) matrix O. The Jordan-block structure with zero diagonal can not be represented only by spectra. (a) (b) (c) Figure 1: (a) One sampling result of numerically obtained eigenvalues of the system with Gaussian perturbation matrix Z; S^{(b)}(m,\delta Z)=S^{m}+bS^{m+1}+(1/\sqrt{2n})Z, where n=5000, m=3, and b=1. (b) Superpositions of 50 samples. (c) Symbol curve of \widehat{S}^{m}+b\widehat{S}^{m+1} with m=3 and b=1. The structure of S(m) hidden in eigenvalue analysis is revealed by its sensitivity to perturbation. Let Z be a matrix with independently and normally distributed complex entries; Z_{jk}=X_{jk}+iY_{jk} with X_{jk}\sim{\rm N}(0,1), Y_{jk}\sim{\rm N}(0,1), i:=\sqrt{-1}. Here we consider a simple case for (1.2) such that b_{1}=b\in\mathbb{C}, b_{j}=0 for j\geq 2. Figure 1 shows plots of the numerically obtained eigenvalues, when the complex Gaussian random matrix Z is added, S^{(b)}(m,\widetilde{\delta}Z):=S^{m}+bS^{m+1}+\widetilde{\delta}Z, (1.5) where n=5000, m=3, b=1, and the coefficient of Z is given by \widetilde{\delta}=\widetilde{\delta}(n)=1/\sqrt{2n}=1/100. The dots are not the eigenvalues of the original matrix, S^{(b)}(m,0)=S^{m}+bS^{m+1}, but they represent the structure of this defective matrix in the sense explained below. Hence they are called the pseudo-eigenvalues of S^{(b)}(m,0). (More precisely speaking, the domains on \mathbb{C} in which the eigenvalues of randomly perturbed matrix are distributed are called the pseudospectra of the original unperturbed matrix having defective eigenvalues [6, 22, 25].) Instead of the n\times n shift matrix (1.1), here we consider an infinite-size shift matrix, \widehat{S}:=S_{\infty}=(\delta_{j\,k-1})_{1\leq j,k<\infty}. (1.6) which will represent a nilpotent Toeplitz operator. We also consider an infinite-dimensional vector \widehat{\bm{v}} in the form \widehat{\bm{v}}=(1,z,z^{2},z^{3},\cdots)^{\mathsf{T}}, z\in\mathbb{C}. Then we see that (\widehat{S}^{m}+b\widehat{S}^{m+1})\widehat{\bm{v}}=f(z)\widehat{\bm{v}}\quad% \mbox{with}\quad f(z)=z^{m}+bz^{m+1}. (1.7) The 2-norm of \widehat{\bm{v}}, \|\widehat{\bm{v}}\|:=(\sum_{j=1}^{\infty}|\widehat{v}_{j}|^{2})^{1/2}=(1-|z|^% {2})^{-1/2}, is finite if z is inside the unit circle \mathbb{T}:=\{z\in\mathbb{C}:|z|=1\}. The function f(z) is known as the symbol of the Toeplitz operator \widehat{S}^{m}+b\widehat{S}^{m+1}. The image of \mathbb{T} by the map f, f(\mathbb{T}), is called the symbol curve of \widehat{S}^{m}+b\widehat{S}^{m+1} and is drawn in Fig.1 for b=1 [6, 25]. In Fig.1, the plots of eigenvalues of the perturbed systems line up along the symbol curve f(\mathbb{T}). For all z\in\mathbb{C}, |z|<1, the vectors \widehat{\bm{v}} satisfying (1.7) give eigenvectors of eigenvalues f(z)=z^{m}+bz^{m+1}, m-1,2,\dots,n-1 in \ell^{2}-space. It is proved that the spectrum of the Toeplitz operator \widehat{S}^{m}+b\widehat{S}^{m+1} is equal to f(\mathbb{T}) with all the points enclosed by this curve (see, [22, Theorem 2.1], [25, Theorem 7.1]), and Section 5 (i) below). If numerically obtained eigenvalues of (1.5) were all superposed, they will fill the region bounded by the outmost curve of the symbol curve f(\mathbb{T}). Figure 1 shows superposition of the plots of 50 samples. Mathematical study of random perturbations of banded Toeplitz matrices, see [1, 2, 3, 4, 5, 23] and references therein. Recently, the notion of pseudospectra has attracted much attention in stochastic analysis of time-dependent random matrix theory [13, 19]. The non-Hermitian matrix-valued Brownian motion (BM) is defined by M(t)=(M_{jk}(t))_{1\leq j,k\leq n}:=\left(\frac{1}{\sqrt{2n}}(B^{{\rm R}}_{jk}% (t)+iB^{{\rm I}}_{jk}(t))\right)_{1\leq j,k\leq n},\quad t\geq 0, where (B^{{\rm R}}_{jk}(t))_{t\geq 0}, (B^{{\rm I}}_{jk}(t))_{t\geq 0}, 1\leq j,k\leq n are 2n^{2} independent one-dimensional standard BMs [7, 8, 9, 12, 17]. This process is regarded as the dynamical extension of the complex Ginibre ensemble, since if it starts from the null matrix, M(0)=O, the distribution of eigenvalues at an arbitrary time t>0 is identified with the complex Ginibre ensemble of eigenvalues with variance t [16], which has been extensively studied in random matrix theory [10, 13]. Burda et al. [9] studied the process (M(t))_{t\geq 0} starting from M(0)=S. By numerical simulation they found that the eigenvalues seem to expand instantly from \lambda_{0} to a unit circle \mathbb{T}. For the time interval 0<t<1, the dots form a growing annulus. Then the inner radius of the annulus shrinks to zero at t=1 and dots fill up a full unit disk. This observation shall be compared with the eigenvalues of the matrix (1.5) with m=1 and b=0, where perturbation was given by a Gaussian complex random-matrix Z. When m=1 and b=0, the symbol is f(z)=z and hence the symbol curve is simply a unit circle, f(\mathbb{T})=\mathbb{T}. The transition from a unit circle to a unit disk in the time period t\in(0,1] reported by Burda et al. [9] will be regarded as a sampling process of eigenvalues for the perturbed nilpotent Toeplitz matrix. They seem to cluster along the symbol curve \mathbb{T} when the sampling number is small, while they tend to fill the unit disk as the sampling number becomes large. Motivated by the above consideration, we will study the following matrix-valued dynamical system [20], S^{(b)}(t,\delta J):=S^{t+1}+bS^{t+2}+\delta J, (1.8) with discrete time t=0,1,\dots,T, where the final time is defined by T=T(n):=n-2. Here b,\delta\in\mathbb{C} and J is the all-ones matrix; J=(J_{jk})_{1\leq j,k\leq n} with J_{jk}\equiv 1,\quad j,k=1,2,\dots n, which gives the additive rank 1 perturbation [14] to the nilpotent Toeplitz matrices, S^{(b)}(t,0)=S^{t+1}+bS^{t+2}. Figure 2: Time-evolution of the geometric multiplicity g_{0}, the algebraic multiplicity a_{0}, and the degree k_{0} of \lambda_{0} are shown by black, red, and blue dots, respectively, for t=1,2,\dots,T:=n-2 with n=100. Figure 3: Time evolution of Young diagram representing the dynamics of the Jordan canonical form associated with \lambda_{0}. The upper-left diagram is for the initial time t=1 with \lfloor n/2\rfloor boxes and the right diagram is for the final time t=T with n-2 boxes. Here we have drawn the case with n=17. The lower-left diagram shows the intermediate state at time t=5. In this case n=17 is indivisible by t+1=6; (t+1)\nmid n. Then k_{0}=\lfloor n/(t+1)\rfloor+1=3, n-(t+1)\lfloor n/(t+1)\rfloor-1=4. We will show the following. (i) The discrete time t is equal to the geometric multiplicity of \lambda_{0}, g_{0}(t)=t,\quad t=0,1,\dots,T. (1.9) (See Proposition 3.1 in Section 3.1.) In other words, we consider the matrix-valued dynamical system such that the dimension of the eigenspace in the narrow sense associated with \lambda_{0} is growing in time. (ii) All non-zero eigenvalues of S^{(b)}(t,\delta J) are given by simple roots of a polynomial equation with degree p_{1}(t)+1 with p_{1}(t):=\left\lfloor\frac{n-1}{t+1}\right\rfloor, (1.10) where \lfloor x\rfloor denotes the greatest integer less than or equal to x\in\mathbb{R} (the floor function of x) [20]. This determines the algebraic multiplicity of \lambda_{0} as a_{0}(t)=n-p_{1}(t)-1,\quad t=0,1,\dots,T. (1.11) (See Theorem 2.1 in Section 2.) Note that with a fixed n, a_{0}(t) is increasing stepwise in t [20]. Notice that a_{0}(0)=0; that is, the origin is not an eigenvalue at t=0. When the origin becomes an eigenvalue at t=1, its algebraic multiplicity has a large value \lfloor n/2\rfloor, that is, approximately half of the matrix size n, while the system has only one (g_{0}(1)=1) eigenvector. Non-zero eigenvalues are being absorbed one by one to the origin [20], and the algebraic multiplicity a_{0}(t) increases stepwise in time. The speed of increment of a_{0}(t) is slowing down as t increases, but it keeps excess to g_{0}(t) until t=n-3. At the final time t=T, \lambda_{0} has a_{0}(T)=n-2=T leaving only two non-zero eigenvalues on \mathbb{C}. There are g_{0}(T)=T linearly independent eigenvalues at that time. The coincidence a_{0}(T)=g_{0}(T) makes the matrix be diagonalizable. (iii) Although g_{0}(0)=a_{0}(0)=0 and g_{0}(T)=a_{0}(T)=T, the inequality holds as g_{0}(t)<a_{0}(t),\quad t=1,2,\dots,T-1. That is, the matrices S^{(b)}(t,\delta J) are nonnormal and \lambda_{0} is defective. We will construct the generalized eigenspaces associated with \lambda_{0} explicitly and prove that the index of \lambda_{0} is given by k_{0}(t)=\begin{cases}\displaystyle{\frac{n}{t+1}},&\quad\mbox{if $(t+1)\mid n% $},\cr\cr\displaystyle{\left\lfloor\frac{n}{t+1}\right\rfloor+1},&\quad\mbox{% if $(t+1)\nmid n$},\end{cases} (1.12) where (t+1)\mid n (resp. (t+1)\nmid n) means that n is divisible (resp. indivisible) by t+1. (See Proposition 3.2 in Section 3.1.) The degree of nonnormality is the highest value at the beginning; k_{0}(1)=n/2 if n is even and k_{0}(1)=(n+1)/2 if n is odd. The defectivity of \lambda_{0} is then decreasing stepwise in time. We put k_{0}(T)=1 by convention. See Fig.2 (iv) At each time t=1,2,\dots,T-1, by a similarity transformation, S^{(b)}(t,\delta J) is reduced to the following form, \mathbb{J}(t)\oplus{\rm diag}(\lambda_{1}(t),\lambda_{2}(t),\dots,\lambda_{p_{% 1}(t)+1}), (1.13) where the Jordan canonical form \mathbb{J}(t) is decomposed into t-ple Jordan blocks as \mathbb{J}(t)=\begin{cases}\underbrace{S_{k_{0}(t)}\oplus\cdots\oplus S_{k_{0}% (t)}}_{t},&\mbox{if $(t+1)\mid n$},\cr\underbrace{S_{k_{0}(t)}\oplus\cdots% \oplus S_{k_{0}(t)}}_{n-(t+1)\lfloor n/(t+1)\rfloor-1}\oplus\underbrace{S_{k_{% 0}(t)-1}\oplus\cdots\oplus S_{k_{0}(t)-1}}_{t-n+(t+1)\lfloor n/(t+1)\rfloor+1}% ,&\mbox{if $(t+1)\nmid n$}.\end{cases} (1.14) (See Section 3.1.) The Jordan canonical form is represented by a Young diagram [11, 15]. Figure 3 shows dynamics of Young diagram corresponding to (1.14). It starts from a single row diagram with \lfloor n/2\rfloor boxes at time t=1 and ends with a single column diagram with n-2 boxes at time t=T. (As mentioned at the end of (ii) above, at the final time t=T, S^{(b)}(T,\delta J)=S^{n-1}+\delta J can be diagonalized into the form, {\rm diag}(\underbrace{0,\cdots,0}_{T},\lambda_{1}(T),\lambda_{2}(T)), |\lambda_{1}(T)|>|\lambda_{2}(T)|>0 instead of (1.13).) The time t is identified with the number of rows and the total number of boxes is given by a_{0}(t) which increases stepwise in time. The relaxation process of the defectivity of \lambda_{0} is represented by the stepwise decreasing of the number of columns. In summary, the present dynamical systems (S^{(b)}(t,\delta J))_{1\leq t\leq T}, b,\delta\in\mathbb{C}, represent relaxation processes of matrices from being far-from-normal to being near-normal, in which the defective eigenvalue \lambda_{0} is recovering in time. The paper is organized as follows. In Section 2 we derive the polynomial equation for the non-zero eigenvalues and discuss their time-evolution. Section 3 is devoted to the analytical study of the pseudospectra, in particular, the pseudospectrum including the defective eigenvalue \lambda_{0}=0. In Section 3.1 we explain how to construct the generalized eigenspace associated with \lambda_{0}, which is decomposed into t sub-spaces and gives the t-ple Jordan blocks for the similarity transformation of the matrix at each time t, We perform the Jordan decomposition of resolvent of the matrix, introduce the notion of generalized condition number, and then evaluate the 2-norm of the resolvent (Proposition 3.6) in Section 3.2. In Section 3.3, we give the first definition of \varepsilon-pseudospectrum (Definition 3). Then an estimation of the \varepsilon-pseudospectra is given by Theorem 3.8. This theorem clarifies the (t,n)-dependence of the pseudospectrum including \lambda_{0}. In order to show the validity of our analytical study, we perform numerical calculation for the processes perturbed by Gaussian complex random matrices in Section 4. In Section 4.1, we show the second definition of \varepsilon-pseudospectrum (Definition 4.1) which is equivalent with the first one. By this definition, the pseudospectrum is characterized by the sensitivity of \lambda_{0} with respect to perturbations. Actually, we show in Section 4.2, that (t,n)-dependence of the domain, in which the eigenvalues of the perturbed systems are accumulated, is consistent with Theorem 3.8 for the pseudospectrum including \lambda_{0}. Finally in Section 5 future problems are listed out."
