URL,Title,Abstract,Introduction
https://arxiv.org/html/2411.10105v1,Parametric Autoresonance with Time-Delayed Control,"We investigate how a constant time delay influences a parametric autoresonant system. This is a nonlinear system driven by a parametrically chirped force with a negative delay-feedback that maintains adiabatic phase locking with the driving frequency. This phase locking results in a continuous amplitude growth, regardless of parameter changes. Our study reveals a critical threshold for delay strength; above this threshold, autoresonance is sustained, while below it, autoresonance diminishes. We examine the interplay between time delay and autoresonance stability, using multi-scale perturbation methods to derive analytical results, which are corroborated by numerical simulations. Ultimately, the goal is to understand and control autoresonance stability through the time-delay parameters.","A specific type of nonlinear system in which the system becomes phase-locked with a driving force in an adiabatic manner, where the frequency of the forcing gradually changes over time. This phenomenon, widely known as autoresonance, leverages the system’s nonlinearity to maintain resonance and effectively increase the system’s amplitude over an extended period, despite changes in the system’s parameters sanjuanbook ; fajans2001autoresonant . Typically, when the parameters of a nonlinear system change, the resonant frequency also shifts, causing the system to become detuned from resonance. In autoresonance, however, the system remains naturally phase-locked with the driving force in an adiabatic manner, allowing for self-adjustment of both amplitude and frequency. Since the initial observation of autoresonance ms_livingstone , a plethora of studies have been conducted across various fields. The use and application of autoresonance have been explored in atomic physics meerson1990strong ; liu1995nonlinear , plasma physics fajans1999autoresonant1 ; fajans1999autoresonant2 ; andresen2011autoresonant ; baker2015electron , nonlinear wave interactions friedland1998autoresonance3 ; friedland1998autoresonant4 ; yaakobi2013complete , planetary dynamics malhotra1999migrating ; friedland2001migration ; lanza2022tidal , and fluid dynamics friedland1999control . The theoretical framework of autoresonance has been extensively developed over the past few years. Some of the foundational work has been carried out by L. Friedland et al. friedland1997variational ; fajans2001dampingeffect ; fajans1999collective ; fajans2000secondharmonic ; nakar1999passage ; barth2014quantum . Studies can be found on asymptotic analysis and stability of autoresonance by L.A. Kalyakin et al. kalyakin2008asymptotic ; kalyakin2013stability . Kovaleva et al. kovaleva2013limiting have contributed an array of excellent works, including the limiting phase trajectory description of autoresonance and investigations of autoresonance in nonlinear coupled chains manevitch2016autoresonant ; kovaleva2018autoresonance ; kovaleva2016autoresonance . Additionally, R. Chacón et al. chacon2005energy ; chacon2010universal ; chacon2008breakdown have developed an energy-based theory and conducted notable research on chaos and the breakdown of autoresonance . While autoresonance induced by external forcing has garnered significant attention, relatively few studies have focused on parametric autoresonance khain2001parametric ; assaf2005parametric ; kiselev2007capture ; friedland2016parametric . In this article, we have investigated the effect of time delay on a parametric autoresonant system. The control of resonance response whether deterministic or stochastic, in various nonlinear systems with time delay has proven to be an efficient strategy over the years hu1998resonances ; mei2009effects ; jeevarathinam2011theory ; cantisan2020delay ; zakharova2017time ; maccari2003vibration . In a recent work, the effect of delay has been discussed in a externally driven autoresonant array of Duffing-Ueda oscillator chacon2024 . Although time delay has been employed in systems with externally applied chirped forcing, its role in parametric autoresonant systems warrants attention due to its potential for effective applications across diverse fields. Driven by an interest in parametric autoresonance, we aim to investigate the effect of time delay in such systems, an aspect that has received limited attention in the existing literature, to the best of our knowledge. Our findings demonstrate that the delay strength can serve as a powerful mechanism to control the growth of the autoresonant system. The structure of this article is as follows. Section \mathrm{II} outlines the essential mathematical formulations. In Sect. \mathrm{III}, we present numerical results to validate our analytical findings. Lastly, Sect. \mathrm{IV} provides the concluding remarks."
https://arxiv.org/html/2411.10320v1,Ghost states underlying spatial and temporal patterns: how non-existing invariant solutions control nonlinear dynamics,"Close to a saddle-node bifurcation, when two invariant solutions collide and disappear, the behavior of a dynamical system can closely resemble that of a solution which is no longer present at the chosen parameter value. For bifurcating equilibria in low-dimensional ODEs, the influence of such ‘ghosts’ on the temporal behavior of the system, namely delayed transitions, has been studied previously. We consider spatio-temporal PDEs and characterize the phenomenon of ghosts by defining representative state-space structures, which we term ‘ghost states,’ as minima of appropriately chosen cost functions. Using recently developed variational methods, we can compute and parametrically continue ghost states of equilibria, periodic orbits, and other invariant solutions. We demonstrate the relevance of ghost states to the observed dynamics in various nonlinear systems including chaotic maps, the Lorenz ODE system, the spatio-temporally chaotic Kuramoto–Sivashinsky PDE, the buckling of an elastic arc, and 3D Rayleigh–Bénard convection.","Characterizing dynamical systems from a geometrical point of view provides a powerful approach to complex nonlinear systems, where obtaining analytical or closed-form solutions is typically impossible. In this approach, the state of the system at a given time is viewed as a ‘point,’ and its evolution is viewed as a ‘trajectory’ within an abstract, possibly very high-dimensional, and often formally infinite-dimensional state space. Instead of describing the behavior of individual solutions for given initial conditions, a geometrical approach characterizes the dynamics in terms of the topology of the ensemble of all these trajectories, known as the phase portrait of the system. The idea for such a geometrical approach was initiated in the late nineteenth century [1, 2], which later became a key element in the study of deterministic chaos [3]. Thanks to advances in computational resources and methods over the past three decades, this approach has been successfully transferred from low-dimensional dynamical systems governed by ordinary differential equations (ODEs) to those governed by partial differential equations (PDEs). The function space of a PDE is infinite-dimensional, which, in discretized form, results in finite but very high-dimensional problems. Examples of such PDE systems include fluid flows [4, 5] and nonlinear optics [6, 7], among others, where a geometrical approach has proven to be particularly useful. A geometrical approach aims first to characterize how general trajectories are organized within the state space of a dynamical system, and then to discover how this organization changes as the control parameters of the system are varied. The shape of the general trajectories is determined by special trajectories corresponding to dynamically invariant solutions with a simple dependence on time. The simplest of these invariant solutions include steady states, where the system does not evolve over time, and periodic orbits, where the state recurs exactly after a given period. These invariant solutions might be dynamically unstable and, thus, never realized naturally in a numerical simulation or a laboratory experiment. However, their local dynamics and the dynamical connections between them dictate the shape of the other trajectories. When the control parameters of a dynamical system are varied, a geometrical description is typically concerned with bifurcations. A bifurcation is the appearance of a topologically nonequivalent phase portrait at precise parameter values [8]. This topological change involves the appearance or disappearance of fixed points, periodic orbits, or more complex invariant sets, or changes in their stability properties. A bifurcation is local if its associated topological change can be detected within any small neighborhood of the invariant solution involved in the bifurcation; if this change cannot be identified within small neighborhoods of the invariant solution, then the bifurcation is global. Through a local bifurcation, the shape and dynamical properties of trajectories outside a small neighborhood around the involved invariant solution do not change immediately. Consequently, whenever two invariant solutions collide and annihilate in a saddle-node (fold) bifurcation, the properties of these solutions are still ‘felt’ by the dynamics even though the solutions are not present anymore. This phenomenon is called the ‘ghost’ of the saddle-node bifurcation [9]. When two fixed points collide in a saddle-node bifurcation, slow evolution emerges in the ghost region as the key remaining property of the disappeared equilibria. The ghost region attracts and slows down the flow of nearby trajectories, delaying their transition to another attracting region in the state space. As the control parameter approaches the bifurcation value, the time spent in the vicinity of the ghost (or, equivalently, the transition time needed for the system to pass the ghost and move to some other equilibrium state) increases and diverges in a predictable manner. The scaling of the transition time with the distance from the bifurcation point in the parameter space has been extensively studied before [10, 11, 12]. Some authors [11, 13], particularly in quantum mechanics [14, 15], interpret ghosts by extending the real-valued state space of the dynamics to the space of complex-valued state variables. In this picture, two fixed points in the real-valued subspace collide and disappear from that subspace, giving rise to two repelling fixed points outside the real-valued subspace. The effect of these complex-valued repellers on the real-valued subspace, i.e., the original state space of the system, is what we identify as the ghost phenomenon. Such an approach, however, does not generalize to very complicated systems such as PDEs. Ghosts of equilibrium solutions have been investigated across a variety of applications. These include electronic circuits [16], population dynamics and catalytic hypercycles of biochemical reactions [17], the buckling of elastic solid structures [18], and understanding and predicting financial crises [19, 20], to name a few. Ghosts of equilibria play a significant role in so-called critical transitions: when the control parameter of a system, which is at a stable equilibrium state, is changed slowly toward and then beyond a critical value, where the equilibrium solution disappears through a saddle-node bifurcation or loses stability through other bifurcations, the system transitions to a new attracting region of the state space. In the case of a saddle-node bifurcation, the transition time is controlled by the ghost. This phenomenon is known as a critical transition, and the critical threshold is often referred to as the tipping point. The significance of a critical transition is that the new equilibrium state may be undesirable while, due to strong hysteresis, the transition cannot be reversed immediately by returning to a parameter value for which the desirable equilibrium exists again [21, 22]. Recently, Calsina et al. [23] considered a one-dimensional (1D) PDE model for a spatially extended population dynamics. They studied how the strength of the diffusion term in their model affects the delayed transition times to extinction. The transition time is governed by the ghost, as the parameter value is chosen close to a saddle-node bifurcation through which two other equilibria disappear and leave the uniform zero as the only attracting solution. However, the majority of previous research has investigated simple ODE systems. In this work, we formalize the ghost phenomenon by defining representative state-space structures without the necessity of being asymptotically close to the saddle-node bifurcation point in the parameter space. We term these representative structures the ‘ghost states.’ Characterizing the ghost phenomenon in terms of the representative ghost states enables us to follow three main objectives that have not been fully addressed previously. First, unlike previous works that study the ghost phenomenon as the system approaches the bifurcation point in the parameter space, we are interested in this phenomenon as the system moves away from it, so that less time is expected to be spent in the ghost region. The ghost states enable us to investigate how the ghost region evolves and whether it remains relevant to the dynamics as the control parameter is varied further from the bifurcation value. Secondly, we are interested in the ghost phenomenon in spatially extended dynamical systems governed by PDEs, such as fluid flows. We aim to explore the relevance of ghosts to both the spatial and temporal properties of the dynamics, rather than solely the temporal characteristics of delayed transitions, which have been the primary focus of previous studies. If the numerical computation of the ghost states can be scaled to high-dimensional problems, as will be demonstrated, the proposed characterization of the ghost phenomenon can be applied to high-dimensional discretizations of PDEs as well as low-dimensional ODEs. Finally, in addition to equilibrium solutions, we are interested in the ghosts resulting from the saddle-node bifurcation of time-varying invariant solutions, which has not been explored previously. We propose a family of methods that, based on a single unifying idea, defines and computes the ghost states for different types of invariant solutions. This enables us to pursue the previous two objectives for the ghosts of invariant solutions of various types. Specifically, we study the ghosts of periodic orbits as well as equilibria in the present work. We define the ghost state in the space of all sets that have the same topological structure as the invariant solutions involved in the saddle-node bifurcation. For the ghosts of equilibria and periodic orbits, this space includes all points and all loops in the state space, respectively. Within the respective search space, we formulate invariant solutions as the global minima (zeros) of a suitably defined non-negative cost function. Following this formulation, we define the ghost states as the non-zero minima of the cost function, which lift from zero as soon as the control parameter passes the bifurcation value. As the control parameter approaches the bifurcation value, the minimum value of the cost function decreases to zero, and the ghost state becomes the invariant solution itself, by construction and as expected. We demonstrate that as the control parameter is varied further from the bifurcation value, the ghost state captures the essential properties of the ghost phenomenon. Defined as such, the ghost of an equilibrium solution represents the locally slowest point in the state space at the chosen parameter value, and the ghost of a periodic orbit represents the best-fit loop to the vector field induced by the governing equations. A recently developed family of variational methods [24, 25, 26, 27] enables us to apply this approach to high-dimensional dynamical systems, including discretizations of PDEs. However, the cost functions whose minima represent the ghost states are not uniquely defined. Therefore, the ghost states are not purely a property of the dynamical system, and their exact properties depend on the specific choice of the cost function. Nevertheless, we will see that the ghost states defined based on different cost functions consistently capture the characteristics of the ghost phenomenon, providing important insight into the dynamics of a system. One particular application of ghosts is to intermittent chaos. In some instances (the type-1 transition of Pomeau and Manneville [28]), intermittent chaos is preceded by the saddle-node bifurcation of a periodic orbit. The trajectories of the subsequent chaotic attractor intermittently visit the region of the state space where the solutions formerly existed—the ghost of the bifurcation. We compute the ghost of such a periodic orbit in the Lorenz system. We demonstrate that, compared to the periodic orbit at the bifurcation point, the ghost state provides a better match with the regions of the state space frequently visited by the intermittent chaos at the studied parameter value. This paper proceeds as follows: in Sec. II, we present the mathematical background of ghosts. Section III details the general principles of the family of methods we have developed. In Sec. IV, we present several examples of applying our methods to problems of various complexities, to show the power but also the pitfalls of our methods. In Sec. V, we apply our methods to the three-dimensional (3D) Rayleigh–Bénard convection problem. We give concluding remarks in Sec. VI."
https://arxiv.org/html/2411.09667v1,Chaos in hyperscaling violating Lifshitz theories,"We holographically study quantum chaos in hyperscaling-violating Lifshitz (HVL) theories (with charge). Particularly, we present a detailed computation of the out-of-time ordered correlator (OTOC) via the shockwave analysis in the bulk HVL geometry with a planar horizon topology. We also compute the butterfly velocity (v_{B}) using the entanglement wedge reconstruction and find that the result matches the one obtained from shockwave analysis. Furthermore, we analyze in detail, the behavior of v_{B} with respect to the dynamical critical exponent (z), hyperscaling-violating parameter (\theta), charge (Q) and the horizon radius (r_{h}). We interestingly find non-monotonic behavior of v_{B} with respect to z (in the allowed region and for certain (not all) fixed, permissible values of \theta, Q and r_{h}) and \theta (in the allowed region and for certain (not all) fixed, permissible values of z, Q and r_{h}). Moreover, v_{B} is found to monotonically decrease with an increase in charge (for all permissible, fixed values of z, \theta and r_{h}), whereas it is found to monotonically increase with r_{h} (for all fixed, permissible values of z, \theta and Q). Unpacking these features can offer some valuable insights into the chaotic nature of HVL theories.","Abstract We holographically study quantum chaos in hyperscaling-violating Lifshitz (HVL) theories (with charge). Particularly, we present a detailed computation of the out-of-time ordered correlator (OTOC) via the shockwave analysis in the bulk HVL geometry with a planar horizon topology. We also compute the butterfly velocity (v_{B}) using the entanglement wedge reconstruction and find that the result matches the one obtained from shockwave analysis. Furthermore, we analyze in detail, the behavior of v_{B} with respect to the dynamical critical exponent (z), hyperscaling-violating parameter (\theta), charge (Q) and the horizon radius (r_{h}). We interestingly find non-monotonic behavior of v_{B} with respect to z (in the allowed region and for certain (not all) fixed, permissible values of \theta, Q and r_{h}) and \theta (in the allowed region and for certain (not all) fixed, permissible values of z, Q and r_{h}). Moreover, v_{B} is found to monotonically decrease with an increase in charge (for all permissible, fixed values of z, \theta and r_{h}), whereas it is found to monotonically increase with r_{h} (for all fixed, permissible values of z, \theta and Q). Unpacking these features can offer some valuable insights into the chaotic nature of HVL theories."
