URL,Title,Abstract,Introduction
https://arxiv.org/html/2411.08694v1,Intensity landscapes in elliptical and oval billiards with a circular absorbing region,"Billiard models of single particles moving freely in two-dimensional regions enclosed by hard walls, have long provided ideal toy models for the investigation of dynamical systems and chaos. Recently, billiards with (semi-)permeable walls and internal holes have been used to study open systems. Here we introduce a billiard model containing an internal region with partial absorption. The absorption does not change the trajectories, but instead reduces an intensity variable associated with each trajectory. The value of the intensity can be tracked as a function of the initial configuration and the number of reflections from the wall and depicted in intensity landscapes over the Poincaré phase space. This is similar in spirit to escape time diagrams that are often considered in dynamical systems with holes. We analyse the resulting intensity landscapes for three different geometries; a circular, elliptic, and oval billiard, respectively, all with a centrally placed circular absorbing region. The intensity landscapes feature increasingly more complex structures, organised around the sets of points that are a particular number of iteration away from the absorbing region, and enriched by effects arising from multiple absorption events for a given trajectory.","Billiard models play a prominent role in our understanding of chaos and dynamical systems. In their simplest form they consist of two-dimensional regions with hard walls at the boundary, where free particles or rays may traverse without friction and reflect from the hard walls. While the corresponding phase space is four-dimensional, the simple behaviour of the trajectories between reflections from the walls, and the scaling invariance with respect to the total momentum of a trajectory, allows for the analysis of the dynamical behaviour on a two-dimensional Poincaré section \Omega=S\times p, spanned by Poincaré-Birkhoff coordinates (S,p), characterising the points of reflection. The billiard dynamics can thus be described in the form of a symplectic map T:(S_{n},p_{n})\to(S_{n+1},p_{n+1}) on the Poincaré section, the dynamical behaviour of which is determined by the shape of the billiard boundary [1, 2, 3]. Integrable (regular) dynamics can be studied through e.g., circular and elliptical boundaries; and globally chaotic dynamics through e.g. a stadium boundary or Sinai geometries. The generic case of mixed dynamics arises in many perturbations of these shapes, such as in ovals or in billiards with an internal boundary/scatterer such as annulus or iris billiards [4, 5]. In particular the investigation of mixed and chaotic billiards and their classical maps, has played an important role in the development of the theory of quantum and wave chaos, where quantum counterparts of these systems provide important theoretical examples [6, 7, 8, 9, 10]. Experimentally these systems can be implemented for example as quasi-two-dimensional cavities for microwaves [11, 12] or for light [13, 14, 15, 16, 17]. Recently there has also been intense interest in relativistic billiards [18, 19, 20, 21]. While classical dissipative chaos is a well developed field, the study of wave chaos in the presence of loss is still in the early stages and many phenomena such as multifractal distributions of eigenstates and the fractal Weyl law are still only partially understood [22, 23, 24, 25, 26, 27, 28, 29, 30, 31, 32]. This has motivated various studies of modified classical billiard dynamics, which include a loss mechanism. In particular, leaking billiards - billiards with partial or total escape through a region in the boundary - have been studied in some detail [33, 34, 35, 36]. A hole placed at the boundary corresponds to escape through a simple rectangular area in the Poincaré section, and does not affect the mapping T, but stops the iteration of the map when the hole is first encountered. The study of escape time diagrams, where initial points on the Poincaré section are colour-coded in correspondence with the number of iterations by which they are separated from the hole, has uncovered rich dynamical structures and provided a new tool for understanding the corresponding wave systems [30]. In [37] leaking billiards with a hole in the inside of the billiard, rather than on its boundary, were studied. The dynamics again terminate on first encounter of a trajectory with the hole, and escape time diagrams and average escape times can be studied. In contrast to a hole in the boundary a hole in the interior is not connected to a static area in the Poincaré section. The behaviour of the escape times was found to depend crucially on the dynamical nature of the billiard, with characteristic features associated to chaotic versus regular cases. The concept of a partial leak, on the other hand does not terminate trajectories on encounter with the leaking region, but can be described by a loss of intensity - an additional coordinate attached to the trajectories that changes due to the leak [33, 34, 38, 31, 39]. Hitherto partial leaks have only been investigated on the boundary of the system, corresponding to losses from a static region in the Poincaré phase space. In the present paper we consider a loss region in the interior of the billiard. The loss region itself is considered spatially homogeneous and does not change the dynamics encoded in T. However, due to the finite size of the loss region, different trajectories spend different amounts of time within the loss region between iterations, leading to a nontrivial change in intensity that cannot be connected to a static area of loss in the two-dimensional Poincaré phase space. The intensity dynamics can be visualised as false colour plots on the Poincaré phase space, displaying the value of the intensity after a given number of iterations in dependence of the initial phase-space point. The resulting intensity landscapes have been found to unravel classical structures underlying quantum systems with decay in simpler model systems [31, 39]. Here we investigate billiards with elliptic and oval boundaries, (corresponding to regular and mixed chaotic-regular maps T) with a partial leak from a central circular region within the billiard. We observe that the intensity landscapes over time develop characteristics of the Poincaré section for the closed billiard, and the interplay with the absorbing region. We show that the intensity landscapes are organised around a union of sets related to the infinite absorption limit (i.e. the limit in which the absorbing region acts as a hole), and are modulated with intricate intensity variations arising from a finite absorption strength. The paper is organised as follows. We begin with a brief summary of the background and notation of the billiard dynamics expressed as a symplectic map in Poincaré-Birkhoff coordinates and introduce the concept of the intensity landscape in section II. Then we discuss the intensity landscapes in detail for three examples (circle, ellipse, and oval) in sections III, IV, and V. We finish with a short summary and outlook in section VI."
https://arxiv.org/html/2411.08511v1,"Conceptualizing the chaotic perception, demands and challenges","One propounded theory for the presence of chaos in biological neural networks is that it could be involved in discriminating different olfactory stimuli. Inspired by the idea, in this paper, we define the visual “chaotic perception” and spell out the challenges we face when conceptualizing it.","1. Defining the chaotic perception Topologically equivalent dynamical systems[1] and linking matrix of strange attractors[2] are what we need to characterize the act of recognition chaotically. Let us review topological equivalence in the first place. 1.1. Topological equivalence Assume that S is the state space of a dynamical system, and \varphi^{t}:\,S\to S,t\in\tau, \tau being a number set, is the evolution operator, which satisfies \varphi^{0}X=X,\varphi^{t+t^{\prime}}=\varphi^{t}(\varphi^{t^{\prime}}). An “orbit” (or trajectory) setting off from X_{0}\in S is an ordered subset of the state space, i.e, \{X\in S;\,X=\varphi^{t}X_{0},t\in\tau\}. Two dynamical systems are topologically equivalent if there is a homeomorphism \xi:S_{1}\to S_{2} mapping orbits of the first system onto the second one. If S\subset X, for any t\in\tau \varphi^{t}S\subseteq S is called an invariant set. Clearly, each orbit is an invariant set. Invariant subsets are stable if for any U\supset S (U a small neighborhood), there exists V (another neighborhood) such that \varphi^{t}x\in U for any x\in V,t\in T. Or, there exists U\supset S for any x\in U we have \varphi^{t}x\to S as t\to\infty. The former one is called Lyapunov stability and the latter one is said to be asymptotic stability111None of the aforementioned stabilities implies the other one.. Seeing such stable invariant sets (or attractors) as geometric objects, they are termed strange if their dimension is fractional. 1.2. Linking matrix of the strange attractors There are two sets of attributes of strange attractors, dynamical and topological. The former one, known as “old” chaos quantifiers, are fractal dimension, the metric entropy, and the spectrum of Lyapunov exponents[3]. The latter attribute, all being topological invariants (or fingerprints) of strange attractors, could be linking numbers, topological entropy, and rotation rates (if the associated phase space is \mathbb{R}^{3}\times S^{1}). Because the topological organization breaks down in higher dimensions, the finger prints are applicable merely in 3-space[2]. Let us focus on the first topological property. In a chaotic time series, there are sections that are so close to some periodic orbits. These sections are called “surrogate periodic orbits”, the stabilization of which yields Unstable Periodic Orbits (UPOs). Then, the motion on the attractor may be conceived as hopping from one UPO to another. In this paper, we choose to work with linking numbers. In principle, to find the linking matrix superpose the extracted UPOs, detect the crossings, and use the conventions depicted in fig. 1. The linking number is half the sum of the assigned crossings L(\mathcal{A},\mathcal{B})=\frac{1}{2}\sum_{i}\alpha_{i}(\mathcal{A},\mathcal{% B}), \mathcal{A}, and \mathcal{B} are two UPOs. Self-linking number, on the other hand, is defined to be L(\mathcal{A},\mathcal{A})=\sum_{i}\alpha_{i}(\mathcal{A},\mathcal{A}). The linking Matrix will be of the form \NiceMatrixOptionscode-for-first-row = ,code-for-first-col= (1.1) \mathrm{M}=\pNiceArray{>{}ccccc}[first-row,first-col=1,margin,extra-margin=2pt% ,colortbl-like]&p_{1}p_{2}p_{3}p_{4}\cdots\\ p_{1}SL_{11}L_{12}L_{13}L_{14}\cdots\\ p_{2}L_{12}SL_{22}L_{23}L_{24}\cdots\\ p_{3}L_{13}L_{23}SL_{33}L_{34}\cdots\\ p_{4}L_{14}L_{24}L_{34}SL_{44}\vdots\\ \cdots\vdots\vdots\vdots\vdots\ddots. Figure 1. +,- are not affected by clockwise and counter-clockwise rotations. While linking numbers are topological invariants, the self-linking numbers are not unless the underlying cyclic phase space is of type \mathbb{R}^{2}\times S^{1}. 1.3. Global topological equivalence and chaotic perception While topological equivalence of dynamics can be local, having two strange attractors with the same linking matrix will refer to such equivalence globally. One possible usage of global equivalence could be in face recognition, in a narrow sense of course. After descrying the presence of chaos in biological neural networks[4], “Which artificial networks are generative of chaos?”, “What does chaos justify in real networks?” have been among researchers’ concerns. One suggested theory for this latter question is chaotic perception. Initially, in the late 80s, the functionality of discrimination was credited to limit cycles[5]. Then, Ashwin and Timme argued that chaos might afford a means to discriminate different olfactory stimuli[6]. In their paper[7], Marro and colleagues proposed a model for dynamic associative memory based on hopping from regularity to irregularity (chaos), the latter mimicking the brain states of attention and searching. Suppose we are to recognize a person from a group of people. From experience, we know that the brain is so fast in doing so, a trait that is justified thanks to face symmetry (hence minimizing the information) and other distinguishing factors like gender, age, color, stature, and facial shape. Now, what if we are to distinguish identical twins? In case we do not have any of the mentioned features to resort to, how does a brain decide who is who? This is the place we may hypothesize that low-dimensional strange attractors may come to help the following way. Chaotic perception. Seeing objects of perception as invariant sets of fractal dimension, we may see the act of recognition as the comparison of the fingerprints of two globally equivalent strange attractors, one constructed and saved already when learning the object and the other one reconstructed at the time of perceiving the object. The topology of chaos teaches us that linking matrices are fingerprints of attractors with unique off-diagonal and non-unique diagonal entries. While the former entries may refer to the twins as a group, the latter would designate a matrix for each group member."
https://arxiv.org/html/2410.23971v1,"Stochastic Reconstruction of Gappy Lagrangian Turbulent Signals 
by Conditional Diffusion Models","We present a stochastic method for reconstructing missing spatial and velocity data along the trajectories of small objects passively advected by turbulent flows with a wide range of temporal or spatial scales, such as small balloons in the atmosphere or drifters in the ocean. Our approach makes use of conditional generative diffusion models, a recently proposed data-driven machine learning technique. We solve the problem for two paradigmatic open problems, the case of 3D tracers in homogeneous and isotropic turbulence, and 2D trajectories from the NOAA-funded Global Drifter Program. We show that for both cases, our method is able to reconstruct velocity signals retaining non-trivial scale-by-scale properties that are highly non-Gaussian and intermittent. A key feature of our method is its flexibility in dealing with the location and shape of data gaps, as well as its ability to naturally exploit correlations between different components, leading to superior accuracy, with respect to Gaussian process regressions, for both pointwise reconstruction and statistical expressivity. Our method shows promising applications also to a wide range of other Lagrangian problems, including multi-particle dispersion in turbulence, dynamics of charged particles in astrophysics and plasma physics, and pedestrian dynamics.",".1 Conditional DMs for reconstruction Here we give a detailed description of the C-DMs used in this work to reconstruct Lagrangian trajectories from partial velocity measurements. As briefly introduced above, C-DMs consist of two main processes: the forward and the backward process, see Fig.8a. The one-step forward transition probability can be written as: q(\mathcal{V}^{(n)}_{g}|\mathcal{V}^{(n-1)}_{g})\to\mathcal{V}^{(n)}_{g}\sim% \mathcal{N}(\sqrt{1-\beta_{n}}\mathcal{V}^{(n-1)}_{g},\beta_{n}\bm{I}), (12) where the initial realization inside the gap coincides with the ground truth signal, \mathcal{V}^{(0)}_{g}=\mathcal{V}_{g}, and the variance schedule, \{\beta_{1},\ldots,\beta_{N}\}, is predefined to progressively destroy the correlations between the data in the gap and the measured signal, \mathcal{V}_{m}, resulting in a smooth transition to the pure Gaussian state, \mathcal{V}^{(N)}_{g}\sim\mathcal{N}(0,\bm{I}). We can formally express the forward process as q(\mathcal{V}^{(1:N)}_{g}|\mathcal{V}^{(0)}_{g})\coloneqq\prod_{n=1}^{N}q(% \mathcal{V}^{(n)}_{g}|\mathcal{V}^{(n-1)}_{g}), (13) where the notation \mathcal{V}^{(1:N)}_{g} denotes the entire sequence of noisy trajectories, \{\mathcal{V}^{(1)}_{g},\mathcal{V}^{(2)}_{g},\dots,\mathcal{V}^{(N)}_{g}\}, generated from the initial trajectory \mathcal{V}^{(0)}_{g} in the gap. Note that the data within the measurement region is never accessed in the forward process. The backward process models each step of the denoising conditional probability given measurements outside the gap, p_{\theta}(\mathcal{V}^{(n-1)}_{g}|\mathcal{V}^{(n)}_{g},\mathcal{V}_{m}), using a neural network with parameters \theta. Once trained, the C-DM reconstructs the trajectory within the gap, starting from pure Gaussian noise, \mathcal{V}^{(N)}_{g}, and conditioning on the measurements, \mathcal{V}_{m}, by iteratively reversing the forward diffusion process as introduced in Eq. (1). In the continuous diffusion limit, where a large number of diffusion steps are used and the noise variance \beta_{n} is chosen to be small, we can assume that the backward transition probability, p_{\theta}(\mathcal{V}^{(n-1)}_{g}|\mathcal{V}^{(n)}_{g},\mathcal{V}_{m}), follows the same Gaussian functional form as the forward step [80, 81]. The neural network is then tasked with predicting the mean, \mu_{\theta}(\mathcal{V}^{(n)}_{g},\mathcal{V}_{m},n), and the covariance, \Sigma_{\theta}(\mathcal{V}^{(n)}_{g},\mathcal{V}_{m},n), for each denoising step. Following [61], we set \Sigma_{\theta}=\beta_{n}\mathbf{I}, using step-dependent constants that remain untrained. Consequently, each one-step backward sampling is reformulated as: p_{\theta}(\mathcal{V}^{(n-1)}_{g}|\mathcal{V}^{(n)}_{g})\to\mathcal{V}^{(n-1)% }_{g}\sim\mathcal{N}(\mu_{\theta}(\mathcal{V}^{(n)}_{g},\mathcal{V}_{m},n),% \beta_{n}\bm{I}). (14) The model optimization is performed by minimizing a variational upper bound on the negative log-likelihood, as in standard generative DMs. The additional conditioning is explicitly expressed in both the target distribution, p(\mathcal{V}_{g}|\mathcal{V}_{m}), and the approximated distribution, p_{\theta}(\mathcal{V}^{(0)}_{g}|\mathcal{V}_{m}): \mathbb{E}_{p(\mathcal{V}_{g}|\mathcal{V}_{m})}[-\log(p_{\theta}(\mathcal{V}^{% (0)}_{g}|\mathcal{V}_{m}))]. (15) A detailed derivation of the loss function can be found in [58, 50]. The backbone neural network for the C-DMs in this work is based on a U-Net architecture [82], building upon the design previously used for unconditional Lagrangian turbulence generation [50]. To incorporate conditioning on the measurements, the input is modified as a combination of the measurement data and the noisy generation inside the gap, \mathcal{V}_{m}\cup\mathcal{V}_{g}^{(n)}, with additional channels that consist of the measurement and random noise within the gap. Fig. 8 provides a graphical representation of the U-Net architecture and its role in the C-DM refilling process. The U-Net architecture consists of two main components: a downsampling stack and an upsampling stack, which are arranged symmetrically. Both stacks perform four steps of downsampling and upsampling respectively, resulting in five stages from left to right for each stack. Across these five stages, the residual blocks are configured with channel sizes of \{1C,1C,2C,3C,4C\}, where C is 128. The last two stages of both stacks contain multi-head attention blocks, each with four heads. Connecting the downsampling and upsampling stacks is an intermediate module containing two residual blocks surrounding a central four-head attention block. The optimal noise schedule from [50] is applied, with a total of N=800 diffusion steps. Each specific C-DM case is trained with a batch size of 256 on four NVIDIA A100 GPUs, taking approximately 24 hours. (a)(b) Figure 8: (a) Schematic of the C-DM protocol for turbulent signal reconstruction. In the forward process (from right to left), noise is gradually added to the signal within the unknown region, \mathcal{V}_{g}=\mathcal{V}_{g}^{(0)}, over N steps according to a predefined schedule. The noisy signal at step n within the gap, \mathcal{V}_{g}^{(n)}, is represented by green lines. Partial measurements, \mathcal{V}_{s}, are represented by black points (for interpolation, top) or black lines (for gap filling, middle). In the backward process (from left to right), reconstruction starts with pure noise within the gap, \mathcal{V}_{g}^{(N)}, which is combined with the measurements to progressively denoise the missing information using the trained neural network. (b) The U-Net architecture of the neural network for a denoising step, p_{\theta}(\mathcal{V}^{(n-1)}_{g}|\mathcal{V}^{(n)}_{g},\mathcal{V}_{m}). The noisy signal at step n, \mathcal{V}_{g}^{(n)}, is first combined with the measurements to form a complete signal, which is then concatenated along the channel dimension with a signal consisting of the measurements outside the gap and random noise inside the gap. The network output has the length of a full signal, and only the part inside the gap is filtered out as \mathcal{V}_{g}^{(n-1)}."
https://arxiv.org/html/2411.07522v1,Protected chaos in a topological lattice,"The erratic nature of chaotic behavior is thought to erode the stability of periodic behavior, including topological oscillations. However, we discover that in the presence of chaos, non-trivial topology not only endures but also provides robust protection to chaotic dynamics within a topological lattice hosting non-linear oscillators. Despite the difficulty in defining topological invariants in non-linear settings, non-trivial topological robustness still persists in the parametric state of chaotic boundary oscillations. We demonstrate this interplay between chaos and topology by incorporating chaotic Chua’s circuits into a topological Su-Schrieffer-Heeger (SSH) circuit. By extrapolating from the linear limit to deep into the non-linear regime, we find that distinctive correlations in the bulk and edge scroll dynamics effectively capture the topological origin of the protected chaos. Our findings suggest that topologically protected chaos can be robustly achieved across a broad spectrum of periodically-driven systems, thereby offering new avenues for the design of resilient and adaptable non-linear networks.","Chaotic dynamics, despite being notoriously unpredictable and sensitive to initial conditions [1], govern the behavior of many complex systems [2, 3] such as networks of coupled oscillators and dynamical non-linear lattices [4, 5, 6, 7, 8]. In such coupled dynamical networks, even small perturbations are amplified rapidly, leading to complex global behaviors [4, 9, 10]. While synchronization can appear at times, chaos, with its inherent unpredictability, disrupts this order and makes the system decidedly irregular in the long run. However, we discover that this well-established pattern of behavior may no longer hold when a network of coupled chaotic oscillators is arranged in a topological manner. Despite the lack of well-defined band topological invariants in non-linear systems, we find that topological robustness potently persists, even as chaotic behavior introduces randomness that would erode the bulk periodicity and threaten any semblance of topological bulk-boundary correspondence. Surprisingly, not only can topological robustness be well-preserved in certain chaotic systems, it even protects chaotic oscillations from strong perturbations, demonstrating a parametric robustness inherited from band topology. This protection stems from the stability of non-trivial edge oscillations, whose absence would lead to the rapid decay of bulk chaotic attractors, as observed in the case of trivial edge oscillations. In this work, we choose chaotic Chua circuits among various potential candidates to implement the Lorenz system, as they offer an experimentally accessible and easily tunable platform for investigating chaotic dynamics [11, 12, 13]. Identical Chua circuits are coupled such that they form a one-dimensional topological Su-Schrieffer-Heeger (SSH) circuit array with onsite chaotic Chua oscillators [14, 15, 16, 17, 18, 19, 20, 21, 22]. In our setup, the degree of non-linearity can be adjusted by tuning the current-voltage characteristics of the Chua diodes, with high non-linearity typically expected to substantially distort linear eigenstates. In non-linear systems, a key challenge in attributing robustness to band topology is the difficulty in defining bulk topological invariants [23], which are inherently properties of linear band structures. To overcome this, we continuously deform the Chua circuit array from its linear SSH limit by tuning its non-linear Chua diodes. Notably, the topological edge oscillations are preserved remarkably well even deep into the non-linear regime. This allows for the identification of non-linear topological boundaries, which can be made further precise with the aid of machine learning techniques. Importantly, we emphasize that although we shall demonstrate topologically protected chaos only with Chua circuits, this novel form of robustness is not specific to the Lorenz equations, and extends generally to chaotic attractors with well-defined bounded oscillations. Furthermore, the physical implementation is applicable to any medium which can host the requisite non-linear dynamics, not just electronic circuit metamaterials. As such, our discovery of topologically protected chaos also opens up new possibilities in fields as diverse as neural networks [24, 25], chaotic quantum dynamics [26] and mechanical metamaterials [27]."
