URL,Title,Abstract,Introduction
https://arxiv.org/html/2411.06755v1,Complexity measure of extreme events,"Complexity is an important metric for appropriate characterization of different classes of irregular signals, observed in the laboratory or in nature. The literature is already rich in the description of such measures using a variety of entropy and disequilibrium measures, separately or in combination. Chaotic signal was given prime importance in such studies while no such measure was proposed so far, how complex were the extreme events when compared to non-extreme chaos. We address here this question of complexity in extreme events and investigate if we can distinguish them from non-extreme chaotic signal. The normalized Shannon entropy in combination with disequlibrium is used for our study and it is able to distinguish between extreme chaos and non-extreme chaos and moreover, it depicts the transition points from periodic to extremes via Pomeau-Manneville intermittency and, from small amplitude to large amplitude chaos and its transition to extremes via interior crisis. We report a general trend of complexity against a system parameter that increases during a transition to extreme events, reaches a maximum, and then starts decreasing. We employ three models, a nonautonomous Liénard system, 2-dimensional Ikeda map and a 6-dimensional coupled Hindmarh-Rose system to validate our proposition.","The knowledge of extreme events, particularly in deterministic dynamical systems, has advanced significantly during the past three decades[1, 2, 3, 4, 5, 6]. Recent studies have primarily focused on real-world extreme phenomena. Extreme events are recognized as significantly large occasional deviations from long-term nominal behavior. The large deviations are short-living but occur recurrently or non-recurrently. Such extremes often have a size of more than 4 to 8 times the standard deviation of mean event size [7]. These phenomena have been studied across various disciplines, including oceanography [8, 9], climate science [10], sociology, economics [11, 12] and natural events like floods [13], earthquake and forest fire, for many years[14]. Since then a number of studies have been made on extreme events in a variety of systems including experiments such as optical fiber [15], laser systems [16, 17, 18, 19], mechanical systems [20, 21], electronic circuits [22, 23], and other systems [24, 25]. To develop a better understanding of extreme events, in general, the dynamical models are often used as basic tools for studies in addition to dealing with real-world data. These efforts led to finding tools which are now able to explain the origin of extremes in high-dimensional systems and networks of systems [26, 27, 28] and more complex natural events [5, 3]. The primary concern of extreme events research is to predict the time of arrival of such extremes and to address the most difficult question of predicting the magnitude of events. We address here another important question how to measure complexity that may distinguish extreme events from non-extreme complex dynamics such as the nominal chaos and if possible, locate the transition point from non-extreme to extreme events and vice versa in a parameter space. It is expected that complexity of extreme events shall be different due to the presence of occasional larger events, and distinguishable from nominal chaos when the trajectory is bounded in state space. The existing complexity measures depend primary on three categories of metrics, namely, Lyapunov exponent (LE) [29], fractal dimension [30, 31] and entropy [32, 33] that are usually used for chaos in deterministic dynamical systems. Researchers from other disciplines, physiology [34], painting [35], and machine learning [36], showed interest in identifying the complexity of signals from the general entropy measure. We emphasize here on Shannon entropy, which has been mainly proposed [37] as a measure of information content in a communication channel, however, it has also been used later for divergence measures [38]. Several other measures [39] have been developed from the Shannon entropy and used more frequently to characterize and for a possible quantification of complexity of dynamical systems’ behaviors from time series data. It includes, but is not limited to, topological entropy that measures the exponential growth rate of the systems’ distinguishable orbits [40], Kolmogorov–Sinai entropy that measures chaos and complexity of motion that occurs in dynamical systems [41]. However, the Shannon entropy itself, based on symbolic dynamics [42] or recurrence plot [43] although naturally produced large increase in complexity during a transition from periodic to chaotic state with a large amplitude, but they failed to recognize the emergence of extremes against a change of parameter. On the other hand, permutation entropy (PE) was proposed [44] as an important complexity measure basing on identification of ordinal patterns and their probability in a data sequence. The PE has dependence on selective parameters, namely, the embedding dimension and time delay. From a close look at the results presented earlier [44, 45], it is noticed that PE shows a large change of complexity during a transition from periodic or small amplitude to large amplitude chaos at least in the logistic map. The complexity then slowly increases reaching a saturation against the system parameter. Alternatively, entropy and disequilibrium have been combined [46, 47] for statistical complexity measure of observed signals in many systems. Disequilibrium is based on Euclidean distance [46], Wootters distance [48], entropy of Kullback-Shannon (or Tsallis or Rényi) [49], and the divergence of Jensen-Shannon (or Tsallis or Rényi) [50]. In a recent study, PE in combination with Jensen-Shannon disequilibrium was used [51] to measure complexity of chaos in logistic map. This work was also successful to record both the sudden large change in complexity during transitions from low amplitude chaos to large amplitude chaos against a parameter and the transition from periodic to large amplitude chaos in another parameter range. Once again, complexity increases sharply from small amplitude to large amplitude chaos and then saturates against a system parameter. A similar trend is seen during a transition from periodic to large amplitude chaos. However, none of the earlier works [42, 43, 44, 45, 51] dealt with systems or time series that showed occasional extremely large amplitude events. We are concerned about signals that show occasional large events. How complex are the extreme events and it changes during transitions from periodic to large amplitude chaotic state via PM intermittency [52] and low amplitude chaos to large amplitude chaos via interior crisis [53] when signature of extreme events does appear? Three exemplary systems that show origin of extreme events, are used for numerical validation of our proposed measure: Forced Liénard system [54], the Ikeda map [55] and a 6-dimensional coupled spiking-bursting Hindmarsh-Rose (HR) systems [56, 57] that shows a more complex basin structure [58]. We consider the product of Shannon entropy and disequilibrium that provides a consistency in complexity measure. The Shannon entropy is preferred to PE since it records information of each local maxima of a time series or a data sequence and then takes care of their probability measures. In PE measure, information on occasional large events are missing during symbolic representation of data sequence in search of ordinal patterns. We plot the bifurcation diagram for each of the considered systems against a parameter and delineate the regions of transitions via PM intermittency and interior crisis when extreme events appear. And capture the corresponding signal or time series (long enough) for each parameter and take care of each events (local maxima) in a time series or data sequence so that no information on the occasional large events are missed or ignored. Then we derive the normalized Shannon entropy and disequlibrium to estimate complexity as a product of both. We plot the complexity measure against a parameter and compare with the bifurcation diagram of each of the systems. The complexity shows a sharp increase during the PM intermittency when a transition occurs from periodicity to large amplitude chaos with the presence of occasional extreme events. After reaching a maximum against a parameter, complexity continues to decrease slowly with a transition to non-extreme chaos. Similarly, during the interior-crisis, we find a sharp rise in complexity during the transition from small amplitude chaos to large amplitude chaos with occasional extremes and then a slow decrease in complexity against a parameter after reaching a maximum. Our results show a trend of complexity different from the earlier reports [44, 45, 46, 47, 51]. and justify a trend of slow decrease in complexity beyond the regime of extreme events when the occasional large events gradually become more and more frequent. Thereby we are able to distinguish non-extreme chaotic events and extreme events and, their transitions against a parameter. For all the three systems, a similar trend is found for the two different nonlinear processes of origin of extreme events."
https://arxiv.org/html/2411.06199v1,"Control of the classical dynamics of a particle in the 
Morse-soft-Coulomb potential","We introduce the one-dimensional Morse-soft-Coulomb (MsC) potential consisting of a Morse repulsive barrier smoothly connected with a soft-core Coulomb potential at the origin. This new potential has a single parameter that controls the softness of the repulsive barrier and the well depth. When this softening-depth parameter tends to zero, the MsC potential approaches the Coulomb potential with an infinite repulsive barrier, a known successful model for the hydrogen atom. We investigate the classical chaotic dynamics of the MsC potential subjected to time-dependent external fields, comparing the results with the Coulomb potential. We show that the MsC potential reproduces the dynamics and the ionization probabilities of the Coulomb potential for sufficiently small values of the softening parameter. We also investigate the role of the softening parameter in the phase-space structures, showing that the increasing of its value leads to the increasing of the chaotic sea and consequently to the rise of the ionization probability. Finally, we address the problem of controlling the dynamics of a particle in the MsC potential from the perspective of optimal control theory, which cannot be easily applied in the case of the Coulomb potential due to the singularity at the origin. We analize a particular optimal solution to the problem of transferring a given amount of energy to the system at minimum cost. Our results show that the MsC potential can be a useful simple model for investigating the hydrogen atom.","One-dimensional model potentials are of fundamental importance for Physics since they contribute to a clear understanding of diverse complex atomic and molecular processes such as ionization and dissociation [1, 2, 3, 4, 5]. Standard examples are the Morse potential and the one-dimensional Coulomb potential used, respectively, in the study of dissociation of diatomic molecules and ionization of the hydrogen atom [6, 7, 8, 9, 10, 11, 12]. These models in conjunction with the tools of classical nonlinear dynamics provide important means of gaining physical insight in complicate situations. In particular, the classical approach has been proved to be a powerful tool for analysing the ionization of hydrogen atoms. For instance, the classical driven one-dimensional hydrogen atom yields good agreement with the experimentally determined ionization thresholds [13, 14, 15]. Nonlinear dynamics provides a general description for the escaping of a particle from a potential well, which can be regarded as atomic ionization or molecular dissociation depending on the model potential [8, 16, 17, 18, 19]. In the absence of external fields, the phase space is composed by a bound region, where the particle undergoes periodic motion, and by an unbound region, where the particle can depart from the potential well. Periodic time-dependent external fields can induce transitions from the bound to the unbound region by means of chaotic routes. For small field strength, some invariant curves remain in phase space, the so-called Kolmogorov–Arnold–Moser (KAM) tori, except in the vicinity of the nonlinear resonances, where resonance islands emerge enclosed by a localized chaotic regions. In this scenario, no escaping occurs, since the motion is still restricted in phase space. However, with increasing field strength, the resonance islands grows and overlap each other leading to the destruction of the KAM tori. The phase-space is then dominated by resonance islands and by a connected chaotic sea, where the particle can diffuse erratically and eventually escapes from the potential well. Although this the the main known escaping mechanism, we mention in passing that there exist also nonchaotic routes which leads to the escaping of the particle through deformed KAM tori [20]. When referring to the one-dimensional hydrogen atom model, two distinct Coulomb-like potentials are often considered: one is symmetric around the origin V(r)\propto-1/|r|, and the other has an infinite repulsive barrier at the origin V(r)\propto-1/r, such that the particle is constrained to move in the positive semi-axis r\geq 0. In both cases, the singularity has to be tackled to perform numerical calculations and to this end some techniques based on extended phase space have been developed [21, 22]. However, the issue with the singularity becomes more severe, or even prohibitive, when one tries to apply optimal control theory to these problems because the associated Euler-Lagrange equations involves spatial derivatives of the potential function. Since the optimal control of classically chaotic system is an important part of the control of molecular system [23, 24, 25], alternative approaches to the classical control of these singular potentials should be developed. To circumvent the singularity problem in the case of the symmetric Coulomb potential, Eberly and co-workers proposed the soft-Coulomb potential V(r)\propto-1/\sqrt{r^{2}+\alpha^{2}}, a well-behaved potential with a softening parameter \alpha [26, 27, 28, 29, 30, 2, 31, 32]. However, there has been no singularity-free, simple potential to mimic the Coulomb potential with an infinite repulsive barrier. To fill this gap, we introduce the Morse-soft-Coulomb (MsC) potential consisting of a Morse repulsive barrier smoothly connected with a soft-core Coulomb potential at the origin. This potential is differentiable up to second order while possessing a single parameter that sets the softness of the repulsive barrier and the well depth. The MsC potential approaches the Coulomb potential with an infinite repulsive barrier as the softening-depth parameter tends to zero. We consider the chaotic dynamics of the MsC potential subjected to harmonic driving field and show that the MsC potential reproduces the dynamics and the ionization probabilities of the Coulomb potential for small values of the softening parameter. We analyze the impact of the softening parameter in the phase-space structures, verifying that the increasing of its value leads to the increasing of the chaotic sea and to the rise of the ionization probability. We also address the problem of controlling the dynamics of a particle in the MsC potential using optimal control theory. We consider the problem of transferring a given amount of energy to the system at minimum effort and investigate a particular solution, termed intrinsic optimal solution [33]."
https://arxiv.org/html/2411.07005v1,"Detecting time-irreversibility in multiscale systems: 
correlation and response functions in the Lorenz96 model","Due to their relevance to geophysical systems, the investigation of multiscale systems through the lens of statistical mechanics has gained popularity in recent years. The aim of our work is the characterization of the nonequilibrium properties of the well-known two-scales Lorenz96 model, a dynamical system much used for testing ideas in geophysics, by studying either higher-order correlation functions or response to external perturbations of the energy. These tools in both equilibrium (inviscid) or non-equilibrium (viscous) systems provide clear evidence of their suitability for detecting time-reversal symmetry breaking and for characterizing transport properties also in this class of models. In particular, we characterize how localized energy perturbations are transported between the different scales, highlighting that perturbations of synoptic variables greatly impact advective variables but perturbations of the latter have a practically negligible effect on synoptic scales. Finally, we show that responses of global observables to finite size perturbations strongly depend on the perturbation protocol. This prevents the physical understanding of the system from observations of the relaxation process alone, a fact often overlooked.","The study of geophysical phenomena is notoriously challenging for both mathematicians and physicists. The inherent complexity can be attributed to the nontrivial interactions existing between the system components possessing different length and time scales, but also to the mere difficulty (even computational) of properly taking into account the enormous amount of variables needed to describe any relevant observable. These difficulties could be overcome with a clever modelization of the phenomenon, having the twofold aim of simplifying the interactions appearing in the original equations and reduce the number of degrees of freedom. Naturally the procedure of discarding variables and interactions is rather delicate: the resulting equations still need to be a valid approximation of the original ones, and have to reproduce as faithfully as possible the features (either dynamical or statistical) of our system. E. N. Lorenz clearly understood the advantages of simplified models Lorenz (2005) to gain some insight on complex phenomena, especially when dealing with geophysical flows. The “Lorenz63 model"" Lorenz (1963), a hyper-simplified modelization of thermal convection, had an enormous impact on chaos theory and fluid mechanics, and arguably represents the prototypical chaotic model for most computational studies. Less popular, yet with quite a considerable influence, is another model that became known as “Lorenz96"" Lorenz (1995). The original aim was the study of atmospheric predictability, and the possibility to gain information about the spreading of initial small uncertainties by exploiting dynamical models attempting to reproduce atmospheric circulation. Lorenz presented two versions of the model. He first introduced a single-scale model where the dynamical variables, placed along a latitude circle, have asymmetric nonlinear couplings and are subject to constant forcing and linear damping. The combination of these three actions can roughly account for most geophysical phenomena taking place in the atmosphere. In the same work, Lorenz also proposed a two-scales version of the model, where the interacting variables have either slow or fast dynamics. Resolving the faster scales as well should make the model more adherent to real physics. The wide influence of the Lorenz96 model is proved by the plethora of works which adopted it as the core of their studies or as a case study for applying new concepts. It was employed likewise in physics Boffetta et al. (2000); Lacorata and Vulpiani (2007); Karimi and Paul (2010); Gallavotti and Lucarini (2014); van Kekem and Sterk (2018), mathematics Orrell and Smith (2003); Stappers and Barkmeijer (2012); de Leeuw et al. (2018); Kerin and Engler (2020) and geosciences Basnarkov and Kocarev (2012); Sterk et al. (2012); Carlu et al. (2019), just to mention a few. In this work we are interested in the characterization, in the two-scales Lorenz96 model, of temporal nonequilibrium properties as revealed by two effective indicators of the absence of statistical equilibrium: high-order time correlation functions Pomeau (1982) and response functions Kubo (1966); Marconi et al. (2008). There are several reasons for choosing the Lorenz96 model for our purposes: the presence of nonlinear interactions between variables hinders the use of the solid theoretical framework built for linear systems, thereby making necessary the use of computer simulations. Since we have access to the explicit evolution equations, we can choose to study the ‘standard’ model, namely a driven dissipative system, which is far from statistical equilibrium, or else the ‘reversible’ model, where damping and external forcing are put to zero and the total energy is a global conserved quantity, so that the system is in statistical equilibrium in the microcanonical sense. In the following we will refer to the original model as “viscous"" or “irreversible"" Lorenz96, and to the model without forcing and damping as “inviscid"" or “reversible"" Lorenz96. In this respect, it becomes especially interesting to analyze the differences between the two above-mentioned indicators when they refer to the former or the latter version of the model. Non-symmetric third-order time correlation functions provide results that fit well with recent studies Lucente et al. (2023a); Cocciaglia, Cencini, and Vulpiani (2024), for what concerns their ability to discriminate between statistical equilibrium and nonequilibrium: correlation functions in the reversible model show very small deviations from zero, while the same functions in the irreversible model are characterized by a large short-time peak followed by relaxation to zero, thus the time dependence is more nontrivial. The second indicators, namely the response functions Marconi et al. (2008) of the ‘local’ (related to a single d.o.f.) energies, reveal interesting dynamical properties. Specifically, the spreading of an initially-localized energy perturbation highlights the presence of statistical fluxes that behave as travelling waves. This happens only in the irreversible model, while in the reversible case the response functions display an asymptotic approach to equipartition, as expected from equilibrium statistical mechanics considerations. The paper is structured as follows: in Sec. II we introduce the model and delineate the main differences between the reversible and irreversible versions. In Sec III, the statistical properties of the system are characterized through the lens of non-equilibrium statistical mechanics. In particular, Sec. III.1 deals with higher-order correlation functions while Sec. III.2 examines the responses of the system to external perturbations. Finally, in Sec. IV we draw the main conclusions and present possible perspectives."
