URL,Title,Abstract,Introduction
https://arxiv.org/html/2411.10097v1,Analysis of multistability in discrete quantum droplets and bubbles,"This study investigates the existence and stability of localized states in the discrete nonlinear Schrödinger (DNLS) equation with quadratic and cubic nonlinearities, describing the so-called quantum droplets and bubbles. Those states exist within an interval known as the pinning region, as we vary a control parameter. Within the interval, multistable states are connected through multiple hysteresis, called homoclinic snaking. In particular, we explore its mechanism and consider two limiting cases of coupling strength: weak (anti-continuum) and strong (continuum) limits. We employ an asymptotic and a variational method for the weak and strong coupling limits, respectively, to capture the pinning region’s width. The width exhibits an algebraic and an exponentially small dependence on the coupling constant for the weak and strong coupling, respectively. This finding is supported by both analytical and numerical results, which show excellent agreement. We also consider the modulational instability of spatially uniform solutions. Our work sheds light on the intricate interplay between multistability and homoclinic snaking in discrete quantum systems, paving the way for further exploration of complex nonlinear phenomena in this context.","While one-dimensional solitons of the nonlinear Schrödinger (NLS) equation are robust localized wave packets and the ground state of the model [1], the corresponding multidimensional solitons, including fundamental and higher-order states with topological structures, are different. In this multidimensional setting, the common cubic self-attractive nonlinearity typically yields completely unstable solitons [2, 3]. This instability arises from the tendency for critical and supercritical collapse in the respective dimensions, leading to singular solutions via catastrophic wave collapse (self-compression) [4]. Therefore, a significant focus lies on developing physically relevant scenarios enabling stabilization of both fundamental and topologically structured multidimensional self-trapped localized modes as they would offer characteristics that would be inaccessible in the one-dimensional case, such as higher-dimensional self-trapped states with topological charge (intrinsic vorticity) [5]. A promising approach to address this challenge was recently proposed theoretically in [6], based on utilizing quantum fluctuations as a correction to the mean-field behavior of Bose-Einstein condensates (BEC), which was initially forecasted by Lee, Huang, and Yang [7]. The proposal was subsequently realized experimentally in quantum droplets, magnetic quantum gases, and dipolar supersolids; see, e.g., the reviews [8, 9]. The Lee-Huang-Yang effect manifests through local quartic self-repulsive terms within the corresponding NLS equations in the mean-field approximation. A localized state that would typically collapse is now sustained by this interplay between mean field attraction and Lee-Huang-Yang repulsion, and one has a superfluid state characterized by a density constrained to remain below a specific maximum value, rendering it incompressible. Hence, this quantum macroscopic state is classified as a fluid and is referred to as “quantum droplets” [10]. In cigar-shaped and pancake-shaped BECs, which appear in a three-dimensional setting, each system can be effectively described by one-dimensional and two-dimensional NLS equations, respectively. Consequently, under tight confinement imposed by an external potential in one direction or more, one can change the form of the effective NLS equation and create lower-dimensional droplets. In the one-dimensional limit, the Lee-Huang-Yang term exhibits quadratic self-attraction instead of being quartic in the original three-dimensional setup [11]. Dynamics and characteristics of one-dimensional quantum droplets are studied in [12], whereby upon solving the associated amended Gross-Pitaevskii equation, the authors identified two physically distinct regimes that correspond to small droplets of a Gaussian-like shape and large puddles with a broad flat-top plateau. Furthermore, Zhou et al. [13] studied them in the presence of linear optical lattice, where they interestingly observed multi-stability and stability change between onsite and off-site solitons. It was later shown that the multi-stable droplets are connected in a multi-hysteresis fashion [14] and exist in a finite interval of band-gap. Kartashov and Zezyulin [15] also considered bright solitons in a linear optical lattice and showed enhanced mobility with alternating mobility and immobility bands related to soliton multistability. Additionally, Zhao et al. [16] considered when the lattice is deep, and the NLS equation effectively becomes a discrete model, demonstrating that multistability is also present. The multistability reported in [13, 14, 16] belongs to the phenomenon of pinning observed in many nonlinear dynamical systems with bistability of two or more uniform states (see, e.g., [17, 18] and references therein). In such systems, a front linking these states typically undergoes directional drift, depending on which state is preferred. However, there is no preference between the two states at a specific parameter value, resulting in a stationary front. This point is known as the Maxwell point, occurring when the two states have equal energy. Placing two fronts back-to-back creates a localized state, and the bifurcation diagram, plotting the length of this localized solution against a control parameter, exhibits a snaking structure. This structure involves a sequence of turning point bifurcations in near-perfect alignment over a range of parameter values around the Maxwell point, forming what is known as the pinning region. Since the spatial structure of such a localized state departs from and returns to a uniform state, this phenomenon is named homoclinic snaking [19]. The present paper aims to analyze homoclinic snaking and pinning regions of discrete quantum droplets. We also consider localized solutions called holes/dark notches/quantum bubbles. The main results of our report are the mechanism behind the snaking and the asymptotic width of the pinning region of the two solution kinds in two limiting cases, i.e., strong and weak coupling between the wave packets. The paper is structured as follows. We introduce the model for the dynamics of discrete quantum droplets in Section 2. We also analyze the uniform solutions of the model in the same section. We analyze the existence of localized states, i.e., discrete quantum droplets and quantum bubbles, in Section 3. The multistability of these states that form homoclinic snaking is also reported numerically in the section. We present our asymptotic analysis of the snaking in Section 4. Finally, we conclude our work in Section 5."
https://arxiv.org/html/2411.10376v1,Soliton Dynamics over a Disordered Topography,"We report on the dynamics of a soliton propagating on the surface of a fluid in a 4-m-long canal with a random or periodic bottom topography. Using a full space-and-time resolved wavefield measurement, we evidence, for the first time experimentally, how the soliton is affected by the disorder, in the context of Anderson localization, and how localization depends on nonlinearity. For weak soliton amplitudes, the localization length is found in quantitative agreement with a linear shallow-water theory. For higher amplitudes, this spatial attenuation of the soliton amplitude is found to be enhanced. Behind the leading soliton slowed down by the topography, different experimentally unreported dynamics occur: Fission into backward and forward nondispersive pulses for the periodic case, and scattering into dispersive waves for the random case. Our findings open doors to potential applications regarding ocean coastal protection against large-amplitude waves.","References [1] W. H. Bragg and W. L. Bragg, The reflection of X-rays by crystals, Proc. R. Soc. Lond. A 88, 428 (1913). [2] P. W. Anderson, Absence of diffusion in certain random lattices, Phys. Rev. 109, 1492 (1958). [3] A. Lagendijk, B. V. Tiggelen, and D. S. Wiersma, Fifty years of Anderson localization, Phys. Today 62, 24 (2009). [4] G. Roati, C. d’Errico, L. Fallani, M. Fattori, C. Fort, M. Zaccanti, G. Modugno, M. Modugno, and M. Inguscio, Anderson localization of a non-interacting Bose-Einstein condensate, Nature 453, 895 (2008); F. Jendrzejewski, A. Bernard, K. Müller, P. Cheinet, V. Josse, M. Piraud, L. Pezzé, L. Sanchez-Palencia, A. Aspect, and P. Bouyer, Three-dimensional localization of ultracold atoms in an optical disordered potential, Nature Phys. 8, 398 (2012); S. S. Kondov, W. R. McGehee, J. J. Zirbel, and B. DeMarco, Three-dimensional Anderson localization of ultracold fermionic matter, Science 333, 66 (2011) [5] C. Hodges, Confinement of vibration by structural irregularity, J. Sound Vib. 82, 411 (1982); C. E. Bradley, Acoustic Bloch wave propagation in a periodic waveguide, Technical report (1991); H. Hu, A. Strybulevych, J. Page, S. E. Skipetrov, and B. A. Van Tiggelen, Localization of ultrasound in a three-dimensional elastic network, Nature Phys. 4, 945 (2008). [6] M. Störzer, P. Gross, C. M. Aegerter, and G. Maret, Observation of the critical regime near Anderson localization of light, Phys. Rev. Lett. 96, 063904 (2006). [7] T. Pertsch, U. Peschel, J. Kobelke, K. Schuster, H. Bartelt, S. Nolte, A. Tünnermann, and F. Lederer, Nonlinearity and Disorder in Fiber Arrays, Phys. Rev. Lett. 93, 053901 (2004) [8] Y. Lahini, A. Avidan, F. Pozzi, M. Sorel, R. Morandotti, D. N. Christodoulides, and Y. Silberberg, Anderson Localization and Nonlinearity in One-Dimensional Disordered Photonic Lattices, Phys. Rev. Lett. 100, 013906 (2008). [9] E. Akkermans and R. Maynard, Chains of random impedances, J. Phys. France 45, 1549 (1984). [10] I. Z. Rothstein, Gravitational Anderson Localization, Phys. Rev. Lett. 110, 011601 (2013). [11] Y. Sharabi, E. Lustig, and M. Segev, Disordered Photonic Time Crystals, Phys. Rev. Lett. 126, 163902 (2021). [12] B. Apffel, S. Wildeman, A. Eddi, and E. Fort, Experimental Implementation of Wave Propagation in Disordered Time-Varying Media, Phys. Rev. Lett. 128, 094503 (2022). [13] M. Belzons, P. Devillard, F. Dunlop, E. Guazzelli, O. Parodi, and B. Souillard, Localization of surface waves on a rough bottom: Theories and experiments, Europhys. Lett. (EPL) 4, 409 (1987). [14] G. Ricard, F. Novkoski, and E. Falcon, Effects of nonlinearity on Anderson localization of surface gravity waves, Nature Commun. 15, 5726 (2024). [15] A. G. Davies and A. D. Heathershaw, Surface-wave propagation over sinusoidally varying topography, J. Fluid Mech. 144, 419 (1984). [16] E. Guazzelli, V. Rey, and M. Belzons, Higher-order Bragg reflection of gravity surface waves by periodic beds, J. Fluid Mech. 245, 301 (1992). [17] M. J. McKenna, R. L. Stanley, and J. D. Maynard, Effects of Nonlinearity on Anderson Localization, Phys. Rev. Lett. 69, 1807 (1992). [18] J. Fröhlich, T. Spencer, and C. E. Wayne, Localization in disordered, nonlinear dynamical systems, J. Stat. Phys. 42, 247 (1986); C. Albanese and J. Fröhlich, Periodic solutions of some infinite-dimensional Hamiltonian systems associated with non-linear partial difference equations I, Commun. Math. Phys. 116, 475 (1988); T. Nakayama, K. Yakubo, and R. L. Orbach, Dynamical properties of fractal networks: Scaling, numerical simulations, and physical realizations, Rev. Mod. Phys. 66, 381 (1994). [19] Yu. S. Kivshar, S. A. Gredeskul, A. Sánchez, and L. Vázquez, Localization Decay Induced by Strong Nonlinearity in Disordered Systems, Phys. Rev. Lett. 64, 1693 (1990). [20] A. S. Pikovsky and D. L. Shepelyansky, Destruction of Anderson Localization by a Weak Nonlinearity, Phys. Rev. Lett. 100, 094101 (2008); A. V. Milovanov, and A. Iomin, Localization-delocalization transition on a separatrix system of nonlinear Schrödinger equation with disorder, Europhys. Lett. (EPL) 100, 10006 (2012). [21] M. V. Ivanchenko, T. V. Laptyeva, and S. Flach, Anderson Localization or Nonlinear Waves: A Matter of Probability, Phys. Rev. Lett. 107, 240602 (2011). [22] Q. Li, C. M. Soukoulis, St. Pnevmatikos, and E. N. Economou, Scattering properties of solitons in nonlinear disordered chains, Phys. Rev. B 38, 11888 (1988). [23] R. Bourbonnais and R. Maynard, Energy transport in one- and two-dimensional anharmonic lattices with isotopic disorder Phys. Rev. Lett. 64, 1397 (1990). [24] O. Nakoulima, N. Zahibo, E. Pelinovsky, T. Talipova, and A. Kurkin, Solitary wave dynamics in shallow water over periodic topography, Chaos 15, 037107 (2005). [25] V. A. Hopkins, J. Keat, G. D. Meegan, T. Zhang, and J. D. Maynard, Observation of the Predicted Behavior of Nonlinear Pulse Propagation in Disordered Media, Phys. Rev. Lett. 76, 1102 (1996). [26] R. R. Rosales and G. C. Papanicolaou, Gravity waves in a channel with a rough bottom, Stud. App. Math. 68, 89 (1983). [27] A. Nachbin and K. Sølna, Apparent diffusion due to topographic microstructure in shallow water, Phys. Fluids 15, 66 (2003) [28] C. C. Mei and Y. Li, Evolution of solitons over a randomly rough seabed, Phys. Rev. E 70, 016302 (2004). [29] J. Garnier, J. C. Muñoz Grajales, and A. Nachbin, Effective behavior of solitary waves over random topography, SIAM Multiscale Model. Simul. 6, 995 (2007). [30] I. J. Losada, M. D. Patterson, M. A. Losada, Harmonic generation past a submerged porous step, Coast. Engi. 31, 281 (1997). [31] W.-T. Chao, C.-C. Young, and C.-L. Ting, Solitary wave propagation over a submerged step: reflection, transmission, energy dissipation, and soliton fission, Proc. 24th Int. Ocean and Polar Engi. Conf. (2014); W.-T. Chao, S.-Y. Liang, C.-C. Young, and C.-L. Ting, Interactions of Solitary Wave with a Submerged Step: Experiments and Simulations, Water 9, 1302 (2021). [32] Q. Fu, A. Kurganov, M. Na, and V. Zeitlin, Birth, interactions, and evolution over topography of solitons in Serre-Green-Naghdi model, ArXiv:2405.07182 (2024). [33] F. J. Seabra-Santos, D. P. Renouard, and A. M. Temperville, Numerical and experimental study of the transformation of a solitary wave over a shelf or isolated obstacle, J. Fluid. Mech. 176, 117 (1987). [34] Y.-T. Wu, S.-C. Hsiao, Z.-C. Huang, and K.-S. Hwang, Propagation of solitary waves over a bottom-mounted barrier, Coast. Engi. 62, 31 (2012). [35] E. Pelinovsky, B. H. Choi, T. Talipova, S. B. Woo, and D. C. Kim, Solitary wave transformation on the underwater step: Asymptotic theory and numerical experiments, App. Math. Comp. 217, 1704 (2010). [36] M. A. Losada, C. Vidal, and R. Medina, Experimental study of the evolution of a solitary wave at an abrupt junction, J. Geophys. Res. 94, 14557 (1989). [37] Y. Zhang, Y. Li, H. Shao, Y. Zhong, S. Zhang, and Z. Zhao, Band gaps and localization of surface water waves over large-scale sand waves with random fluctuations, Phys. Rev. E 85, 066319 (2012). [38] E. Pelinovsky, Hydrodynamics of Tsunami Waves, Chap. in J. Grue and K. Trulsen (eds), Waves in Geophysical Fluids, CISM Intern. Cent. Mech. Sci., Vol. 489 (Springer, Vienna, 2006); S. Tadepalli and C. E. Synolakis, Model for the Leading Waves of Tsunamis, Phys. Rev. Lett. 77, 2141 (1996). [39] K. Guizien and E. Barthélémy, Accuracy of solitary wave generation by a piston wave maker, J. Hydraulic Res. 40, 321 (2002). [40] D. J. Korteweg and G. De Vries, On the change of form of long waves advancing in a rectangular canal, and on a new type of long stationary waves, Phil. Mag. 5, 422 (1895). [41] M. Remoissenet, Waves called solitons: Concepts and experiments (Springer-Verlag, Berlin, 1994); M. Peyrard and T. Dauxois, Physique des solitons (EDP Sciences, CNRS Editions, Paris, 2004) [42] E. Falcon, C. Laroche, and S. Fauve, Observation of Depression Solitary Surface Waves on a Thin Fluid Layer, Phys. Rev. Lett. 89, 204501 (2002). [43] See Supplemental Material at [URL] for (i) movies of a soliton over different bathymetries, and (ii) experimental soliton profiles and details of the KdV soliton solution. [44] I. Redor, E. Barthélémy, N. Mordant, and H. Michallet, Analysis of soliton gas with large-scale video-based wave measurements, Exp. Fluids 61, 216 (2020). [45] C. S. Gardner, J. M. Greene, M. D. Kruskal, and R. M. Miura, Method for Solving the Korteweg-deVries Equation, Phys. Rev. Lett. 19, 1095 (1967). [46] W. Chen and D. L. Mills, Gap Solitons and the Nonlinear Optical Response of Superlattices, Phys. Rev. Lett. 58, 160 (1987); O. Morsch and M. Oberthaler, Dynamics of Bose-Einstein Condensates in Optical Lattices, Rev. Mod. Phys. 78, 179 (2006). [47] P. Suret, S. Randoux, A. Gelash, D. Agafontsev, B. Doyon, and G. El, Soliton gas: Theory, numerics, and experiments, Phys. Rev. E 109, 061001 (2024). [48] C. C. Mei and M. J. Hancock, Weakly nonlinear surface waves over a random seabed, J. Fluid Mech. 475, 247 (2003); J. H. Pihl, C. C. Mei, and M. J. Hancock, Surface gravity waves over a two-dimensional random seabed, Phys. Rev. E 66, 016611 (2002); V. M. Lashkin, Dynamics of multidimensional fundamental and vortex solitons in random media, Phys. Rev. E 109, 064216 (2024)."
