URL,Title,Abstract,Introduction
https://arxiv.org/html/2411.01690v1,Co-clustering for Federated Recommender System,"As data privacy and security attract increasing attention, Federated Recommender System (FRS) offers a solution that strikes a balance between providing high-quality recommendations and preserving user privacy. However, the presence of statistical heterogeneity in FRS, commonly observed due to personalized decision-making patterns, can pose challenges. To address this issue and maximize the benefit of collaborative filtering (CF) in FRS, it is intuitive to consider clustering clients (users) as well as items into different groups and learning group-specific models. Existing methods either resort to client clustering via user representations—risking privacy leakage, or employ classical clustering strategies on item embeddings or gradients, which we found are plagued by the curse of dimensionality. In this paper, we delve into the inefficiencies of the K-Means method in client grouping, attributing failures due to the high dimensionality as well as data sparsity occurring in FRS, and propose CoFedRec, a novel Co-clustering Federated Recommendation mechanism, to address clients heterogeneity and enhance the collaborative filtering within the federated framework. Specifically, the server initially formulates an item membership from the client-provided item networks. Subsequently, clients are grouped regarding a specific item category picked from the item membership during each communication round, resulting in an intelligently aggregated group model. Meanwhile, to comprehensively capture the global inter-relationships among items, we incorporate an additional supervised contrastive learning term based on the server-side generated item membership into the local training phase for each client. Extensive experiments on four datasets are provided, which verify the effectiveness of the proposed CoFedRec. The implementation is available at https://github.com/Xinrui17/CoFedRec.","With the rapid development of e-commerce and digital services, people have become increasingly digital-centric (Lu et al., 2015). They now spend a significant amount of time online, exploring products, content, and services tailored to their interests. Traditional recommender systems (RS) (Qin et al., 2021; Adomavicius and Tuzhilin, 2005) have proven to be indispensable for e-commerce giants and various digital service providers. However, these systems usually operate by consolidating vast amounts of user data centrally, leading to potential privacy concerns. Federated learning (FL) (McMahan et al., 2017; Konečnỳ et al., 2016; Bonawitz et al., 2019) is a method where multiple clients collaboratively train a deep learning model using their local data. This decentralized approach promotes efficient information exchange and ensures that each participant’s data remains private, without being exposed to a central authority or other participants. The Federated Recommender System (FRS) (Yang et al., 2020; Wu et al., 2021) is built on this idea. FRS is a specialized implementation of FL for recommendation tasks. Instead of directly sending user interaction data to a central server, FRS processes the data locally on users’ devices and only the essential model updates are sent back to the central server for global aggregation. Unlike other applications of FL (Qayyum et al., 2022; Yang et al., 2021), where there are fewer clients and each client possesses a large amount of data from multiple individuals (known as cross-silo FL (Kairouz et al., 2021)), in FRS, each user acts as a client constituting only one single user’s profile (also known as cross-device FL (Karimireddy et al., 2021)). There is an increasing number of works (Ammad-Ud-Din et al., 2019; Lin et al., 2020a; Wu et al., 2022b) exploring solutions for FRS. A typical approach involves the utilization of FedAvg (McMahan et al., 2017) to generate a global model and then fine-tune the model on the client side (Zhang et al., 2023b). However, this single global aggregation is inherently designed for IID data. In practical scenarios, the data available on each device is generated or produced by users, usually non-IID (Ghosh et al., 2019), reflecting users’ different preferences or decision habits. To model the heterogeneity across the clients (users), there are works (Frisch et al., 2021; Luo et al., 2022; Yuan et al., 2023) that assume the whole population could be partitioned into distinct clusters or groups, characterized by analogous preferences. On the other hand, collaborative filtering (CF) (Mnih and Salakhutdinov, 2007; He et al., 2017) has proven successful in recommender systems whose power is confined in the federated setting where the entire dataset is not available. However, we can expect an increase in accuracy by finding out the neighbors of users through clustering and then gathering collaborative insights. In this light, learning a group-level model customized for each user group can boost the algorithm’s adaptability to heterogeneous clients’ data and the ability to transfer positive knowledge among clients by factoring in collaborative insights. In this paper, however, we observe that the widely deployed clustering method which groups the clients using a distance function applied to the updates uploaded by clients (Long et al., 2022; Pan et al., 2022; Sattler et al., 2020) in FL is inefficient in the FRS setting since querying neighbors of high quality is nearly impossible when the feature space is sparse. To address the challenges mentioned above, we propose a co-clustering mechanism CoFedRec for FRS to effectively group clients without accessing their profiles. The core insights come from (i) the heterogeneity across clients in FR (ii) the understanding of CF whose key idea is to predict the interests of a user by collecting preferences from many neighborhoods. Specifically, we turn to the experiment results to analyze the inherent limitations of the classical clustering strategies and introduce the co-clustering mechanism. In each communication round, the global aggregation is performed as a preliminary step to gather the global item relationship, which yields an item membership via the K-Means clustering technique upon the global item representation. The server algorithm then implements the co-clustering by computing similarity scores among clients regarding a selected item category, which allows a specific item category to cluster users into two distinct groups, the similar group, and the dissimilar group. Within the similar group, users tend to react similarly towards that type of item. All the clients in the similar group will update their item embedding network with the aggregated group model while those in the dissimilar group will retain their local model waiting for the subsequent communication rounds. In addition to the group model, the item membership will be distributed to all the clients. Inspired by the theory of Supervised Contrastive Learning (SCL) (Khosla et al., 2020), a local supervised contrastive term is integrated into the local training phase, ensuring that the locally learned item representations retain the global item insights. Our contributions are summarized as follows: • We analyze the failure of classical clustering technique K-Means in the federated recommendation setting and propose a novel co-clustering federated recommendation mechanism CoFedRec which groups users based on specific item categories within each communication round and generates an intelligent group model containing the collaborative information from the neighbors. Our proposed paradigm applies to different backbones. • We introduce a supervised contrastive term into the local training phases to encode the global item relationship in the user individual item network. This ensures that our proposed CoFedRec not only effectively leverages user collaborative information, but also seamlessly integrates global insights into the local training process. • We conduct extensive experiments on four real-world datasets with various settings, which demonstrate the effectiveness and rationality of CoFedRec."
https://arxiv.org/html/2411.01540v1,Efficient and Robust Regularized Federated Recommendation,"Recommender systems play a pivotal role across practical scenarios, showcasing remarkable capabilities in user preference modeling. However, the centralized learning paradigm predominantly used raises serious privacy concerns. The federated recommender system (FedRS) addresses this by updating models on clients, while a central server orchestrates training without accessing private data. Existing FedRS approaches, however, face unresolved challenges, including non-convex optimization, vulnerability, potential privacy leakage risk, and communication inefficiency. This paper addresses these challenges by reformulating the federated recommendation problem as a convex optimization issue, ensuring convergence to the global optimum. Based on this, we devise a novel method, RFRec, to tackle this optimization problem efficiently. In addition, we propose RFRecF, a highly efficient version that incorporates non-uniform stochastic gradient descent to improve communication efficiency. In user preference modeling, both methods learn local and global models, collaboratively learning users’ common and personalized interests under the federated learning setting. Moreover, both methods significantly enhance communication efficiency, robustness, and privacy protection, with theoretical support. Comprehensive evaluations on four benchmark datasets demonstrate RFRec and RFRecF’s superior performance compared to diverse baselines. The code is available to ease reproducibility111https://github.com/Applied-Machine-Learning-Lab/RFRec.","In recent years, recommender systems (RSs) (Resnick and Varian, 1997; Jannach et al., 2010; Naumov et al., 2019; Hu et al., 2008; Koren et al., 2009; Liu et al., 2023b; Lin et al., 2022; Zhang et al., 2023; Wang et al., 2023; Li et al., 2022, 2023a) have become prevalent in various practical scenarios, such as e-commerce, online movie or music platforms, providing personalized recommendations for users (Lu et al., 2015; Schafer et al., 1999; Celma, 2010; Liu et al., 2023d; Li et al., 2023b; Liu et al., 2023a; Lin et al., 2023). Matrix Factorization (MF)-based models (Hu et al., 2008; Koren et al., 2009; Koren, 2008; Mnih and Salakhutdinov, 2007), the most prevalent RS solutions, leverage a centralized learning paradigm that collects user data and trains the model in a central server. The centralized approach can address user preferences well and has achieved great success. However, there emerge increasing concerns from individual users about privacy issues during information storage and collection in central server (Yang et al., 2020, 2019). In response, the authorities are strengthening data privacy protection legally (Yang et al., 2019), such as issuing the General Data Protection Regulation (GDPR) (Regulation, 2018). Exploring a practical approach that can train the models without directly utilizing user data is urgent in the recommendation domain. Federated Learning (FL) (Konečnỳ et al., 2016a, b; McMahan et al., 2016) has proven its efficacy in addressing the aforementioned data-isolated problem. In contrast to the centralized learning paradigm, FL learns the optimal model by continuously communicating the model parameters or gradients between the local client (user) and central server without aggregating client data to the server. Therefore, FL is promising to be the solution to address the privacy issue in the recommendation. Recently, some efforts have been exerted to integrate the FL technique into recommender systems to address the privacy issue, named as federated recommender systems (FedRS) (Ammad-Ud-Din et al., 2019; Lin et al., 2020a; Chai et al., 2020; Muhammad et al., 2020; Lin et al., 2020b; Wu et al., 2021; Dolui et al., 2019; Sun et al., 2022). Using the same optimization formulation as centralized RS, mainstream FedRS methods (e.g., MF-based FedRS) learn the user and item latent feature vectors and utilize their inner product to predict the rating matrix. In the FL setting, the user feature vectors are updated only on the clients. In contrast, the gradients of item feature vectors are aggregated to the server for item feature matrix updating. This approach can train the recommendation model without accessing and utilizing user data, alleviating privacy concerns. However, we recognize that existing FedRS methods generally suffer from several deficiencies. 1) Non-convex Optimization: most FedRS methods solve the RS optimization problem formulated as the MF error minimization directly (Ammad-Ud-Din et al., 2019; Lin et al., 2020a; Chai et al., 2020), which is essentially non-convex. The non-convex optimization may converge to sub-optimal points, jeopardizing the recommendation performance. Moreover, constrained by the FL setting, the user and item feature vectors defined in the formulation must be updated in the client and server, respectively, which can lead to unstable model training. 2) Vulnerability: the existing methods leverage the alternating update rule, where the client and server highly depend on each other to update (Ammad-Ud-Din et al., 2019; Wu et al., 2021; Takács and Tikk, 2012). Therefore, the update process may terminate when some clients cannot participate due to network or device issues. 3) Privacy Leakage Risk: in the training process, the transmission of gradients may still lead to private information leaks (Chai et al., 2020). Specifically, knowing two continuous gradients of a user during the communication process, the server can deduce the user ratings by the algebra operation of these two gradients. Though privacy protection methods can be equipped to prevent privacy leakage, such as leveraging homomorphic encryption and generating pseudo items (Liu et al., 2023c; Chai et al., 2020; Minto et al., 2021), such methods bring considerable additional computational or communication costs. 4) Communication Inefficiency: FedRS methods have a low convergence rate due to the alternating update rule, no matter alternating least squares (ALS) (Takács and Tikk, 2012; Haldar and Hernando, 2009) or alternating stochastic gradient descent (SGD) (Bottou, 2010; Koren et al., 2009). Specifically, these methods converges to the optimal with ε𝜀\varepsilonitalic_ε-accuracy in at least O⁢(log⁡m+log⁡1ε)𝑂𝑚1𝜀O(\log m+\log\frac{1}{\varepsilon})italic_O ( roman_log italic_m + roman_log divide start_ARG 1 end_ARG start_ARG italic_ε end_ARG ) iterations (Lee and Stöger, 2023; Jain et al., 2013; Takács and Tikk, 2012), where m𝑚mitalic_m is the number of items. Hence, the number of communication rounds of existing methods is also O⁢(log⁡m+log⁡1ε)𝑂𝑚1𝜀O(\log m+\log\frac{1}{\varepsilon})italic_O ( roman_log italic_m + roman_log divide start_ARG 1 end_ARG start_ARG italic_ε end_ARG ), which is tremendous when m𝑚mitalic_m is large. In this paper, we first propose a problem formulation for FedRS and reformulate its optimization as a convex problem, which guarantees that the model converges to global optimal. As a regularized empirical risk minimization (RERM) (Marteau-Ferey et al., 2019; Zhang and Xiao, 2017), it consists of cumulative local loss (task term) and global loss (regularization term). Under the guidance of this formulation, we design two methods, namely RFRec and its faster version, RFRecF. In particular, we propose a Regularized Federated learning method for Recommendation (RFRec) to solve this RERM problem in a local GD manner. It theoretically ensures strict convergence to optimal with a linear convergence rate, which has an edge on communication efficiency. In addition, to pursue further communication efficiency, we leverage a non-uniform SGD training manner to update the task term and regularization term stochastically (RFRecF). This optimization mechanism enables RFRecF to achieve fewer expected communication rounds per iteration, thereby reducing communication costs and striking a balance between performance and efficiency. The minimum communication iterations of both methods is O⁢(log⁡1ε)𝑂1𝜀O(\log\frac{1}{\varepsilon})italic_O ( roman_log divide start_ARG 1 end_ARG start_ARG italic_ε end_ARG ), which is independent of item number m𝑚mitalic_m and achieves a remarkable reduction over existing methods. Our main contributions can be summarized as follows: • We propose a convex optimization formulation of FedRS, formulated as a regularized empirical risk minimization (RERM) problem, which can guide FedRS methods design with theoretical support for convergence and communication efficiency. • We put forward RFRec to solve the proposed RERM problem and the faster version, RFRecF, for further communication efficiency. We theoretically and experimentally prove their robustness and privacy preservation capability, and they own a guarantee of advancing communication efficiency. • Extensive experiments are conducted on four public benchmark datasets, demonstrating the state-of-the-art performance of our proposed methods against advanced baselines. We also conduct in-depth analysis to verify the efficacy and efficiency."
https://arxiv.org/html/2411.01537v1,LinRec: Linear Attention Mechanism for Long-term Sequential Recommender Systems,"Transformer models have achieved remarkable success in sequential recommender systems (SRSs). However, computing the attention matrix in traditional dot-product attention mechanisms results in a quadratic complexity with sequence lengths, leading to high computational costs for long-term sequential recommendation. Motivated by the above observation, we propose a novel L2-Normalized Linear Attention for the Transformer-based Sequential Recommender Systems (LinRec), which theoretically improves efficiency while preserving the learning capabilities of the traditional dot-product attention. Specifically, by thoroughly examining the equivalence conditions of efficient attention mechanisms, we show that LinRec possesses linear complexity while preserving the property of attention mechanisms. In addition, we reveal its latent efficiency properties by interpreting the proposed LinRec mechanism through a statistical lens. Extensive experiments are conducted based on two public benchmark datasets, demonstrating that the combination of LinRec and Transformer models achieves comparable or even superior performance than state-of-the-art Transformer-based SRS models while significantly improving time and memory efficiency. The implementation code is available online at https://github.com/Applied-Machine-Learning-Lab/LinRec.","In recent years, sequential recommender systems (SRSs) have become an increasingly popular and widely-applied technology (Wang et al., 2015; He et al., 2018; Wang et al., 2019; Huang et al., 2018; Tang et al., 2019; Chen et al., 2022; Xie et al., 2022; Qiu et al., 2022; Zhang et al., 2021), with applications in various practical scenarios such as social media, e-commerce, and online movie platforms (Liu et al., 2023b; Ge et al., 2021; Fan et al., 2021; Liu et al., 2023a; Zhao, 2022; Zhao et al., 2021a, 2019, 2018a; Ren et al., 2022). In practice, users’ historical interaction sequences are typically long-term, which contain valuable yet unequal information (i.e., different interactions’ importance), including more and less recent interactions, for revealing users’ actual preferences (Zhao et al., 2022; Zhang et al., 2020b; Zou et al., 2020; Zhang et al., 2023a; Yang et al., 2023; Zhao et al., 2020a, 2018b, 2017, b; Zhang et al., 2023b, 2022; Zheng et al., 2022). Therefore, identifying important interactions while not losing valuable information from a sequence (Wang et al., 2019; Chen et al., 2018), thus learning better sequence representation for making next-item recommendations, leads to the problem of long-term sequential recommendation. Towards this purpose, the Transformer architecture (Vaswani et al., 2017) has gained significant attention since its capabilities for learning informative long-term sequential patterns among historical user-item interactions. The core component of Transformer-based models is the dot-product attention mechanism (Vaswani et al., 2017), which computes the corresponding attention matrix for distinguishing items’ importance by a dot-product operation between the query and key matrices (Query and Key for short), thus learning sequence representations. For example, BERT4Rec (Sun et al., 2019) uses multi-head self-attention and simultaneously calculates the attention score of all positions. FDSA (Zhang et al., 2019) introduces multiple attention blocks to depict the potential features. SASRec (Kang and McAuley, 2018) controls the predictions based on only a small amount of actions by adopting an attention mechanism. However, a significant limitation of these models arises when dealing with long-term sequences, where the sequence length N𝑁Nitalic_N is far greater than the item embedding size d𝑑ditalic_d (N≫dmuch-greater-than𝑁𝑑N\gg ditalic_N ≫ italic_d). Due to the dot-product operation in the attention layer, the computational and memory complexity of transformers are 𝒪⁢(N2)𝒪superscript𝑁2\mathcal{O}(N^{2})caligraphic_O ( italic_N start_POSTSUPERSCRIPT 2 end_POSTSUPERSCRIPT ), resulting in the complexity could be dramatically increased with the problem scale (i.e., sequence lengths) for long-term sequential recommendation (Li et al., 2023, 2022; Liang et al., 2023; Zhao et al., 2023). In view of the above limitations, several approaches have been proposed to address the high computational costs of Transformer models, including Fixed Patterns (FP), Combination of Patterns (CP), Learnable Patterns (LP), Neural Memory, Low-Rank Methods, Kernels, and Recurrence (Tay et al., 2022). Some of these categories, such as FP, LP, and low-Rank, are theoretically less complex than the standard dot-product attention and have been shown to effectively reduce memory and time costs in practice (Qiu et al., 2019; Parmar et al., 2018; Wang et al., 2020b; Kitaev et al., 2020; Child et al., 2019; Beltagy et al., 2020; Wang et al., 2020a; Katharopoulos et al., 2020). Notably, there are several efficient transformer models with linear complexity, such as Linformer (Wang et al., 2020a), Linear Transformers (Katharopoulos et al., 2020), and Big Bird (Zaheer et al., 2020). However, these methods may not be well-suited for SRSs, particularly when dealing with long-term sequences, as they often introduce additional steps to improve efficiency while sacrificing accuracy and stability. For instance, to reduce the rank of the attention matrix, Linformer (Wang et al., 2020a) introduces the projection for both Query and Key, which results in additional complexity and impairs accuracy, jeopardizing recommendation performance. In this paper, we propose an efficient attention mechanism to address the issue of high complexity transformers with linear complexity, called L2-normalized Linear attention for long-term sequential Recommender systems (LinRec). Our proposed method aims to create a method for the long-term sequential recommender that not only retains the advantages of attention (such as high accuracy) but also significantly reduces the computational complexity. Additionally, LinRec can be conveniently transplanted to any transformer for sequential recommendation systems, providing flexibility and compatibility. Moreover, LinRec does not introduce additional steps, but directly enhances the attention layer to improve efficiency, preserving both effectiveness and stability. To be more specific, the proposed LinRec mechanism involves three key modifications compared to standard attention: (i) changing the dot-product order of the attention mechanism, (ii) using row-wise and column-wise normalization methods for Query (𝑸𝑸\boldsymbol{Q}bold_italic_Q) and Key (𝑲𝑲\boldsymbol{K}bold_italic_K) respectively, and (iii) adding an activation layer to 𝑸𝑸\boldsymbol{Q}bold_italic_Q and 𝑲𝑲\boldsymbol{K}bold_italic_K. These modifications enable LinRec to reduce the complexity from 𝒪⁢(N2)𝒪superscript𝑁2\mathcal{O}(N^{2})caligraphic_O ( italic_N start_POSTSUPERSCRIPT 2 end_POSTSUPERSCRIPT ) to 𝒪⁢(N)𝒪𝑁\mathcal{O}(N)caligraphic_O ( italic_N ), while still preserving the attention property and providing sparsity. The major contributions to our work are four-fold: • We develop a novel L2 normalized linear attention (LinRec) for long-term sequential recommendations, which reduces the complexity of the attention mechanism from 𝒪⁢(N2)𝒪superscript𝑁2\mathcal{O}(N^{2})caligraphic_O ( italic_N start_POSTSUPERSCRIPT 2 end_POSTSUPERSCRIPT ) to 𝒪⁢(N)𝒪𝑁\mathcal{O}(N)caligraphic_O ( italic_N ), while preserving the high accuracy of the attention mechanism; • We theoretically analyze the proposed LinRec mechanism, including its effectiveness and efficiency, justifying the correctness of our design choice. Moreover, we explain and factorize the attention operation from a statistical perspective, demonstrating the inherent relation of efficient Transformer with probabilities; • The proposed LinRec mechanism is generally applicable to most transformer models for SRSs, as it can be easily incorporated into existing transformers by replacing the standard dot-product attention, providing flexibility and compatibility; • Empirical evaluations are conducted on two public benchmark datasets (ML-1m and Gowalla), which demonstrates that LinRec possesses competitive or superior performance than representative Transformer-based SRS models, while greatly reducing computational and memory costs."
