URL,Title,Abstract,Introduction
https://arxiv.org/html/2411.02959v1,HtmlRAG: HTML is Better Than Plain Text for Modeling Retrieved Knowledge in RAG Systems,"Retrieval-Augmented Generation (RAG) has been shown to improve knowledge capabilities and alleviate the hallucination problem of LLMs. The Web is a major source of external knowledge used in RAG systems, and many commercial systems such as ChatGPT and Perplexity have used Web search engines as their major retrieval systems. Typically, such RAG systems retrieve search results, download HTML sources of the results, and then extract plain texts from the HTML sources. Plain text documents or chunks are fed into the LLMs to augment the generation. However, much of the structural and semantic information inherent in HTML, such as headings and table structures, is lost during this plain-text-based RAG process. To alleviate this problem, we propose HtmlRAG, which uses HTML instead of plain text as the format of retrieved knowledge in RAG. We believe HTML is better than plain text in modeling knowledge in external documents, and most LLMs possess robust capacities to understand HTML. However, utilizing HTML presents new challenges. HTML contains additional content such as tags, JavaScript, and CSS specifications, which bring extra input tokens and noise to the RAG system. To address this issue, we propose HTML cleaning, compression, and pruning strategies, to shorten the HTML while minimizing the loss of information. Specifically, we design a two-step block-tree-based pruning method that prunes useless HTML blocks and keeps only the relevant part of the HTML. Experiments on six QA datasets confirm the superiority of using HTML in RAG systems 111Code and datasets are available at https://github.com/plageon/HtmlRAG..","Large Language Models (LLMs) have been proven to have powerful capabilities in various natural language processing tasks (Patel et al., 2023; Ouyang et al., 2022; OpenAI, 2023). However, at the same time, LLMs show deficiencies such as forgetting long-tailed knowledge (Kotha et al., 2024), offering outdated knowledge (Amayuelas et al., 2024), and hallucination (Zhou et al., 2024c; Mallen et al., 2023; Min et al., 2023). Retrieval-augmented generation (RAG) utilizes a retrieval system to fetch external knowledge and augment the LLM. It has proved effective in mitigating hallucinations of LLMs (Zhou et al., 2024a; Ni et al., 2024). Many RAG systems, such as Perlexity (PerplexityAI, 2024) and SearchGPT (OpenAI, 2024), have been developed, and they commonly use Web search engines as the underlying retrieval systems. Figure 1. Information loss in HTML to plain text conversion. Traditional RAG pipelines typically use plain text as the format for retrieved knowledge (Wang et al., 2024c; Jin et al., 2024a). HTML documents from the Web are often converted into plain text and concatenated with the user’s query before being fed into the LLM. We found that converting HTML to plain text leads to the loss of structural and semantic information. Figure 1 illustrates that a web page containing tabular form becomes disordered when converted to plain text. Even worse, original HTML tags, such as “¡code¿” and “¡a¿”, denoting important information, are discarded during conversion. Thus, in this paper, we tend to investigate an intuitive idea: Can we take HTML as the format of external knowledge in RAG systems to preserve the information in HTML documents to a larger extent? Taking HTML as the format of external knowledge offers several advantages beyond preserving the information inherent in HTML documents. During pre-training, LLMs have encountered HTML documents (Gur et al., 2023; Groeneveld et al., 2024; Biderman et al., 2023), which means that they inherently possess the ability to understand HTML without requiring further fine-tuning (Zheng et al., 2024; Kim et al., 2023a). Recently, both proprietary and open source LLMs have begun to support increasingly longer input windows, making it feasible to input more extensive HTML documents (Zeng et al., 2024; Dong et al., 2023; Zhang et al., 2024). Furthermore, documents in Latex, PDF, and Word formats can be converted to HTML with minimal loss, expanding the potential application of HTML as the format of external knowledge (Wang et al., 2023; Bruce R. Miller, 2024; Williamson et al., 2024). However, employing HTML as the knowledge format for LLMs also presents the challenge of handling longer input sequences and noisy contexts. Our preliminary experiments show that a real HTML document from the Web contains over 80K tokens on average, among which over 90% of the tokens are CSS styles, JavaScript, Comments, or other meaningless tokens. Compared to the common maximum context window of current LLMs, which ranges from 32K to 128K, an individual document length of 80K is unacceptable. The noisy tokens. The aforementioned meaningless tokens in HTML documents can also affect the generation quality of LLMs. To solve this problem, in this paper, we devise a HTML Cleaning module to remove semantically irrelevant content in HTML documents, while keeping the main content intact. We also adjust the HTML tree structure without losing semantic information, for example, merging multiple layers of single nested HTML tags and removing empty tags. These processes reduce the length of the HTML to 6% of its original size. Even after cleaning, HTML documents remain relatively long (over 4K each) to LLMs. To shorten the input context and remove the noise contained in the original retrieved documents, existing RAG systems have utilized different types of post-retrieval result refiners (Zhou et al., 2024b; Jin et al., 2024b; Xu et al., 2024; Jiang et al., 2024). These refiners extract the relevant text chunks or key sentences from the documents, regarding the user’s query and LLMs’ preference, and discard other content. These plain-text-based refiners cannot be directly applied to HTML because simply chunking HTML without considering its structure may generate unreasonable chunks. Hence, we further design an HTML Pruning module, which functions upon the intrinsic tree structure of HTML. The pruning process is comprised of the following steps: (1) Building a Block Tree. Each HTML document can be parsed into a DOM tree (W3Schools, 2024). We do not simply prune HTML on the DOM tree because it is too finely-grained (Guo et al., 2022; Wang et al., 2022), which brings much computational cost. Instead, we propose to build a corresponding block tree, in which the original DOM tree nodes are merged into hierarchical blocks. The granularity of the block tree can be adjusted by the degree of merging. (2) Pruning Blocks based on Text Embedding. We then prune the block tree using an on-the-shelf embedding model, because it is a simple but effective way to calculate the block’s relevance scores with the user’s query based on their embedding similarity. We apply a greedy pruning algorithm that removes blocks with lower similarity scores, and gets a pruned block tree. However, we observe that the embedding model may fail to work well with the fine-grained blocks because embeddings learned for these small blocks are usually vague and inaccurate, so this pruning step is limited to coarse-grained block trees. (3) Generative Fine-grained Block Pruning. To prune the block tree further, we expand the leaf nodes of the pruned block tree and build a finer-grained block tree. Since the generative model has a longer context window, it can model the block tree globally and is not limited to modeling one block at a time. Thus we further develop a generative model to prune HTML over the fine-grained blocks. The generative model is supposed to calculate the score for each block, which is given by the generation probability of a unique sequence indicating the block. The sequence is given by the path of HTML tags, starting from the root tag and walking down to the block’s tag and text (e.g., “¡html¿¡body¿¡div¿¡p¿block content…”). Finally, according to the block scores, we apply a similar greedy pruning algorithm to get the final pruned HTML. We conduct extensive experiments on six datasets including ambiguous QA, natural QA, multi-hop QA, and long-form QA. Experimental results confirm the superiority of HTML as the format of external knowledge over plain text. Our contributions are threefold: (1) We propose to take HTML as the format of knowledge in RAG systems, which retains information of the original HTML; (2) We propose a simple but effective HTML cleaning algorithm; (3) We propose a two-stage HTML pruning algorithm. This can be applied to most RAG systems and strikes a balance between efficiency and effectiveness."
https://arxiv.org/html/2411.02790v1,Memory Augmented Cross-encoders for ControllablePersonalized Search,"Personalized search represents a problem where retrieval models condition on historical user interaction data in order to improve retrieval results. However, personalization is commonly perceived as opaque and not amenable to control by users. Further, personalization necessarily limits the space of items that users are exposed to. Therefore, prior work notes a tension between personalization and users’ ability for discovering novel items. While discovery of novel items in personalization setups may be resolved through search result diversification, these approaches do little to allow user control over personalization. Therefore, in this paper, we introduce an approach for controllable personalized search. Our model, CtrlCE presents a novel cross-encoder model augmented with an editable memory constructed from users historical items. Our proposed memory augmentation allows cross-encoder models to condition on large amounts of historical user data and supports interaction from users permitting control over personalization. Further, controllable personalization for search must account for queries which don’t require personalization, and in turn user control. For this, we introduce a calibrated mixing model which determines when personalization is necessary. This allows system designers using CtrlCE to only obtain user input for control when necessary. In multiple datasets of personalized search, we show CtrlCE to result in effective personalization as well as fulfill various key goals for controllable personalized search.","Personalized search powers several industry scale search systems for products (Aslanyan et al., 2020; Yu et al., 2021), movies (Ostuni et al., 2023), jobs (Ha-Thuc and Sinha, 2016), and web-search more broadly (Horling and Kulick, 2009). While personalization in search systems commonly increases the uptake of systems by users and improves the relevance of search results, personalization is commonly seen as opaque and failing to provide users with sufficient control over predictions (Eiband et al., 2019; Konstan and Terveen, 2021). Further, personalized ranking is more likely to prevent users from seeing the breadth of information in a document collection. Here, Chien and Danks (2023) note the tension between personalization and epistemic fairness, which ensures that all users are similarly exposed to the space of information. Similarly, Salehi et al. (2015) note that search personalization may prevent serendipitous discovery and exploration in important applications such as education. Such concerns about personalization have been addressed through two avenues. The limits to information diversity have been addressed through diversification of personalized search results (Radlinski and Dumais, 2006; Vallet and Castells, 2012). While this improves result diversity, it does little to improve user control or facilitate user-driven interaction and discovery (Ruotsalo et al., 2018). On the other hand, a small body of work has also provided users interactive control over personalized search through editable user profiles (Ahn et al., 2015; Zemede and Gao, 2017). However, this line of work has been limited to exploring simple term or entity based user profiles and has focussed on designing visualization interfaces for user control. Notably, while prior work on controllable personalization for search tasks has been limited, a larger line of work has explored control for personalized recommendation tasks (Balog et al., 2019; Konstan and Terveen, 2021). This work has shown control over personalized recommendations to improve user satisfaction and trust (Jin et al., 2017; Jannach et al., 2016). In this paper, we take inspiration from this work and extend the body of work on controllable personalized search. We introduce, CtrlCE, a controllable cross-encoder model personalized with a editable user profile for personalized search tasks. We outline the following goals for controllable personalized search: (1) to allow control, a user profile used for personalization must be transparent to users, (2) users should be able to express preferences through intuitive edits made to their user profile. Further, since search can be performed without any personalization a controllable model should make good predictions without personalization, (3) since only some queries are likely to require personalization (Ai et al., 2019; Teevan et al., 2008) a controllable model should highlight queries for which user profile edits would be meaningful, and (4) controllable personalization should not come at the expense of degraded performance. Specifically, our model to fulfill these goals is a cross-encoder augmented with a user profile realized as an editable memory constructed from historical user documents. For our editable user memory we explore two multi-vector user representations, an item level representation and a novel concept based representation introduced in recent work on controllable recommendation (Mysore et al., 2023). Both representations remain transparent to users, leverage the rich content of historical user documents, and support a intuitive set of user edits. Further, to ensure that user edits are only solicited when necessary, CtrlCE represents document relevance as a non-personalized query-document and a personalized user-document score. Then, we train a novel calibrated mixing model that in addition to intelligently combining these scores, also predicts which queries are likely to benefit from user edits to their profile (Figure 1). In experiments, we show that on four datasets of personalized search drawn from multiple domains CtrlCE outperforms standard personalization approaches based on dense retrieval as well as ensemble models, and non-personalized approaches spanning sparse, dense, and cross-encoder retrievers/re-rankers by 6.4-10.6% across evaluation metrics. Following this, we demonstrate that CtrlCE fulfills the goals of controllability through simulations and calibration evaluations. Finally, we present a case study showcasing the queries that CtrlCE highlights for user profile edits. To the best of our knowledge CtrlCE represents the first approach to controllable personalized search with performant cross-encoder models and extends the under-explored area of controllable personalized search. Code for CtrlCE will be released upon acceptance."
https://arxiv.org/html/2411.02695v1,JEL: Applying End-to-End Neural Entity Linking in JPMorgan Chase,"Knowledge Graphs have emerged as a compelling abstraction for capturing key relationship among the entities of interest to enterprises and for integrating data from heterogeneous sources. JPMorgan Chase (JPMC) is leading this trend by leveraging knowledge graphs across the organization for multiple mission critical applications such as risk assessment, fraud detection, investment advice, etc. A core problem in leveraging a knowledge graph is to link mentions (e.g., company names) that are encountered in textual sources to entities in the knowledge graph. Although several techniques exist for entity linking, they are tuned for entities that exist in Wikipedia, and fail to generalize for the entities that are of interest to an enterprise. In this paper, we propose a novel end-to-end neural entity linking model (JEL) that uses minimal context information and a margin loss to generate entity embeddings, and a Wide & Deep Learning model to match character and semantic information respectively. We show that JEL achieves the state-of-the-art performance to link mentions of company names in financial news with entities in our knowledge graph. We report on our efforts to deploy this model in the company-wide system to generate alerts in response to financial news. The methodology used for JEL is directly applicable and usable by other enterprises who need entity linking solutions for data that are unique to their respective situations.","Knowledge Graphs are being used for a wide range of applications from space, journalism, biomedicine to entertainment, network security, and pharmaceuticals. Within JP Morgan Chase (JPMC), we are leveraging knowledge graphs for financial applications such as risk management, supply chain analysis, strategy implementation, fraud detection, investment advice, etc. While leveraging a knowledge graph, Entity Linking (EL) is a central task for semantic text understanding and information extraction. As defined in many studies (Zhang et al. 2010; Eshel et al. 2017; Kolitsas, Ganea, and Hofmann 2018), in an EL task we link a potentially ambiguous Mention (such as a company name) with its corresponding Entity in a knowledge graph. EL can facilitate several knowledge graph applications, for example, the mentions of company names in the news are inherently ambiguous, and by relating such mentions with an internal knowledge graph, we can generate valuable alerts for financial analysts. In Figure 1, we show a concrete example in which the name “Lumier” has been mentioned in two different news items. “Lumier”s are two different companies in the real world, and their positive financial activities should be brought to the attention of different stakeholders. With a successful EL engine, these two mentions of “Lumier”s can be distinguished and linked to their corresponding entities in a knowledge graph. Figure 1: Example for Entity Linking Prior work on EL has been driven by a number of standard datasets, such as CoNLYAGO (Suchanek, Kasneci, and Weikum 2007), TAC KBP111https://www.ldc.upenn.edu/collaborations/current-projects/tac-kbp, DBpedia222https://wiki.dbpedia.org/develop/datasets, and ACE333https://catalog.ldc.upenn.edu/LDC2006T06. These datasets are based on Wikipedia, and are therefore, naturally coherent, well-structured and rich in context (Eshel et al. 2017). We face the following problems when we use these methods for entity linking for our internal knowledge graph: 1) Wikipedia does not cover all the entities of financial interest. For example, as of this writing, the startup “Lumier” mentioned in Figure 1 is not present in Wikipedia, but it is of high financial interest as it has raised critical investment from famous investors. 2) Lack of context information. Many pre-trained models achieve great performance by leveraging rich context data from Wikipedia (Ganea and Hofmann 2017). For JPMC internal data, we do not have information comparable to Wikipedia to support re-training or fine-tuning of existing models. To address the problems identified above, we built a novel entity linking system, JEL, to link mentions of company names in text to entities in our own knowledge graph. Our model makes the following advancements on the current state-of-the-art: 1) We do not rely on Wikipedia to generate entity embeddings. With minimum context information, we compute entity embeddings by training a Margin Loss function. 2) We deploy the Wide & Deep Learning (Cheng et al. 2016) to match character and semantic information respectively. Unlike other deep learning models (Martins, Marinho, and Martins 2019; Kolitsas, Ganea, and Hofmann 2018; Ganea and Hofmann 2017), JEL applies a simple linear layer to learn character patterns, making the model more efficient both in the training phase and inference phase."
https://arxiv.org/html/2411.02692v1,JPEC: A Novel Graph Neural Network for Competitor Retrieval in Financial Knowledge Graphs,"Knowledge graphs have gained popularity for their ability to organize and analyze complex data effectively. When combined with graph embedding techniques, such as graph neural networks (GNNs), knowledge graphs become a potent tool in providing valuable insights. This study explores the application of graph embedding in identifying competitors from a financial knowledge graph. Existing state-of-the-art(SOTA) models face challenges due to the unique attributes of our knowledge graph, including directed and undirected relationships, attributed nodes, and minimal annotated competitor connections. To address these challenges, we propose a novel graph embedding model, JPEC(JPMorgan Proximity Embedding for Competitor Detection), which utilizes graph neural network to learn from both first-order and second-order node proximity together with vital features for competitor retrieval. JPEC had outperformed most existing models in extensive experiments, showcasing its effectiveness in competitor retrieval.","Competitor retrieval is one of the most crucial use cases for financial organizations. Traditionally, it is mostly driven by multiple manual tasks involving collecting data and converting factors like revenue, products, pricing, marketing, and industry distributions. While manually gathered market data offer vital insights, they have limitations in terms of applicability and scalability. On the other hand, knowledge graphs can provide competitive clues by revealing meaningful connections, such supply-chain, between companies. Combined with graph embedding techniques, knowledge graphs can offer a structured and efficient approach for automatic and intelligent competitor retrieval. However, most SOTA graph embedding methods are sub-optimal for our task due to the complex structure of a real world knowledge graph(described in Section2). This paper introduces a novel graph neural network, JPEC, for competitor detection from a financial knowledge graph with various types of edges but limited labeled data."
