URL,Title,Abstract,Introduction
https://arxiv.org/html/2411.04677v1,Lightning IR: Straightforward Fine-tuning and Inference of Transformer-based Language Models for Information Retrieval,"A wide range of transformer-based language models have been proposed for information retrieval tasks. However, fine-tuning and inference of these models is often complex and requires substantial engineering effort. This paper introduces Lightning IR, a PyTorch Lightning-based framework for fine-tuning and inference of transformer-based language models for information retrieval. Lightning IR provides a modular and extensible architecture that supports all stages of an information retrieval pipeline: from fine-tuning and indexing to searching and re-ranking. It is designed to be straightforward to use, scalable, and reproducible. Lightning IR is available as open-source: https://github.com/webis-de/lightning-ir.","Pre-trained transformer-based language models have become a cornerstone in information retrieval (IR) research (Lin et al., 2022). Many different architectures have been proposed, each with their own model implementation and training procedure. This plethora makes fine-tuning different model architectures cumbersome and comparing different model architectures even more so. However, all these models use the same basic building blocks, can be fine-tuned in the same way, and have only minor differences in their inference procedure. To unify the usage of transformer-based language models in IR we present the Lightning IR framework. Lightning IR builds on and extends PyTorch Lightning (Falcon and team, 2024) to provide several key features that set it apart from existing libraries for neural IR: (1) It is backbone agnostic, i.e., (almost) any HuggingFace (Wolf et al., 2020) transformer-based language model can be used. (2) It supports the entire pipeline of IR models, from fine-tuning and indexing to searching and re-ranking. (3) It is flexible and supports, for example, multi-vector or sparse bi-encoder models and pointwise or listwise cross-encoder models out-of-the-box. (4) It provides an easy-to-use API and CLI for fine-tuning and inference. (5) It is easily configurable, allowing for reproducible experiments and easy model comparison. In this paper, we compare Lightining IR to existing frameworks, we describe its features and API, and we demonstrate Lightning IR’s capabilities in a series of reproducibility experiments."
https://arxiv.org/html/2411.04602v1,Self-Calibrated Listwise Reranking with Large Language Models,"Large language models (LLMs), with advanced linguistic capabilities, have been employed in reranking tasks through a sequence-to-sequence approach. In this paradigm, multiple passages are reranked in a listwise manner and a textual reranked permutation is generated. However, due to the limited context window of LLMs, this reranking paradigm requires a sliding window strategy to iteratively handle larger candidate sets. This not only increases computational costs but also restricts the LLM from fully capturing all the comparison information for all candidates. To address these challenges, we propose a novel self-calibrated listwise reranking method, which aims to leverage LLMs to produce global relevance scores for ranking. To achieve it, we first propose the relevance-aware listwise reranking framework, which incorporates explicit list-view relevance scores to improve reranking efficiency and enable global comparison across the entire candidate set. Second, to ensure the comparability of the computed scores, we propose self-calibrated training that uses point-view relevance assessments generated internally by the LLM itself to calibrate the list-view relevance assessments. Extensive experiments and comprehensive analysis on the BEIR benchmark and TREC Deep Learning Tracks demonstrate the effectiveness and efficiency of our proposed method.","Text reranking is a fundamental task in the information retrieval (IR) area focusing on scoring and reranking a set of retrieved text candidates (e.g., passages and documents) on the input query (Zhao et al., 2022). In the real world, text reranking is generally an important intermediate stage in the widely used IR pipeline, underpinning numerous downstream tasks, such as question answering (Mao et al., 2021) and dialogue systems (Won et al., 2023). Concretely, this task aims to measure the semantic relevance of each text candidate with the input query, and then ranks all candidates in order of that (Nogueira and Cho, 2019; Zhuang et al., 2023). In recent years, with the exceptional problem-solving capabilities of large language models (LLMs) (Zhao et al., 2023), existing work has applied LLMs to the text reranking tasks (Sun et al., 2023; Zhuang et al., 2024b; Ma et al., 2024). Instead of individually computing the relevance score for all query-candidate pairs, LLM-based methods are capable of directly generating the permutation of reranked candidates in an autoregressive manner (Ma et al., 2023; Reddy et al., 2024). Such a listwise paradigm enables efficient one-pass reranking for all candidates, and can also leverage the strong generation capability of LLMs, achieving remarkable performance. Despite the success, limited by the input window length of LLMs, it is hard to apply listwise LLM-based rerankers into a large candidate set or long documents. Although existing work has proposed the sliding window strategy (Pradeep et al., 2023a, b) that splits the candidate set for multi-round ranking, the increased computational cost is also higher for real-world applications. Moreover, the sliding window strategy would cause only part of the whole candidate set to be ranked by LLM at the same time. As a result, the global ranking process will degrade into local ranking within the window, which not only restricts LLMs from fully comparing all candidates but also leads to potential risks of the influence from the initial input order. Considering these limitations, several efforts are made to optimize the sliding window strategy (Yoon et al., 2024; Parry et al., 2024) or the autoregressive generative reranking paradigm (Reddy et al., 2024). Nevertheless, as they rely on LLMs for language generation (ranked permutation), the shortcomings in efficiency and effectiveness are still hard to fully resolve. Figure 1. Illustration of the comparison between our proposed SCaLR and the typical listwise reranking approach based on eight candidates. In this paper, we aim to propose a novel method to enable LLMs to efficiently and effectively perform listwise reranking, as shown in Figure 1. Given the whole candidate set, our motivation is to explicitly compute the list-view relevance scores for the listwise input, instead of directly producing the textual reranking results via LLMs. In this way, the list-view relevance scores can be used for a global ranking of all candidates (in the same window or not), which breaks the shortcomings caused by the in-window local comparison. To assess the relevance, we add a projection layer into the decoder-only LLM, to map the last token representations of the candidate text into the score. For the given in-window candidates, we can obtain their relevance scores and utilize ranking objectives for training. However, the ranking objectives mainly focus on learning the comparison of all candidates, which would lead to biased scores that affect the global ranking performance, especially for the top or bottom candidates (with extreme scores of 1 or 0). To address it, we propose self-calibrated training that adjusts the list-view relevance score to better align with the self-generated point-view relevance score. The point-view relevance score is generated solely based on the query and a single candidate, which is relatively fair and provides a regularization for reducing the bias. In this way, we can make use of two views of relevance scores for supervising the training process. The list-view scores provide rich comparison information, and the point-view scores calibrate the possible bias in the list-view ones, both ensuring the global comparability of the relevance score. To this end, we design a Self-Calibrated Listwise Reranking method, termed SCaLR. First, we devise the relevance-aware listwise reranking framework by revising the autoregressive generation process of LLMs. Concretely, we add corresponding projection layers for generating list-view relevance scores. To reduce the computational cost, we design a special mask mechanism to guarantee that the list-view relevance scores can be computed by a one-pass encoding process (Zelikman et al., 2024). Based on this, we introduce the parallel context encoding into the decoder-only LLM architecture, enabling independent encoding of candidates to generate the point-view relevance scores. Second, we propose the self-calibration training strategy that aligns the list-view relevance score with the point-view relevance score. Specifically, we employ the multi-task learning framework to learn both list-view and point-view relevance scores, and propose an adaptive optimization strategy to consider the reliability of the point-view scores during calibration. Our main contributions are summarized as follows: • We propose a novel listwise reranking framework SCaLR based on explicit list-view relevance for ranking, which enhances the model efficiency while addressing the limitation of window-based local ranking strategies. • We employ parallel context encoding for accelerating candidate modeling and utilize self-generated point-view relevance to calibrate the list-view relevance, ensuring global comparability for evaluating on large candidate set. • Extensive experiments and analyses on the BEIR and TREC benchmarks demonstrate the superiority of the proposed approach from in-domain and out-of-domain evaluation over state-of-the-art methods."
https://arxiv.org/html/2411.04539v1,Best Practices for Distilling Large Language Models into BERT for Web Search Ranking,"Recent studies have highlighted the significant potential of Large Language Models (LLMs) as zero-shot relevance rankers. These methods predominantly utilize prompt learning to assess the relevance between queries and documents by generating a ranked list of potential documents. Despite their promise, the substantial costs associated with LLMs pose a significant challenge for their direct implementation in commercial search systems. To overcome this barrier and fully exploit the capabilities of LLMs for text ranking, we explore techniques to transfer the ranking expertise of LLMs to a more compact model similar to BERT, using a ranking loss to enable the deployment of less resource-intensive models. Specifically, we enhance the training of LLMs through Continued Pre-Training, taking the query as input and the clicked title and summary as output. We then proceed with supervised fine-tuning of the LLM using a rank loss, assigning the final token as a representative of the entire sentence. Given the inherent characteristics of autoregressive language models, only the final token </s> can encapsulate all preceding tokens. Additionally, we introduce a hybrid point-wise and margin MSE loss to transfer the ranking knowledge from LLMs to smaller models like BERT. This method creates a viable solution for environments with strict resource constraints. Both offline and online evaluations have confirmed the efficacy of our approach, and our model has been successfully integrated into a commercial web search engine as of February 2024.","Relevance ranking is a paramount challenge in web search systems. The objective of relevance ranking is to rank candidate documents based on their pertinence to a specified inquiry. These documents are usually culled from an extensive corpus by a retrieval module. Of late, the integration of pre-trained language models (PLMs) such as BERTDevlin et al. (2018), along with industry giants like Google111https://blog.google/products/search/search-language-understanding-bert/, Bing222https://azure.microsoft.com/en-us/blog/bing-delivers-its-largest-improvement-in-search-experience-using-azure-gpus/, and BaiduZou et al. (2021); Liu et al. (2021), has been massively adopted within industry web search systems, yielding commendable resultsZhuang et al. (2023). BERT models are adept at considering the entire context of a word by examining adjacent words, which is particularly beneficial for discerning the intent of search queries. The efficacy of IR dictates the system’s response time to inquiries of users, which predominantly contingent on the performance of ranking model The recent triumphs LLMsBrown et al. (2020) in natural language processing have ignited interest in their application to text ranking. Researchers have delved into prompting LLMs to undertake zero-shot unsupervised ranking employing pointwiseWang et al. (2023); Sachan et al. (2023), pairwiseSachan et al. (2022), or listwise approachesSun et al. (2023b). Although these have made notable strides, they have yet to fully harness the potential of LLMs. Moreover, there have been initiatives to train pointwise rankers in supervised settings, utilizing LLMs, as exemplified by RankLLaMAMa et al. (2023a). Despite the SOTA performance yielded by LLM rank models in experimental settings, their direct application in real-world search engines is impractical. Figure 1: The overview of Rank Distillation from LLM Decoder to BERT Encoder. To overcome the challenges of deploying LLMs online, this paper introduces a novel Rank Distillation framework (DisRanker) that combines the capabilities of LLMs with the agility of BERT. Distillation is renowned for enhancing the efficiency of various neural ranking modelsHofstätter et al. (2020). Simultaneously, knowledge distillation facilitates the transfer of discerning skills from the teacher model to more compact models, significantly reducing computational costs during online inference. Initially, we utilize clickstream data to propagate domain knowledge through Continued Pre-Training (CPT)Gupta et al. (2023), using queries as inputs to generate titles and summaries that have captured user interest. In a process similar to question-answering, the LLM develops a detailed understanding of the interaction between queries and documents. We then refine the LLM using a pairwise rank loss, employing the end-of-sequence token, </s>, to represent query-document pairs. While previous research on neural rank models primarily used a bidirectional encoder-only model like BERT, interpreting the [CLS] token as a comprehensive representation of the text input, the autoregressive nature of LLMs prompts us to introduce an end-of-sequence token for the input query and document to structure the input sequence. The latent state from the final layer corresponding to this token is considered the embodiment of the query and document relationship. Consequently, we integrate a dense layer to act as a relevance adjudicator, applying pairwise rank loss to fine-tune the LLM. The deployment of LLMs for ranking tasks still faces practical challenges, particularly regarding application efficacy and output consistency. In the next phase, we employ a hybrid approach using Point-MSEQin et al. (2021) and Margin-MSEHofstätter et al. (2020) losses to distill the LLM. Point-MSE calculates the absolute difference between the LLM teacher and the BERT student, while Margin-MSE introduces a form of regularization and encourages the student model to learn the relative ranking from the teacher. This approach prevents overfitting by not requiring the student model to exactly match the teacher’s scores but to maintain the order of the scores, which is essential for ranking tasks. Thus, the student model learns to emulate the teacher’s ranking behavior while being more lightweight and efficient, making it better suited for deployment in resource-constrained environments. The main contributions of this paper can be summarized as follows: • We present DisRanker, a novel Rank Distillation pipeline that seamlessly integrates LLM with BERT to enhance web search ranking. A comprehensive suite of offline and online evaluations substantiates the efficacy of DisRanker. • We propose a domain-specific continued pre-training methods which is beneficial for enhancing the performance of LLMs on text ranking tasks. Additionally, we contribute a hybrid approach that employs Point-MSE and Margin-MSE loss to refine the distillation of LLM."
https://arxiv.org/html/2411.04403v1,Towards Competitive Search Relevance For Inference-Free Learned Sparse Retrievers,"Learned sparse retrieval, which can efficiently perform retrieval through mature inverted-index engines, has garnered growing attention in recent years. Particularly, the inference-free sparse retrievers are attractive as they eliminate online model inference in the retrieval phase thereby avoids huge computational cost, offering reasonable throughput and latency. However, even the state-of-the-art (SOTA) inference-free sparse models lag far behind in terms of search relevance when compared to both sparse and dense siamese models. Towards competitive search relevance for inference-free sparse retrievers, we argue that they deserve dedicated training methods other than using same ones with siamese encoders. In this paper, we propose two different approaches for performance improvement. First, we introduce the IDF-aware FLOPS loss, which introduces Inverted Document Frequency (IDF) to the sparsification of representations. We find that it mitigates the negative impact of the FLOPS regularization on search relevance, allowing the model to achieve a better balance between accuracy and efficiency. Moreover, we propose a heterogeneous ensemble knowledge distillation framework that combines siamese dense and sparse retrievers to generate supervisory signals during the pre-training phase. The ensemble framework of dense and sparse retriever capitalizes on their strengths respectively, providing a strong upper bound for knowledge distillation. To concur the diverse feedback from heterogeneous supervisors, we normalize and then aggregate the outputs of the teacher models to eliminate score scale differences. On the BEIR benchmark, our model outperforms existing SOTA inference-free sparse model by 3.3 NDCG@10 score. It exhibits search relevance comparable to siamese sparse retrievers and client-side latency only 1.1x that of BM25.","Information retrieval(IR) and question answering(QA) are fundamental tasks in the realm of information processing, widely employed in various web applications. Lexical-based algorithms such as TF-IDF and BM25 were once the dominant approach. These algorithms utilize inverted indexes, which was proven to be efficient. However, due to issues such as vocabulary mismatch (Zhao and Callan, 2010) and the lack of contextual information, their semantic retrieval capabilities are limited. In contrast, siamese dense retrievers have overcome the limitations of traditional lexical-based methods and have become the mainstream approach for semantic retrieval (Reimers and Gurevych, 2019). Nonetheless, the ANN algorithm requires a substantial amount of memory leading to a significant trade-off between search relevance and resource consumption (Malkov and Yashunin, 2018; Jegou et al., 2010). The interpretability of dense retrievers is also questioned. Recent years, learned sparse retrieval is proposed to address this obstacle and gained increasing attention (Dai and Callan, 2020; Formal et al., 2021b, a). This approach predicts token weights based on their semantics with context information. It expands token set with generative models (Nogueira et al., [n. d.], 2019) or masked language model heads (Bai et al., 2020; Zhao et al., 2021; Formal et al., 2021b, a, 2022; Lassance and Clinchant, 2022; MacAvaney et al., 2020; Lassance et al., 2024), thereby addressing the vocabulary mismatch problem. Since sparse embeddings can be integrated with inverted indexes, the retrieval process of learned sparse models is highly efficient without compromising recall. Moreover, learned sparse retrieval offers better interpretability because the contribution of each token can be intuitively understood by human. Among the learned sparse models, the inference-free architecture is particularly attractive to search applications. This architecture degenerates online model inference for query encoding into simple tokenization, significantly reducing end-to-end search latency and the associated model deployment costs. Early work like DEEPCT (Dai and Callan, 2020) and Doc2Query (Nogueira et al., [n. d.]) attempted to associate additional information with the original documents. However, search relevance could not be trained in an end-to-end manner. Proposed by Formal et al. (2021a), the SPLADE-doc architecture has achieved SOTA performance among inference-free retrievers. It predicts the token weights and expands the tokens with similar semantics. The search relevance and sparsity are tuned via end-to-end training. However, even the latest SOTA inference-free model, SPLADE-v3-Doc (Lassance et al., 2024), exhibits a significant gap in search relevance when compared with siamese sparse retrievers. On the BEIR benchmark, the average NDCG@10 score of SPLADE-v3-Doc is 4.7 lower than siamese sparse retrievers of the same size and training method. This disparity hinders its application in actual production environments. In this paper, we focus on improving the search relevance of the inference-free sparse retriever through more effective training methodologies. The first challenge lies in the uniform penalty applied to all tokens by the FLOPS regularization (Paria et al., 2020). The purpose of the FLOPS loss is to eliminate unnecessary tokens to sparsify the document representation. However, the uniform penalty from FLOPS loss has a side effect: it prevents the model from assigning tokens with large weights. Consequently, for semantically rich tokens that are important to be retained in the representation, their importance will be underestimated. To mitigate this effect, we propose a simple yet effective enhancement called IDF-aware FLOPS. This loss adjusts the penalty imposed by the FLOPS loss on different tokens, making the penalty inversely proportional to the token’s IDF value. It reduces the regularization penalty on unique tokens and increases the penalty on frequent tokens. Through experiments, we demonstrate that IDF-aware FLOPS effectively improves the search relevance of the inference-free sparse retriever, and we discover that it effectively reduces the average FLOPS number for the retrieval process. Subsequently, the pre-training phase is also explored in this paper. We argue that although the commonly used contrastive InfoNCE loss (Chen et al., 2020) is able to enhance the alignment and uniformity of representations (Wang and Isola, 2020), these two targets are not applicable in inference-free models. Because for inference-free models, all semantics are only encoded at the model-side. And the search relevance can not be improved by aligning the document representation with the bag-of-word query representation. In contrast, knowledge distillation presents a more suitable approach for the training (Formal et al., 2021a). Hofstätter et al. (2020) proposed to train dense retrievers by conducting knowledge distillation from cross-encoder rerankers, and Formal et al. (2022, 2021a) applied this method to the fine-tuning of sparse retrievers. However, for large-scale pre-training datasets, the inference workload of the teacher model can reach 10 times or even larger. And the inference cost of cross-encoders is impractical at these settings, especially when in-batch negatives are utilized. In this paper, we propose to build a strong teacher model by assembling siamese dense retrievers and siamese sparse retrievers. Siamese retrievers have a heterogeneous and superior architecture compared with the inference-free architecture. And their inference cost is applicable for large-scale pre-training. Moreover, the ensemble of dense and sparse retrievers can further enhance the upper bound of knowledge distillation, enlarging the space for performance improvement of our model. During the assembling process, we normalize the scores for heterogeneous retrievers. This prevents one retriever from dominating the assembled result, further balancing the contribution of teacher models. We conduct experiments on 13 public datasets from the BEIR benchmark, and our model outperforms the existing SOTA inference-free sparse model by 3.3 average NDCG@10 scores. Its performance even surpasses many strong siamese retrievers. Our contributions can be summarized as follows: (1) We propose IDF-aware FLOPS, which effectively improves the search relevance and efficiency of inference-free sparse models. (2) We explore how to effectively pre-train inference-free sparse models and propose the ensemble teacher model of heterogeneous siamese models, which has reasonable inference costs and strong performance. (3) The zero-shot performance of our model outperforms the SOTA inference-free retriever by 3.3 NDCG@10 score. It also surpasses strong siamese retrievers including SPLADE-v3-DistilBERT and ColBERTv2. While its client-side latency is only 1.1x that of BM25."
